2019-11-17T17:06:17.000Z,b'ERC-20 tokens are designed and used solely on the Ethereum platform. They follow a list of standards so that they c\xe2\x80\xa6 https://t.co/HiBwkVpzmx',ERC 20 tokens are designed and used solely on the Ethereum platform They follow a list of standards so that they c xe2 x80 xa6
2019-11-17T17:06:24.000Z,b'Competition is usually so much that users have a lot of options and they switch patronage immediately they experien\xe2\x80\xa6 https://t.co/0ABdu6iQRn',Competition is usually so much that users have a lot of options and they switch patronage immediately they experien xe2 x80 xa6
2019-11-17T17:06:33.000Z,b'If life could only be like this #Bitcoin  https://t.co/FZAxBTeSTd',If life could only e like this Bitcoin
2019-11-17T17:06:48.000Z,"b'The USA IRS has started checking #Bitcoin ATM. Today, the number of #cryptomats in 75 countries has grown to 6000 u\\xe2\\x80\\xa6 https://t.co/EuCSwFWQvZ'",The USA IRS has started checking Bitcoin ATM Today the numer of cryptomats in 75 countries has grown to 6000 u xe2 x80 xa6
2019-11-17T17:07:13.000Z,b'The very latest #bitcoin news analysis from over 150 global news sources in real time every hour 24*7*365 \n\n#BTCUSD\xe2\x80\xa6 https://t.co/qTFjZUjfBV',The very latest itcoin news analysis from over 150 gloal news sources in real time every hour 24 7 365 n n BTCUSD xe2 x80 xa6
2019-11-17T17:07:19.000Z,b'#KLGYO  60 dk #bmkototrend #usdtry #eurtry #XU100 #btc #btcusd #bitcoin #crypto #bist30 #bist100 #viop30 #varant\xe2\x80\xa6 https://t.co/rFD9yQwUUx',KLGYO 60 dk mkototrend usdtry eurtry XU100 tc tcusd itcoin crypto ist30 ist100 viop30 varant xe2 x80 xa6
2019-11-17T17:07:22.000Z,"b'The SFC of #Hongkong has released framework on the regulation of #virtualasset trading platforms. From 6 Nov, platf\\xe2\\x80\\xa6 https://t.co/NihXHMPmHU'",The SFC of Hongkong has released framework on the regulation of virtualasset trading platforms From 6 Nov platf xe2 x80 xa6
2019-11-17T17:07:33.000Z,"b'Donde el gobierno dice #Petro, los venezolanos dicen #Bitcoin\\n#BTC #PTR\\nhttps://t.co/goPUf3KdS4'",Donde el goierno dice Petro los venezolanos dicen Bitcoin n BTC PTR
2019-11-17T17:07:40.000Z,b'Crypto News From the Spanish-Speaking World: Nov. 10\xe2\x80\x9316 in Review https://t.co/YKY2iIiCdv #Bitcoin',Crypto News From the Spanish Speaking World Nov 10 xe2 x80 x9316 in Review Bitcoin
2019-11-17T17:07:57.000Z,b'@OurielOhayon you can read more here: https://t.co/XmWALnZTSP\n\n#Zango #cryptowallet #Bitcoin',you can read more here cryptowallet Bitcoin
2019-11-17T17:07:59.000Z,b'Hello #Libra \xe2\x9a\xa1\xef\xb8\x8f\xe2\x9a\xa1\xef\xb8\x8f\xe2\x9a\xa1\xef\xb8\x8f\n#VET #veChain #Finance #Cryptocurrency #Bitcoin #BitcoinCash #EOS #Stellar #Litecoin #Monero\xe2\x80\xa6 https://t.co/BqrEAhwddq',Hello Lira xe2 x9a xa1 xef x8 x8f xe2 x9a xa1 xef x8 x8f xe2 x9a xa1 xef x8 x8f n VET veChain Finance Cryptocurrency Bitcoin BitcoinCash EOS Stellar Litecoin Monero xe2 x80 xa6
2019-11-17T17:08:04.000Z,b'How blockchain could help combat deepfakes\n#Bitcoin #Crypto #Cryptocurrency #October1st #HereWeGo\nhttps://t.co/xyBKVUjFi5',How lockchain could help comat deepfakes n Bitcoin Crypto Cryptocurrency Octoer1st HereWeGo
2019-11-17T17:08:12.000Z,b'\xe4\xbb\xae\xe6\x83\xb3\xe9\x80\x9a\xe8\xb2\xa8\xe3\x83\x9e\xe3\x82\xa4\xe3\x83\x8b\xe3\x83\xb3\xe3\x82\xb0\xe3\x81\xaa\xe3\x82\x89\xe3\x80\x80genesis mining \xe3\x82\xaf\xe3\x83\xbc\xe3\x83\x9d\xe3\x83\xb3\xe3\x82\xb3\xe3\x83\xbc\xe3\x83\x89:1Wksut #bitcoin #mining',xe4 x xae xe6 x83 x3 xe9 x80 x9a xe8 x2 xa8 xe3 x83 x9e xe3 x82 xa4 xe3 x83 x8 xe3 x83 x3 xe3 x82 x0 xe3 x81 xaa xe3 x82 x89 xe3 x80 x80genesis mining xe3 x82 xaf xe3 x83 xc xe3 x83 x9d xe3 x83 x3 xe3 x82 x3 xe3 x83 xc xe3 x83 x89 1Wksut itcoin mining
2019-11-17T17:08:36.000Z,b'@nebraskangooner Have very much point area Until to 6700 $ no nee do speculation sharing about this. Can go to up t\xe2\x80\xa6 https://t.co/9oObdT5e3d',Have very much point area Until to 6700 no nee do speculation sharing aout this Can go to up t xe2 x80 xa6
2019-11-17T17:08:38.000Z,b'Good Luck with your new version  @ZenGo! \xf0\x9f\x86\x95\xf0\x9f\x93\xb1\xf0\x9f\x91\x9b https://t.co/Tx6qeDGg5o #bitcoin #BTC $BTC #blockchain #MobileApp #Ethereum #ETH $ETH #BNB $BNB',Good Luck with your new version xf0 x9f x86 x95 xf0 x9f x93 x1 xf0 x9f x91 x9 itcoin BTC BTC lockchain MoileApp Ethereum ETH ETH BNB BNB
2019-11-17T17:08:59.000Z,"b'For those that prefer text, thanks to @delans for this searchable transcript of a recent interview discussing #EOS\\xe2\\x80\\xa6 https://t.co/sozEdizFGA'",For those that prefer text thanks to for this searchale transcript of a recent interview discussing EOS xe2 x80 xa6
2019-11-17T17:09:10.000Z,b'Curso de #Inversionista Experto - #DarbyAcademy Trading #Forex #Bitcoin #Brexit por @DarbyAcademy_ https://t.co/R94MkYuLIS',Curso de Inversionista Experto DaryAcademy Trading Forex Bitcoin Brexit por
2019-11-17T17:09:21.000Z,b'#BITCOIN is testing the bottom of my curved channel for WEEKS already\xf0\x9f\xa7\x90pls be ready frens\xf0\x9f\x8c\x9b\xf0\x9f\x8c\x9b https://t.co/m0rf2qf7rb',BITCOIN is testing the ottom of my curved channel for WEEKS already xf0 x9f xa7 x90pls e ready frens xf0 x9f x8c x9 xf0 x9f x8c x9
2019-11-17T17:09:21.000Z,b'https://t.co/wqX7mNIWUU #EMJ #IEO #Crypto #Blockchain #ethereum #bitcoin #ether #cryptocurrency #tokensale https://t.co/q01BTsabYL',EMJ IEO Crypto Blockchain ethereum itcoin ether cryptocurrency tokensale
2019-11-17T17:09:28.000Z,b'Technical Analysis and Market Entry: #bitcoin Price Behaviour Points to Another Looming Drop  Hacked: Hacking Finan\xe2\x80\xa6 https://t.co/bYYwQYhqpF',Technical Analysis and Market Entry itcoin Price Behaviour Points to Another Looming Drop Hacked Hacking Finan xe2 x80 xa6
2019-11-17T17:09:28.000Z,b'\xf0\x9f\x98\x8bHEY GUYS \nThe number of #bitcoin ATMs installed worldwide has passed yet another milestone. Data from the CoinATMR\xe2\x80\xa6 https://t.co/PdeXtxF8P6',xf0 x9f x98 x8HEY GUYS nThe numer of itcoin ATMs installed worldwide has passed yet another milestone Data from the CoinATMR xe2 x80 xa6
2019-11-17T17:09:32.000Z,b'$spnd / $btc\n\nSimplified the chart.\n\nLooks like 32sat level is being tested quite a bit. If we close below this tre\xe2\x80\xa6 https://t.co/yAY0u2FsBE',spnd tc n nSimplified the chart n nLooks like 32sat level is eing tested quite a it If we close elow this tre xe2 x80 xa6
2019-11-17T17:09:34.000Z,b'#17Nov 12:09 Precio del #Bitcoin:\nBitcoin COP: 27570636.52\nBitcoin USD: 8911.00\nTasa Cambio BTC: 3094.00\nFuente:\xe2\x80\xa6 https://t.co/Rq4A3epY67',17Nov 12 09 Precio del Bitcoin nBitcoin COP 27570636 52 nBitcoin USD 8911 00 nTasa Camio BTC 3094 00 nFuente xe2 x80 xa6
2019-11-17T17:09:49.000Z,b'Online Slot Gaming Platforms There are plenty of different online gaming platforms offering a wide range of casino\xe2\x80\xa6 https://t.co/LOZAAPzDWI',Online Slot Gaming Platforms There are plenty of different online gaming platforms offering a wide range of casino xe2 x80 xa6
2019-11-17T17:09:50.000Z,b'Breakout happening right now for $ada.\n\n#ada #cardano #bitcoin #cryptocurrency https://t.co/LZpIBligzJ',Breakout happening right now for ada n n ada cardano itcoin cryptocurrency
2019-11-17T17:10:00.000Z,b'La participaci\xc3\xb3n de Venezuela en el criptomercado https://t.co/COPFdLRXeL #Criptomonedas #Bitcoin #BTC #PetroCoin\xe2\x80\xa6 https://t.co/t1XUgaX9UC',La participaci xc3 x3n de Venezuela en el criptomercado Criptomonedas Bitcoin BTC PetroCoin xe2 x80 xa6
2019-11-17T17:10:02.000Z,"b'Top 5 #cryptocurrencies \\n Alert Time: 2019-11-17 20:10:02\\n#Bitcoin: $8,653.244\\n#Ethereum: $186.996\\n#XRP: $0.268\\xe2\\x80\\xa6 https://t.co/URQMcQ90zS'",Top 5 cryptocurrencies n Alert Time 2019 11 17 20 10 02 n Bitcoin 8 653 244 n Ethereum 186 996 n XRP 0 268 xe2 x80 xa6
2019-11-17T17:10:05.000Z,"b'Bitcoin BTC Current Price:\\n$8,647.93\\n1 Hour: 0.53 % | 24 Hours: 0.99 % | 7 Days: -3.56 %\\n#btc #bitcoin'",Bitcoin BTC Current Price n 8 647 93 n1 Hour 0 53 24 Hours 0 99 7 Days 3 56 n tc itcoin
2019-11-17T17:10:14.000Z,b'1 BTC Price: Bitstamp 8539.14 USD Coinbase  USD #btc #bitcoin 2019-11-17 12:10 https://t.co/g2pK2j4UD2',1 BTC Price Bitstamp 8539 14 USD Coinase USD tc itcoin 2019 11 17 12 10
2019-11-17T17:10:54.000Z,b'\xe6\x97\xa5\xe6\x9c\xac\xe3\x81\x8c\xe3\x81\xa9\xe3\x82\x8c\xe3\x81\xa0\xe3\x81\x91\xe3\x81\xae\xe5\x80\x9f\xe9\x87\x91\xe3\x82\x92\xe8\x83\x8c\xe8\xb2\xa0\xe3\x81\xa3\xe3\x81\xa6\xe3\x81\x84\xe3\x81\xa6\xe6\x99\xaf\xe6\xb0\x97\xe3\x81\x8c\xe6\x82\xaa\xe3\x81\x84\xe3\x81\xae\xe3\x81\x8b\xe3\x82\x92\xe7\x9f\xa5\xe3\x82\x8a\xe3\x80\x81\xe3\x81\x9d\xe3\x82\x8c\xe3\x81\xab\xe5\xaf\xbe\xe3\x81\x97\xe3\x81\xa6\xe5\x8d\xb1\xe6\xa9\x9f\xe6\x84\x9f\xe3\x82\x92\xe6\x8c\x81\xe3\x81\xa1\xe3\x81\xbe\xe3\x81\x97\xe3\x82\x87\xe3\x81\x86\xe3\x80\x82\xe4\xbb\x8a\xe3\x82\x88\xe3\x82\x8a\xe3\x82\x82\xe3\x81\x8a\xe9\x87\x91\xe3\x82\x92\xe7\xa8\xbc\xe3\x81\x8e\xe3\x81\x9f\xe3\x81\x84\xe3\x80\x81\xe3\x81\x9d\xe3\x81\x86\xe6\x80\x9d\xe3\x81\x86\xe3\x81\xaa\xe3\x82\x89\xe8\xa1\x8c\xe5\x8b\x95\xe3\x82\x92\xe8\xb5\xb7\xe3\x81\x93\xe3\x81\x97\xe3\x81\xbe\xe3\x81\x97\xe3\x82\x87\xe3\x81\x86\xe3\x80\x82\xe3\x83\x95\xe3\x82\xa9\xe3\x83\xad\xe3\x83\xbc\xe3\x83\xbbDM\xe3\x81\x8a\xe5\xbe\x85\xe3\x81\xa1\xe3\x81\x97\xe3\x81\xa6\xe3\x81\x8a\xe3\x82\x8a\xe3\x81\xbe\xe3\x81\x99\xe3\x80\x82  #Bitcoin  #\xe5\x89\xaf\xe5\x8f\x8e\xe5\x85\xa5  #\xe5\x89\xaf\xe6\xa5\xad  #\xe3\x81\x8a\xe9\x87\x91  #\xe7\xa8\xbc\xe3\x81\x8e\xe3\x81\x9f\xe3\x81\x84  #\xe7\xa8\xbc\xe3\x81\x90',xe6 x97 xa5 xe6 x9c xac xe3 x81 x8c xe3 x81 xa9 xe3 x82 x8c xe3 x81 xa0 xe3 x81 x91 xe3 x81 xae xe5 x80 x9f xe9 x87 x91 xe3 x82 x92 xe8 x83 x8c xe8 x2 xa0 xe3 x81 xa3 xe3 x81 xa6 xe3 x81 x84 xe3 x81 xa6 xe6 x99 xaf xe6 x0 x97 xe3 x81 x8c xe6 x82 xaa xe3 x81 x84 xe3 x81 xae xe3 x81 x8 xe3 x82 x92 xe7 x9f xa5 xe3 x82 x8a xe3 x80 x81 xe3 x81 x9d xe3 x82 x8c xe3 x81 xa xe5 xaf xe xe3 x81 x97 xe3 x81 xa6 xe5 x8d x1 xe6 xa9 x9f xe6 x84 x9f xe3 x82 x92 xe6 x8c x81 xe3 x81 xa1 xe3 x81 xe xe3 x81 x97 xe3 x82 x87 xe3 x81 x86 xe3 x80 x82 xe4 x x8a xe3 x82 x88 xe3 x82 x8a xe3 x82 x82 xe3 x81 x8a xe9 x87 x91 xe3 x82 x92 xe7 xa8 xc xe3 x81 x8e xe3 x81 x9f xe3 x81 x84 xe3 x80 x81 xe3 x81 x9d xe3 x81 x86 xe6 x80 x9d xe3 x81 x86 xe3 x81 xaa xe3 x82 x89 xe8 xa1 x8c xe5 x8 x95 xe3 x82 x92 xe8 x5 x7 xe3 x81 x93 xe3 x81 x97 xe3 x81 xe xe3 x81 x97 xe3 x82 x87 xe3 x81 x86 xe3 x80 x82 xe3 x83 x95 xe3 x82 xa9 xe3 x83 xad xe3 x83 xc xe3 x83 xDM xe3 x81 x8a xe5 xe x85 xe3 x81 xa1 xe3 x81 x97 xe3 x81 xa6 xe3 x81 x8a xe3 x82 x8a xe3 x81 xe xe3 x81 x99 xe3 x80 x82 Bitcoin xe5 x89 xaf xe5 x8f x8e xe5 x85 xa5 xe5 x89 xaf xe6 xa5 xad xe3 x81 x8a xe9 x87 x91 xe7 xa8 xc xe3 x81 x8e xe3 x81 x9f xe3 x81 x84 xe7 xa8 xc xe3 x81 x90
2019-11-17T17:11:16.000Z,b'#fintradecenter #cryptotrading #onlineincome #crypto #bitcoin #ethereum #tether https://t.co/jtLYgjEf3b',fintradecenter cryptotrading onlineincome crypto itcoin ethereum tether
2019-11-17T17:11:35.000Z,b'BestChange - Claim free Bitcoin and get e-currency exchange rates! https://t.co/xriaOAgc43 #bitcoin \xf0\x9f\x90\xa3',BestChange Claim free Bitcoin and get e currency exchange rates itcoin xf0 x9f x90 xa3
2019-11-17T17:11:40.000Z,"b'@GBNReports The financial world is on fire, be your own bank. #AtomicDEX from @KomodoPlatform is totally Decentrali\\xe2\\x80\\xa6 https://t.co/eUCuzn1E3C'",The financial world is on fire e your own ank AtomicDEX from is totally Decentrali xe2 x80 xa6
2019-11-17T17:11:44.000Z,"b'@codeyisfun Dear Codey, at the moment, you are the only Bitcoin product that I use\\xf0\\x9f\\x98\\x8a\\xf0\\x9f\\x98\\x82\\xf0\\x9f\\x98\\x89 @codeyisfun #bitcoin'",Dear Codey at the moment you are the only Bitcoin product that I use xf0 x9f x98 x8a xf0 x9f x98 x82 xf0 x9f x98 x89 itcoin
2019-11-17T17:11:53.000Z,"b'#Iran #Central_Bank Branch Set on Fire, Crypto Community Follows Events reported by https://t.co/tKZOU0e5ab ----\\xe2\\x80\\xa6 https://t.co/XsGhGcDpr5'",Iran Central Bank Branch Set on Fire Crypto Community Follows Events reported y xe2 x80 xa6
2019-11-17T17:11:55.000Z,"\"b\"\"Bitcoin and the market is pumping. It's an impossible force to stop! Easy money! Too easy! \\n\\n#bitcoin #btc #crypto\\xe2\\x80\\xa6 https://t.co/Y96WqZ37mI\"\"\"",Bitcoin and the market is pumping It s an impossile force to stop Easy money Too easy n n itcoin tc crypto xe2 x80 xa6
2019-11-17T17:12:08.000Z,b'r/#bitcoin - Is Bitcoin the fate for ATMs? https://t.co/Plz0bB0yot',r itcoin Is Bitcoin the fate for ATMs
2019-11-17T17:12:19.000Z,"b'The financial world is on fire, be your own bank. #AtomicDEX from \\n@KomodoPlatform\\n is totally Decentralized.\\xe2\\x80\\xa6 https://t.co/y8HCx1wfh0'",The financial world is on fire e your own ank AtomicDEX from n n is totally Decentralized xe2 x80 xa6
2019-11-17T17:12:24.000Z,b'#Finance #Cryptocurrency #Bitcoin #BitcoinCash #EOS #Stellar #Litecoin #Monero #Cardano #Tron #IOTA #DASH #NEO\xe2\x80\xa6 https://t.co/OgEjHNSfnD',Finance Cryptocurrency Bitcoin BitcoinCash EOS Stellar Litecoin Monero Cardano Tron IOTA DASH NEO xe2 x80 xa6
2019-11-17T17:12:28.000Z,b'#BTC $BTC #Bitcoin https://t.co/6E6ixW6fGq',BTC BTC Bitcoin
2019-11-17T17:12:34.000Z,b'#Emjac https://t.co/1urXmgcpZh #EMJ #IEO #Crypto #Blockchain #ethereum #bitcoin #ether #cryptocurrency https://t.co/2Ce1UGhpkK',Emjac EMJ IEO Crypto Blockchain ethereum itcoin ether cryptocurrency
