2019-11-17T19:24:00.000Z,"b'\\xe2\\x8f\\xb0 22:24:00 #Piyasa #D\\xc3\\xb6viz\\n\\xe2\\x96\\xac USD: 5,7453 \\xe2\\x82\\xba\\n\\xe2\\x96\\xac EUR: 6,3498 \\xe2\\x82\\xba\\n\\xe2\\x96\\xac GBP: 7,4139 \\xe2\\x82\\xba\\n\\xe2\\x96\\xac EUR/USD: 1,1052 $\\n\\xe2\\x96\\xb2 Bitcoin: 8.581,2 $\\xe2\\x80\\xa6 https://t.co/Tftt2ej7EB'",xe2 x8f x0 22 24 00 Piyasa D xc3 x6viz n xe2 x96 xac USD 5 7453 xe2 x82 xa n xe2 x96 xac EUR 6 3498 xe2 x82 xa n xe2 x96 xac GBP 7 4139 xe2 x82 xa n xe2 x96 xac EUR USD 1 1052 n xe2 x96 x2 Bitcoin 8 581 2 xe2 x80 xa6
2019-11-17T19:24:02.000Z,b'#hong #kong: #geolocation #data #provider #starts #accepting #bitcoin \n#bitcoin #airdrop #trading #monero\xe2\x80\xa6 https://t.co/EZMJcaWwF4',hong kong geolocation data provider starts accepting itcoin n itcoin airdrop trading monero xe2 x80 xa6
2019-11-17T19:24:06.000Z,"b'@extstock @dcs_token #cryptocurrency #bitcoin \\nImportant project , i am sure it has a great future and i am happy t\\xe2\\x80\\xa6 https://t.co/7JYgW84tuS'",cryptocurrency itcoin nImportant project i am sure it has a great future and i am happy t xe2 x80 xa6
2019-11-17T19:24:07.000Z,b'Reaction of 10/30 area - Watching 01/08 :)\n-\n#HG_F $XCUUSD #XCUUSD #Copper\n-\n#Forex #BitCoin #Futures #Commodities\xe2\x80\xa6 https://t.co/b2A9kiAuEV',Reaction of 10 30 area Watching 01 08 n n HG F XCUUSD XCUUSD Copper n n Forex BitCoin Futures Commodities xe2 x80 xa6
2019-11-17T19:24:47.000Z,b'#Bitcoin #Altcoin bull season is coming! Increase your profit up to 100x by trading with leverage.  #Cryptocurrency\xe2\x80\xa6 https://t.co/OTFLyF9uRL',Bitcoin Altcoin ull season is coming Increase your profit up to 100x y trading with leverage Cryptocurrency xe2 x80 xa6
2019-11-17T19:25:36.000Z,"b'Perhaps Google Will Kill Bitcoin, After All https://t.co/wSKQPRRg8a by @billybambrough #bitcoin'",Perhaps Google Will Kill Bitcoin After All y itcoin
2019-11-17T19:26:03.000Z,b'@extstock @dcs_token Best Project..\nGoof Luck \xf0\x9f\x91\x8d\xf0\x9f\x91\x8d\xf0\x9f\x91\x8d\xf0\x9f\x91\x8d\n\n#cryptocurrency #bitcoin',Best Project nGoof Luck xf0 x9f x91 x8d xf0 x9f x91 x8d xf0 x9f x91 x8d xf0 x9f x91 x8d n n cryptocurrency itcoin
2019-11-17T19:26:13.000Z,b'What is the #forex #market \n\nhttps://t.co/5n3hYyshE3\n\nhttps://t.co/H5QrYCBVGr\n\n#infographic #foreign #exchange\xe2\x80\xa6 https://t.co/NNGsNerkKW',What is the forex market n nhttps foreign exchange xe2 x80 xa6
2019-11-17T19:26:24.000Z,b'Crypto ATMs get regulators attention\n\n#crypto #cryptocurrency #Bitcoin https://t.co/5HyKp8lSq8',Crypto ATMs get regulators attention n n crypto cryptocurrency Bitcoin
2019-11-17T19:26:26.000Z,b'Watching 11/20 for one more leg lower - we got it!\n-\n#ZC_F #Corn\n-\n#Forex #BitCoin #Futures #Commodities #Markets\xe2\x80\xa6 https://t.co/HUPqRsGlQG',Watching 11 20 for one more leg lower we got it n n ZC F Corn n n Forex BitCoin Futures Commodities Markets xe2 x80 xa6
2019-11-17T19:26:41.000Z,b'#onlinebusiness #passiveincome #financialfreedom #cryptocurrency #money #network #cash #crypto #btc #Bitcoin\xe2\x80\xa6 https://t.co/gE74MTPJxx',onlineusiness passiveincome financialfreedom cryptocurrency money network cash crypto tc Bitcoin xe2 x80 xa6
2019-11-17T19:27:02.000Z,"b'#global #bor\\xc3\\xa7, #bitcoin #ba\\xc5\\x9f\\xc4\\xb1na #12 #milyon #dolara #\\xc3\\x87\\xc4\\xb1kt\\xc4\\xb1! \\n#crypto #ethereum #xrp #ripplenews #altcoin #binance\\xe2\\x80\\xa6 https://t.co/YRMwh6DfFu'",gloal or xc3 xa7 itcoin a xc5 x9f xc4 x1na 12 milyon dolara xc3 x87 xc4 x1kt xc4 x1 n crypto ethereum xrp ripplenews altcoin inance xe2 x80 xa6
2019-11-17T19:27:25.000Z,"b'ProtonMail Holds Bitcoin Since 2014, Says PayPal Behind Its Crypto Adoption https://t.co/qUYjncSou6\\xe2\\x80\\xa6 https://t.co/Cji8DZ2PWh'",ProtonMail Holds Bitcoin Since 2014 Says PayPal Behind Its Crypto Adoption
2019-11-17T19:27:25.000Z,b'The future is now #BitcoinIndependence #bitcoin #BitcoinCash #bitcoinmining https://t.co/9HNpVyJ3fz',The future is now BitcoinIndependence itcoin BitcoinCash itcoinmining
2019-11-17T19:28:42.000Z,b'Gana 200 $ por registrarte en #COINSBIT desde este link: https://t.co/mpxXXCESFo   #Dolares #Criptomonedas #tokens\xe2\x80\xa6 https://t.co/tn1R7dN4d6',Gana 200 por registrarte en COINSBIT desde este link Dolares Criptomonedas tokens xe2 x80 xa6
2019-11-17T19:28:47.000Z,b'@extstock @dcs_token #cryptocurrency #bitcoin\n\n@hanzobtc04 @aa26485598 @Airtiger_1 @TheMtOnBass @DimpleJangra5',cryptocurrency itcoin n n
2019-11-17T19:28:50.000Z,"\"b\"\"@yanivgraph @mrauchs A decentralised money does more than resisting authorities. It's also resistant to attack by a\\xe2\\x80\\xa6 https://t.co/F5Z0nphSf4\"\"\"",A decentralised money does more than resisting authorities It s also resistant to attack y a xe2 x80 xa6
2019-11-17T19:29:03.000Z,b'We are making Bitcoin Millionaires https://t.co/j32oimw0y8 #Bitcoin #Pif #Millionaires',We are making Bitcoin Millionaires Bitcoin Pif Millionaires
2019-11-17T19:29:13.000Z,"b'\\xe3\\x82\\x88\\xe3\\x82\\x8a\\xe9\\x87\\x8d\\xe8\\xa6\\x81\\xe3\\x81\\xaa\\xe3\\x81\\xae\\xe3\\x81\\xaf\\xe6\\xa9\\x9f\\xe4\\xbc\\x9a\\xe6\\x90\\x8d\\xe5\\xa4\\xb1\\xe3\\x82\\x88\\xe3\\x82\\x8a\\xe3\\x82\\x82\\xe5\\xbe\\x85\\xe3\\x81\\xa4\\xe4\\xba\\x8b\\xe3\\x81\\xa0 #fx,#bitcoin'",xe3 x82 x88 xe3 x82 x8a xe9 x87 x8d xe8 xa6 x81 xe3 x81 xaa xe3 x81 xae xe3 x81 xaf xe6 xa9 x9f xe4 xc x9a xe6 x90 x8d xe5 xa4 x1 xe3 x82 x88 xe3 x82 x8a xe3 x82 x82 xe5 xe x85 xe3 x81 xa4 xe4 xa x8 xe3 x81 xa0 fx itcoin
2019-11-17T19:29:24.000Z,b'Pour vous pr\xc3\xa9f\xc3\xa9riez que Satoshi soit:\n\n#Bitcoin #crypto',Pour vous pr xc3 xa9f xc3 xa9riez que Satoshi soit n n Bitcoin crypto
2019-11-17T19:30:03.000Z,b'Money is just Legacy Technology\n\nRead post: - https://t.co/Ka6yNOcdJQ\n\n#LegacyTechnology #Blockchain #Bitcoin\xe2\x80\xa6 https://t.co/O7t48IaVDW',Money is just Legacy Technology n nRead post Blockchain Bitcoin xe2 x80 xa6
2019-11-17T19:30:04.000Z,b'One Bitcoin now worth $8540.56@bitstamp. High $8589.100. Low $8375.000. Market Cap $154.183 Billion #bitcoin',One Bitcoin now worth 8540 56 High 8589 100 Low 8375 000 Market Cap 154 183 Billion itcoin
2019-11-17T19:30:04.000Z,b'One Bitcoin now worth $8554.252. Market Cap $154.430 Billion. Based on #coindesk BPI #bitcoin',One Bitcoin now worth 8554 252 Market Cap 154 430 Billion Based on coindesk BPI itcoin
2019-11-17T19:30:05.000Z,"b'Top 5 #cryptocurrencies \\n Alert Time: 2019-11-17 22:30:05\\n#Bitcoin: $8,627.513\\n#Ethereum: $186.313\\n#XRP: $0.268\\xe2\\x80\\xa6 https://t.co/PJgADyIhDB'",Top 5 cryptocurrencies n Alert Time 2019 11 17 22 30 05 n Bitcoin 8 627 513 n Ethereum 186 313 n XRP 0 268 xe2 x80 xa6
2019-11-17T19:30:05.000Z,b'2019/11/18 04:30\n\nBTC 930613.5\xe5\x86\x86\nETH 20142.1\xe5\x86\x86\nETC 505.7\xe5\x86\x86\nBCH 29293.2\xe5\x86\x86\nXRP 28.9\xe5\x86\x86\nXEM 4.5\xe5\x86\x86\nLSK 85.6\xe5\x86\x86\nMONA 115.5\xe5\x86\x86\xe2\x80\xa6 https://t.co/zfWaZdIj7R',2019 11 18 04 30 n nBTC 930613 5 xe5 x86 x86 nETH 20142 1 xe5 x86 x86 nETC 505 7 xe5 x86 x86 nBCH 29293 2 xe5 x86 x86 nXRP 28 9 xe5 x86 x86 nXEM 4 5 xe5 x86 x86 nLSK 85 6 xe5 x86 x86 nMONA 115 5 xe5 x86 x86 xe2 x80 xa6
2019-11-17T19:30:06.000Z,b'Watching 12/25 - directional change!\n-\n#ZS_F #SoyBeans\n-\n#Forex #BitCoin #Futures #Commodities #Markets #Trading\xe2\x80\xa6 https://t.co/vokDMP0Arw',Watching 12 25 directional change n n ZS F SoyBeans n n Forex BitCoin Futures Commodities Markets Trading xe2 x80 xa6
2019-11-17T19:30:08.000Z,b'Dump your Overly Attached Bank! https://t.co/gykVY7q789 #Bitcoin #Funny #Memes #OAG #Crypto #Ethereum #Litecoin https://t.co/LK5qIb05am',Dump your Overly Attached Bank Bitcoin Funny Memes OAG Crypto Ethereum Litecoin
2019-11-17T19:30:09.000Z,"b'#BTC: \\xe2\\x82\\xba49.071,00\\n#ETH: \\xe2\\x82\\xba1.063,91\\n#LTC:  \\xe2\\x82\\xba343,20\\n#XRP: \\xe2\\x82\\xba1,52\\n\\n17.11.19 - 22:30\\n\\n#Bitcoin #Litecoin #Ethereum #Ripple\\xe2\\x80\\xa6 https://t.co/ydHNaBvh7F'",BTC xe2 x82 xa49 071 00 n ETH xe2 x82 xa1 063 91 n LTC xe2 x82 xa343 20 n XRP xe2 x82 xa1 52 n n17 11 19 22 30 n n Bitcoin Litecoin Ethereum Ripple xe2 x80 xa6
2019-11-17T19:30:10.000Z,"b'Nov 17, 2019 19:29:00 UTC | 8,554.30$ | 7,740.50\\xe2\\x82\\xac | 6,627.30\\xc2\\xa3 | #Bitcoin #BTC $BTC #crypto #financial #news https://t.co/jv0pjk9p1Z'",Nov 17 2019 19 29 00 UTC 8 554 30 7 740 50 xe2 x82 xac 6 627 30 xc2 xa3 Bitcoin BTC BTC crypto financial news
2019-11-17T19:30:13.000Z,"b'Bull Run Intact: Long-Term ##Bitcoin Price Indicator Remains Long: As you likely know, Bitcoin (BTC\\xe2\\x80\\xa6 https://t.co/1Mz84x3NOj #Blockchain'",Bull Run Intact Long Term Bitcoin Price Indicator Remains Long As you likely know Bitcoin BTC xe2 x80 xa6 Blockchain
2019-11-17T19:30:13.000Z,b'Need adult advertisement space and adult traffic? Try our self serve advertising https://t.co/wa8ndmPac7 (world wid\xe2\x80\xa6 https://t.co/yRYCee5HSz',Need adult advertisement space and adult traffic Try our self serve advertising world wid xe2 x80 xa6
2019-11-17T19:30:14.000Z,b'Just a few days until the #KansasCity #Bitcoin &amp; #Cryptocurrency meetup. Be there! https://t.co/D5UgrHRlir',Just a few days until the KansasCity Bitcoin amp Cryptocurrency meetup Be there
2019-11-17T19:30:15.000Z,b'Discoin Airdrop is now Live\xf0\x9f\x9a\x80\xf0\x9f\x92\xb0\xf0\x9f\x8f\x86\n\nClick on below link to participate into this amazing #Airdrop\xf0\x9f\x8e\x81\n\n\xf0\x9f\x8e\x81 Rewards: 400 + 10\xe2\x80\xa6 https://t.co/uNhf3yrhp9',Discoin Airdrop is now Live xf0 x9f x9a x80 xf0 x9f x92 x0 xf0 x9f x8f x86 n nClick on elow link to participate into this amazing Airdrop xf0 x9f x8e x81 n n xf0 x9f x8e x81 Rewards 400 10 xe2 x80 xa6
2019-11-17T19:30:15.000Z,"b'Hello humans, as of Sun Nov 17 13:30:14 CST 2019, current #cryptocoin prices:\\n#bitcoin is $8628.6379\\n#dash is $68.5\\xe2\\x80\\xa6 https://t.co/FYUGEjOgQ2'",Hello humans as of Sun Nov 17 13 30 14 CST 2019 current cryptocoin prices n itcoin is 8628 6379 n dash is 68 5 xe2 x80 xa6
2019-11-17T19:30:18.000Z,"b'Buy Bitcoin With PayPal! Also with CC, paysafecard, Skrill, OKPAY https://t.co/Qdq3dxXr95 #btc #bitcoin 14 https://t.co/ZtJPxyZuXZ'",Buy Bitcoin With PayPal Also with CC paysafecard Skrill OKPAY tc itcoin 14
2019-11-17T19:30:21.000Z,"\"b'Share this with the \"\"it can\\'t possibly scale\"\" \"\"experts\"\"... https://t.co/gykVY7q789 #Bitcoin #memes #Crypto\\xe2\\x80\\xa6 https://t.co/Z7qZ7Bcbst'\"",Share this with the it can t possily scale experts Bitcoin memes Crypto xe2 x80 xa6
2019-11-17T19:30:25.000Z,"b'Balancing a diversified #crypto portfolio is not so easy, you need a smart tool! https://t.co/gykVY7q789 #Bitcoin\\xe2\\x80\\xa6 https://t.co/a7XlnQ1UOK'",Balancing a diversified crypto portfolio is not so easy you need a smart tool Bitcoin xe2 x80 xa6
2019-11-17T19:30:31.000Z,"b'El precio del Bitcoin: 7,746.26\\xe2\\x82\\xac #bitcoin #elpreciodelbtc #criptomonedas'",El precio del Bitcoin 7 746 26 xe2 x82 xac itcoin elpreciodeltc criptomonedas
2019-11-17T19:30:35.000Z,b'#btg #bitcoingold #bitcoin\n\nGZVJHuSJipqMkfS98XZsxgsMigME3Rb8eH https://t.co/KmmS2myVrm',tg itcoingold itcoin n nGZVJHuSJipqMkfS98XZsxgsMigME3R8eH
2019-11-17T19:30:39.000Z,b'Watch videos to earn bitcoin  \n\nCheck It Out: https://t.co/XUJfhkZ3bB\n\n #MyOwnBoss #Watch #Videos #Earn #Bitcoin',Watch videos to earn itcoin n nCheck It Out MyOwnBoss Watch Videos Earn Bitcoin
