2019-11-17T21:00:46.000Z,b'#BTCUSD Market #1H timeframe on  November 17 at 20:00 (UTC)  is #Bullish.  #cryptocurrency #bitcoin  #btc #crypto\xe2\x80\xa6 https://t.co/9q3rvsJRjF',BTCUSD Market 1H timeframe on Novemer 17 at 20 00 UTC is Bullish cryptocurrency itcoin tc crypto xe2 x80 xa6
2019-11-17T21:00:53.000Z,"b'Top 5 #cryptocurrencies \\n Alert Time: 2019-11-18 00:00:53\\n#Bitcoin: $8,686.411\\n#Ethereum: $187.241\\n#XRP: $0.269\\xe2\\x80\\xa6 https://t.co/uaj5UAZW9B'",Top 5 cryptocurrencies n Alert Time 2019 11 18 00 00 53 n Bitcoin 8 686 411 n Ethereum 187 241 n XRP 0 269 xe2 x80 xa6
2019-11-17T21:00:54.000Z,"\"b\"\"Fiyat 8640'a kadar cikti. Herkese bol kazanclar dilerim. #bitcoin #Btc #bitmex #kriptopara https://t.co/jDRP5TkU56\"\"\"",Fiyat 8640 a kadar cikti Herkese ol kazanclar dilerim itcoin Btc itmex kriptopara
2019-11-17T21:00:56.000Z,b'#bitcoin Earn FREE bitcoin with this easy strategy \xe2\x96\xb6 https://t.co/K41USsQ7H8 https://t.co/8kGiIOgDbu',itcoin Earn FREE itcoin with this easy strategy xe2 x96 x6
2019-11-17T21:00:56.000Z,"b'Read my Nov 17 Newsletter featuring \\xe2\\x80\\xa6 https://t.co/8nvM73xeQt\\nFor News about #Blockchain, #Bitcoin &amp; Co please foll\\xe2\\x80\\xa6 https://t.co/nZBfKggIst'",Read my Nov 17 Newsletter featuring xe2 x80 xa6 News aout Blockchain Bitcoin amp Co please foll xe2 x80 xa6
2019-11-17T21:01:07.000Z,b'1 #BTC (#Bitcoin) quotes:\n$8518.83/$8531.76 #Bitstamp\n$8521.51/$8526.90 #Kraken\n\xe2\x87\xa2$-10.25/$8.07',1 BTC Bitcoin quotes n 8518 83 8531 76 Bitstamp n 8521 51 8526 90 Kraken n xe2 x87 xa2 10 25 8 07
2019-11-17T21:01:11.000Z,"b'\\xf0\\x9f\\x94\\xbc\\xf0\\x9f\\x94\\xbc \\xe2\\x82\\xbf1 = $8,617 (20:33 UTC)\\n$BTC prices continue to rise!\\n#Bitcoin $btcusd #btcusd #btc https://t.co/KMj4Y0bT1i'",xf0 x9f x94 xc xf0 x9f x94 xc xe2 x82 xf1 8 617 20 33 UTC n BTC prices continue to rise n Bitcoin tcusd tcusd tc
2019-11-17T21:01:12.000Z,"b'\\xf0\\x9f\\x94\\xbd \\xe2\\x82\\xbf1 = $8,530 (20:59 UTC)\\n$BTC prices fall!\\n#Bitcoin $btcusd #btcusd #btc https://t.co/iCTZWyuUHZ'",xf0 x9f x94 xd xe2 x82 xf1 8 530 20 59 UTC n BTC prices fall n Bitcoin tcusd tcusd tc
2019-11-17T21:01:12.000Z,b'\xe2\x82\xac 7861.31 #bitcoin',xe2 x82 xac 7861 31 itcoin
2019-11-17T21:01:13.000Z,b'Heres What to Possibly Expect From #bitcoin This Week #ToneVays https://t.co/jhriF2xkTG https://t.co/jlPvy7BuTH',Heres What to Possily Expect From itcoin This Week ToneVays
2019-11-17T21:01:18.000Z,"b'\\xe2\\x82\\xbf Actual #Bitcoin #BTC price is \\n1 BTC = 7.860,898 \\xe2\\x82\\xac #EUR\\n1 BTC = 8.686,411 $ #USD\\nChange last 24 hours 1.76% \\xf0\\x9f\\x93\\x88\\nChange last hour 0.65% \\xf0\\x9f\\x93\\x88'",xe2 x82 xf Actual Bitcoin BTC price is n1 BTC 7 860 898 xe2 x82 xac EUR n1 BTC 8 686 411 USD nChange last 24 hours 1 76 xf0 x9f x93 x88 nChange last hour 0 65 xf0 x9f x93 x88
2019-11-17T21:01:26.000Z,b'#crypto price changes last hour\n\n\xf0\x9f\x9a\x80\n$FLO +13.21%\n$GAME +4.63%\n$BTU +4.29%\n\n\xf0\x9f\x8c\xa7\xef\xb8\x8f\n$BTT -20.18%\n$XMY -8.53%\n$AKRO -4.38%\n\n#bitcoin #cryptocurrency',crypto price changes last hour n n xf0 x9f x9a x80 n FLO 13 21 n GAME 4 63 n BTU 4 29 n n xf0 x9f x8c xa7 xef x8 x8f n BTT 20 18 n XMY 8 53 n AKRO 4 38 n n itcoin cryptocurrency
2019-11-17T21:01:27.000Z,b'$GNT\nBuy at #Binance-BNB and sell at #Vebitcoin-TRY. Ratio: 0.46%\n#bitcoin #arbitrage #arbitraj #ArbingTool \nhttps://t.co/xiFUPzcOcC',GNT nBuy at Binance BNB and sell at Veitcoin TRY Ratio 0 46 n itcoin aritrage aritraj AringTool
2019-11-17T21:01:27.000Z,b'$DGB\nBuy at #OKEx-USDT and sell at #Bitfeks-TRY. Ratio: 0.27%\n#bitcoin #arbitrage #arbitraj #ArbingTool \nhttps://t.co/xiFUPzcOcC',DGB nBuy at OKEx USDT and sell at Bitfeks TRY Ratio 0 27 n itcoin aritrage aritraj AringTool
2019-11-17T21:01:27.000Z,b'$LINK\nBuy at #Cryptosa-USDT and sell at #Cryptosa-USD. Ratio: 0.34%\n#bitcoin #arbitrage #arbitraj #ArbingTool \nhttps://t.co/xiFUPzcOcC',LINK nBuy at Cryptosa USDT and sell at Cryptosa USD Ratio 0 34 n itcoin aritrage aritraj AringTool
2019-11-17T21:01:28.000Z,b'$BTG\nBuy at #Gate.io-USDT and sell at #EXMO-USD. Ratio: 0.71%\n#bitcoin #arbitrage #arbitraj #ArbingTool \nhttps://t.co/xiFUPzcOcC',BTG nBuy at Gate io USDT and sell at EXMO USD Ratio 0 71 n itcoin aritrage aritraj AringTool
2019-11-17T21:01:28.000Z,b'$BSV\nBuy at #OKEx-BTC and sell at #Crex24-BTC. Ratio: 1.67%\nBuy at #Digifinex-BTC and sell at #Crex24-BTC. Ratio: 1\xe2\x80\xa6 https://t.co/gu8RkOz24L',BSV nBuy at OKEx BTC and sell at Crex24 BTC Ratio 1 67 nBuy at Digifinex BTC and sell at Crex24 BTC Ratio 1 xe2 x80 xa6
2019-11-17T21:01:30.000Z,b'Free 300 GH Cloud Mining at Gominer Instant Witdraw https://t.co/Y5N6QkIupE #gominer #hashflare #genesismining\xe2\x80\xa6 https://t.co/sLUcjQjGIt',Free 300 GH Cloud Mining at Gominer Instant Witdraw gominer hashflare genesismining xe2 x80 xa6
2019-11-17T21:01:46.000Z,b'$BTC was long at 8400. TP\xe2\x80\x99d at 8542 for +3.16r as soon as it was apparent 8550 wont hold on H1 $BTCUSD $XBT\xe2\x80\xa6 https://t.co/Rbk9qBl1Kh',BTC was long at 8400 TP xe2 x80 x99d at 8542 for 3 16r as soon as it was apparent 8550 wont hold on H1 BTCUSD XBT xe2 x80 xa6
2019-11-17T21:02:00.000Z,b'#PHP #Developer - ProAgrica - Portsmouth - Reed Business Information - [ \xe2\x9e\xa1 https://t.co/sE97cMI3HR ] #AI #AiJobs\xe2\x80\xa6 https://t.co/7uq70gUc91',PHP Developer ProAgrica Portsmouth Reed Business Information xe2 x9e xa1 AI AiJos xe2 x80 xa6
2019-11-17T21:02:02.000Z,b'When you \xe2\x9d\xa4\xef\xb8\x8f the #Bitcoin \xf0\x9f\xa4\xa3\n\nhttps://t.co/Bbq8CfWh4s',When you xe2 x9d xa4 xef x8 x8f the Bitcoin xf0 x9f xa4 xa3 n
2019-11-17T21:02:04.000Z,b'#ProtonMail has no Intention of Converting #Bitcoin Payments to Fiat: Numerous companies\xe2\x80\xa6 https://t.co/pcAob7TmT1',ProtonMail has no Intention of Converting Bitcoin Payments to Fiat Numerous companies xe2 x80 xa6
2019-11-17T21:02:20.000Z,b'Correct!\nIt also means that @CasinoCoin can adapt quickly to feedback from the industry and create bespoke products\xe2\x80\xa6 https://t.co/u4jRTwO3Hx',Correct nIt also means that can adapt quickly to feedack from the industry and create espoke products xe2 x80 xa6
2019-11-17T21:02:21.000Z,"b'Top-5 Cryptos This Week: NEO, LINK, ADA, BNB, LEO\\n#Bitcoin #Crypto #Cryptocurrency #October1st #HereWeGo\\nhttps://t.co/69lLvkYnh6'",Top 5 Cryptos This Week NEO LINK ADA BNB LEO n Bitcoin Crypto Cryptocurrency Octoer1st HereWeGo
2019-11-17T21:02:26.000Z,"\"b\"\"Laughing my FUCKING ASS OFF making this #Forbes meme! \\xf0\\x9f\\x98\\x82\\xf0\\x9f\\xa4\\xa3\\xf0\\x9f\\x98\\x82\\xf0\\x9f\\xa4\\xa3 I can't wait to upload",Laughing my FUCKING ASS OFF making this Fores meme xf0 x9f x98 x82 xf0 x9f xa4 xa3 xf0 x9f x98 x82 xf0 x9f xa4 xa3 I can t wait to upload
2019-11-17T21:02:28.000Z,"\"b\"\"#Bitcoin 8640$'a y\\xc3\\xbckseldi.\"\"\"",Bitcoin 8640 a y xc3 xckseldi
2019-11-17T21:02:39.000Z,b'Bitmain Antminer S9 Bitcoin Miner 13.5Th with power supply https://t.co/9VSu7vvo9g #bitcoin #crypto #antminer #bitmain',Bitmain Antminer S9 Bitcoin Miner 13 5Th with power supply itcoin crypto antminer itmain
2019-11-17T21:02:39.000Z,b'Bitmain Antminer S9 Bitcoin Miner 13.5Th with power supply https://t.co/HmxtR02oGu #bitcoin #crypto #antminer #bitmain',Bitmain Antminer S9 Bitcoin Miner 13 5Th with power supply itcoin crypto antminer itmain
2019-11-17T21:02:42.000Z,b'#PHP #Developer (Laravel) - Digital Gurus - [ \xf0\x9f\x93\x8b More Info  https://t.co/bLsbs8le3L ] #AI #AiJobs\xe2\x80\xa6 https://t.co/zdxfRuF1cO',PHP Developer Laravel Digital Gurus xf0 x9f x93 x8 More Info AI AiJos xe2 x80 xa6
2019-11-17T21:02:55.000Z,"\"b\"\"8700 hedefimize \\xc3\\xa7ok yakla\\xc5\\x9ft\\xc4\\xb1k",8700 hedefimize xc3 xa7ok yakla xc5 x9ft xc4 x1k
2019-11-17T21:02:55.000Z,"b'\\xe7\\x8f\\xbe\\xe5\\x9c\\xa8\\xe3\\x81\\xae1\\xe3\\x83\\x93\\xe3\\x83\\x83\\xe3\\x83\\x88\\xe3\\x82\\xb3\\xe3\\x82\\xa4\\xe3\\x83\\xb3\\xe3\\x81\\x82\\xe3\\x81\\x9f\\xe3\\x82\\x8a\\xe3\\x81\\xae\\xe5\\x80\\xa4\\xe6\\xae\\xb5\\xe3\\x81\\xaf928,869.8330\\xe5\\x86\\x86\\xe3\\x81\\xa7\\xe3\\x81\\x99\\xe3\\x80\\x82\\xe5\\x80\\xa4\\xe6\\xae\\xb5\\xe3\\x81\\xae\\xe5\\x8f\\x96\\xe5\\xbe\\x97\\xe6\\x97\\xa5\\xe6\\x99\\x82\\xe3\\x81\\xafNov 17, 2019 21:02:00 UTC\\xe3\\x81\\xa7\\xe3\\x81\\x99 #bitcoin #\\xe3\\x83\\x93\\xe3\\x83\\x83\\xe3\\x83\\x88\\xe3\\x82\\xb3\\xe3\\x82\\xa4\\xe3\\x83\\xb3'",xe7 x8f xe xe5 x9c xa8 xe3 x81 xae1 xe3 x83 x93 xe3 x83 x83 xe3 x83 x88 xe3 x82 x3 xe3 x82 xa4 xe3 x83 x3 xe3 x81 x82 xe3 x81 x9f xe3 x82 x8a xe3 x81 xae xe5 x80 xa4 xe6 xae x5 xe3 x81 xaf928 869 8330 xe5 x86 x86 xe3 x81 xa7 xe3 x81 x99 xe3 x80 x82 xe5 x80 xa4 xe6 xae x5 xe3 x81 xae xe5 x8f x96 xe5 xe x97 xe6 x97 xa5 xe6 x99 x82 xe3 x81 xafNov 17 2019 21 02 00 UTC xe3 x81 xa7 xe3 x81 x99 itcoin xe3 x83 x93 xe3 x83 x83 xe3 x83 x88 xe3 x82 x3 xe3 x82 xa4 xe3 x83 x3
2019-11-17T21:03:02.000Z,b'$WTC\nBuy at #Bitrue-BTC and sell at #OKEx-BTC. Ratio: 5.87%\nBuy at #Binance-ETH and sell at #OKEx-ETH. Ratio: 5.24%\xe2\x80\xa6 https://t.co/bCaUlBVmLb',WTC nBuy at Bitrue BTC and sell at OKEx BTC Ratio 5 87 nBuy at Binance ETH and sell at OKEx ETH Ratio 5 24 xe2 x80 xa6
2019-11-17T21:03:03.000Z,"b'Senior #PHP #Developer - HAYS ( Doncaster, United Kingdom )  - [ \\xf0\\x9f\\x93\\x8b More Info  https://t.co/aMpJVIkmZM ] #AI #AiJobs\\xe2\\x80\\xa6 https://t.co/YTDmv40Dcm'",Senior PHP Developer HAYS Doncaster United Kingdom xf0 x9f x93 x8 More Info AI AiJos xe2 x80 xa6
2019-11-17T21:03:16.000Z,b'https://t.co/Jt4A8vrdY0 #bitcoin #ethereum #criptomoneda #btc #eth #criptomonedas #inversion #blockchain #espa\xc3\xb1a #espa\xc3\xb1ol #blockmint',itcoin ethereum criptomoneda tc eth criptomonedas inversion lockchain espa xc3 x1a espa xc3 x1ol lockmint
2019-11-17T21:03:23.000Z,b'Really happy for @APompliano. He\xe2\x80\x99s a great guy that does a tremendous job evangelizing #Bitcoin. He deserves the be\xe2\x80\xa6 https://t.co/vNEFDhAQeS',Really happy for He xe2 x80 x99s a great guy that does a tremendous jo evangelizing Bitcoin He deserves the e xe2 x80 xa6
2019-11-17T21:03:24.000Z,b'The Nice thing of vechain is that the next few months a lot of big partners and announcements will come.And everyti\xe2\x80\xa6 https://t.co/GNpcP0U1pJ',The Nice thing of vechain is that the next few months a lot of ig partners and announcements will come And everyti xe2 x80 xa6
2019-11-17T21:03:36.000Z,b'#btc #bitcoin Most internet traffic in IRAN is SHUT DOWN. What is real censorship? via /r/Bitcoin https://t.co/IHHpux1soB',tc itcoin Most internet traffic in IRAN is SHUT DOWN What is real censorship via r Bitcoin
2019-11-17T21:03:37.000Z,"b'BlockShow Asia, Avertissement Bitcoin, Inde retarde l\\xe2\\x80\\x99interdiction de cryptographie: Hodler\\xe2\\x80\\x99s Digest, 11-17 nov.\\xe2\\x80\\xa6 https://t.co/xwFLWWDg64'",BlockShow Asia Avertissement Bitcoin Inde retarde l xe2 x80 x99interdiction de cryptographie Hodler xe2 x80 x99s Digest 11 17 nov xe2 x80 xa6
2019-11-17T21:03:40.000Z,"b'Goedkoopste bitcoin nu te koop voor \\xe2\\x82\\xac7738,58, ga naar https://t.co/pRRpVpkbER #bitcoin'",Goedkoopste itcoin nu te koop voor xe2 x82 xac7738 58 ga naar itcoin
2019-11-17T21:04:02.000Z,b'#russian #intelligence #agency #fsb #linked to #$450 #million in #missing #bitcoin \n#instanews #instaairdrop\xe2\x80\xa6 https://t.co/zUGtzTkhoo',russian intelligence agency fs linked to 450 million in missing itcoin n instanews instaairdrop xe2 x80 xa6
2019-11-17T21:04:55.000Z,b'AIRDROP 250 ENOD\nhttps://t.co/Rn1L259YWA\n\n#cryptocurrency #Crypto #bounty #Airdrops #Airdrop #ETH #ethereum #Blockchain #bitcoin #ico #btc',AIRDROP 250 ENOD nhttps Crypto ounty Airdrops Airdrop ETH ethereum Blockchain itcoin ico tc
