2019-11-17T08:22:18.000Z,"b'Lazy men and unrisk men call the rich men ritualist, while unlucky girls call the lucky ones Prostitute.\\n\\nNever mis\\xe2\\x80\\xa6 https://t.co/21VR6UXBiw'",Lazy men and unrisk men call the rich men ritualist while unlucky girls call the lucky ones Prostitute n nNever mis xe2 x80 xa6
2019-11-17T08:22:26.000Z,"b'\\xf0\\x9f\\x86\\x95 Market Update NOV 17th - #Bitcoin, Crypto, #Finance &amp; Global News\\n\\n#CryptocurrencyNews \\xf0\\x9f\\x91\\x89 Bitcoin, ethereum &amp; altc\\xe2\\x80\\xa6 https://t.co/5wXrlBPb5J'",xf0 x9f x86 x95 Market Update NOV 17th Bitcoin Crypto Finance amp Gloal News n n CryptocurrencyNews xf0 x9f x91 x89 Bitcoin ethereum amp altc xe2 x80 xa6
2019-11-17T08:22:34.000Z,b'#bitcoin\n\nSupport tapped.\n\nI assume many patient bids were filled. https://t.co/fVmzyPhGee',itcoin n nSupport tapped n nI assume many patient ids were filled
2019-11-17T08:23:12.000Z,b'\xe3\x82\x82\xe3\x81\x97\xe3\x81\x8b\xe3\x81\x97\xe3\x81\xa6\xe4\xbb\xae\xe6\x83\xb3\xe9\x80\x9a\xe8\xb2\xa8\xe3\x81\xa3\xe3\x81\xa6\xe3\x81\x8a\xe3\x82\x82\xe3\x81\xa1\xe3\x82\x83\xe3\x81\xa0\xe3\x81\xa8\xe6\x80\x9d\xe3\x81\xa3\xe3\x81\xa6\xe3\x81\xbe\xe3\x81\x9b\xe3\x82\x93\xef\xbc\x9f\xe3\x80\x80\xef\xbc\x83Bitcoin https://t.co/ANyBJztzKr',xe3 x82 x82 xe3 x81 x97 xe3 x81 x8 xe3 x81 x97 xe3 x81 xa6 xe4 x xae xe6 x83 x3 xe9 x80 x9a xe8 x2 xa8 xe3 x81 xa3 xe3 x81 xa6 xe3 x81 x8a xe3 x82 x82 xe3 x81 xa1 xe3 x82 x83 xe3 x81 xa0 xe3 x81 xa8 xe6 x80 x9d xe3 x81 xa3 xe3 x81 xa6 xe3 x81 xe xe3 x81 x9 xe3 x82 x93 xef xc x9f xe3 x80 x80 xef xc x83Bitcoin
2019-11-17T08:23:22.000Z,b'@coindesk @extstock @ChairmanHeath @christine_dkim @ethereum Great Project  #cryptocurrency #bitcoin',Great Project cryptocurrency itcoin
2019-11-17T08:23:27.000Z,b'@extstock @dcs_token Great Project  #cryptocurrency #bitcoin',Great Project cryptocurrency itcoin
2019-11-17T08:23:37.000Z,b'@extstock @dcs_token #cryptocurrency #bitcoin',cryptocurrency itcoin
2019-11-17T08:23:48.000Z,b'@coindesk @extstock @ChairmanHeath @christine_dkim @ethereum #cryptocurrency #bitcoin',cryptocurrency itcoin
2019-11-17T08:24:02.000Z,b'Going up signal on a 1 hour chart! $BTC price: 8479.0 BTC/USD (2019/11/17 17:18:47) #bitcoin #btc #bch #xrp #eth\xe2\x80\xa6 https://t.co/Ut9d4M1KhD',Going up signal on a 1 hour chart BTC price 8479 0 BTC USD 2019 11 17 17 18 47 itcoin tc ch xrp eth xe2 x80 xa6
2019-11-17T08:24:03.000Z,b'3 Things Stopping Bitcoin From Returning to $20k https://t.co/ZPHBrZdmsg #Bitcoin #News #Newsteaser https://t.co/Dkm54oSvIg',3 Things Stopping Bitcoin From Returning to 20k Bitcoin News Newsteaser
2019-11-17T08:24:11.000Z,b'Blackjack is now LIVE on https://t.co/NLv676HCIn \xe2\x99\xa0\xef\xb8\x8f\n\n#btc #eth #ethereum #usdt #ltc #bitcoin #litecoin #trx #eos\xe2\x80\xa6 https://t.co/7xYwXsdUD4',Blackjack is now LIVE on xe2 x99 xa0 xef x8 x8f n n tc eth ethereum usdt ltc itcoin litecoin trx eos xe2 x80 xa6
2019-11-17T08:25:16.000Z,"b'Perhaps #Google \\n\\nWill Kill #Bitcoin, After All \\n\\nhttps://t.co/XekOjfU6Bd #fintech #blockchain #crypto\\xe2\\x80\\xa6 https://t.co/8hPNnFJFva'",Perhaps Google n nWill Kill Bitcoin After All n nhttps fintech lockchain crypto xe2 x80 xa6
2019-11-17T08:25:36.000Z,b'@TokenInsight shares interesting points on the current crypto market trend. Will it be a long slow market till the\xe2\x80\xa6 https://t.co/as8jir2KCK',shares interesting points on the current crypto market trend Will it e a long slow market till the xe2 x80 xa6
2019-11-17T08:25:40.000Z,b'@shu_BSV \xe3\x81\x9d\xe3\x81\xae\xe3\x82\xa2\xe3\x82\xab\xe3\x82\xa6\xe3\x83\xb3\xe3\x83\x88\xe3\x81\xae\xe4\xb8\xad\xe3\x81\xae\xe4\xba\xba\xe3\x81\xaf\xe4\xbd\x95\xe5\x9b\x9e\xe3\x82\x82\xe5\x85\xa5\xe3\x82\x8c\xe6\x9b\xbf\xe3\x82\x8f\xe3\x81\xa3\xe3\x81\x9f\xe3\x81\xa8\xe6\x80\x9d\xe3\x81\x84\xe3\x81\xbe\xe3\x81\x99\xe3\x80\x82\xe3\x81\x82\xe3\x81\xa8\xe3\x80\x81\xe6\x97\xa5\xe6\x9c\xac\xe3\x81\xae\xe5\x8f\x96\xe5\xbc\x95\xe6\x89\x80\xe3\x81\xaf\xe7\xb5\x90\xe5\xb1\x80\xe4\xbb\x8a\xe3\x82\x82 $BSV \xe3\x82\x92\xe4\xb8\x8e\xe3\x81\x88\xe3\x81\xa6\xe3\x81\x8f\xe3\x82\x8c\xe3\x81\x9a\xe3\x80\x81\xe6\x9c\xac\xe7\x89\xa9\xe3\x81\xae #Bitcoin \xe3\x82\x92\xe4\xbf\xa1\xe3\x81\x98\xe3\x81\xa6 $BCH \xe3\x81\xab\xe6\x8a\x95\xe8\xb3\x87\xe3\x81\x97\xe3\x81\x9f\xe6\x96\xb9\xe3\x81\xab\xe5\xaf\xbe\xe3\x81\x97\xe5\xb0\x86\xe6\x9d\xa5\xe7\x9a\x84\xe3\x81\xab $BSV \xe3\x82\x92\xe4\xb8\x8e\xe3\x81\x88\xe3\x81\xa6\xe3\x81\x8f\xe3\x82\x8c\xe3\x82\x8b\xe3\x81\x8b\xe3\x81\xaa\xef\xbc\x9f',xe3 x81 x9d xe3 x81 xae xe3 x82 xa2 xe3 x82 xa xe3 x82 xa6 xe3 x83 x3 xe3 x83 x88 xe3 x81 xae xe4 x8 xad xe3 x81 xae xe4 xa xa xe3 x81 xaf xe4 xd x95 xe5 x9 x9e xe3 x82 x82 xe5 x85 xa5 xe3 x82 x8c xe6 x9 xf xe3 x82 x8f xe3 x81 xa3 xe3 x81 x9f xe3 x81 xa8 xe6 x80 x9d xe3 x81 x84 xe3 x81 xe xe3 x81 x99 xe3 x80 x82 xe3 x81 x82 xe3 x81 xa8 xe3 x80 x81 xe6 x97 xa5 xe6 x9c xac xe3 x81 xae xe5 x8f x96 xe5 xc x95 xe6 x89 x80 xe3 x81 xaf xe7 x5 x90 xe5 x1 x80 xe4 x x8a xe3 x82 x82 BSV xe3 x82 x92 xe4 x8 x8e xe3 x81 x88 xe3 x81 xa6 xe3 x81 x8f xe3 x82 x8c xe3 x81 x9a xe3 x80 x81 xe6 x9c xac xe7 x89 xa9 xe3 x81 xae Bitcoin xe3 x82 x92 xe4 xf xa1 xe3 x81 x98 xe3 x81 xa6 BCH xe3 x81 xa xe6 x8a x95 xe8 x3 x87 xe3 x81 x97 xe3 x81 x9f xe6 x96 x9 xe3 x81 xa xe5 xaf xe xe3 x81 x97 xe5 x0 x86 xe6 x9d xa5 xe7 x9a x84 xe3 x81 xa BSV xe3 x82 x92 xe4 x8 x8e xe3 x81 x88 xe3 x81 xa6 xe3 x81 x8f xe3 x82 x8c xe3 x82 x8 xe3 x81 x8 xe3 x81 xaa xef xc x9f
2019-11-17T08:25:41.000Z,b'@extstock @dcs_token #cryptocurrency #bitcoin',cryptocurrency itcoin
2019-11-17T08:25:41.000Z,"\"b\"\"$btc testing patience and these squeezes are really gonna hit a scalper hard. Don't pick a high leverage here.\\xe2\\x80\\xa6 https://t.co/g5vHcwysm3\"\"\"",tc testing patience and these squeezes are really gonna hit a scalper hard Don t pick a high leverage here xe2 x80 xa6
2019-11-17T08:25:47.000Z,b'@extstock @dcs_token #cryptocurrency #bitcoin',cryptocurrency itcoin
2019-11-17T08:25:53.000Z,b'@extstock @dcs_token #cryptocurrency\xc2\xa0#bitcoin',cryptocurrency xc2 xa0 itcoin
2019-11-17T08:25:58.000Z,b'They have nothing to say bad about #Bitcoin right now.. https://t.co/Z2UliTqU17',They have nothing to say ad aout Bitcoin right now
2019-11-17T08:26:01.000Z,b'what just happened? \n\nhttps://t.co/sFiHA1xxtk \n\n#bitcoin #mempool https://t.co/AUG4JkdGM0',what just happened n nhttps n n itcoin mempool
2019-11-17T08:26:31.000Z,b'@extstock @dcs_token Very very great project \xf0\x9f\x98\x8e\n#cryptocurrency\xc2\xa0#bitcoin',Very very great project xf0 x9f x98 x8e n cryptocurrency xc2 xa0 itcoin
2019-11-17T08:27:09.000Z,b'#bitcoin #Ethereum #Binance #bittrex #Poloniex #XRPcommunity #Litecoin #rich #Finanza #LTC #dogecoin\xe2\x80\xa6 https://t.co/B06SwU65y7',itcoin Ethereum Binance ittrex Poloniex XRPcommunity Litecoin rich Finanza LTC dogecoin xe2 x80 xa6
2019-11-17T08:27:16.000Z,b'#bitcoin #Ethereum #Binance #bittrex #Poloniex #XRPcommunity #Litecoin #rich #Finanza #LTC #dogecoin\xe2\x80\xa6 https://t.co/xkFNLXleeJ',itcoin Ethereum Binance ittrex Poloniex XRPcommunity Litecoin rich Finanza LTC dogecoin xe2 x80 xa6
2019-11-17T08:27:21.000Z,b'#bitcoin #Ethereum #Binance #bittrex #Poloniex #XRPcommunity #Litecoin #rich #Finanza #LTC #dogecoin\xe2\x80\xa6 https://t.co/v9bvmLfEa8',itcoin Ethereum Binance ittrex Poloniex XRPcommunity Litecoin rich Finanza LTC dogecoin xe2 x80 xa6
2019-11-17T08:27:26.000Z,b'#bitcoin #Ethereum #Binance #bittrex #Poloniex #XRPcommunity #Litecoin #rich #Finanza #LTC #dogecoin\xe2\x80\xa6 https://t.co/vfyIFLsyYi',itcoin Ethereum Binance ittrex Poloniex XRPcommunity Litecoin rich Finanza LTC dogecoin xe2 x80 xa6
2019-11-17T08:27:30.000Z,b'#bitcoin #Ethereum #Binance #bittrex #Poloniex #XRPcommunity #Litecoin #rich #Finanza #LTC #dogecoin\xe2\x80\xa6 https://t.co/fDLYucqBvp',itcoin Ethereum Binance ittrex Poloniex XRPcommunity Litecoin rich Finanza LTC dogecoin xe2 x80 xa6
2019-11-17T08:27:35.000Z,b'#bitcoin #Ethereum #Binance #bittrex #Poloniex #XRPcommunity #Litecoin #rich #Finanza #LTC #dogecoin\xe2\x80\xa6 https://t.co/tskjfo21Do',itcoin Ethereum Binance ittrex Poloniex XRPcommunity Litecoin rich Finanza LTC dogecoin xe2 x80 xa6
2019-11-17T08:27:47.000Z,b'Download\xf0\x9f\x94\xb9https://t.co/cPTeGH7iNx\n\n#crypto #cryptocurrency #cryo #cryptocurrencynews #cryptolife #bitcoinmining\xe2\x80\xa6 https://t.co/2NdAqBmqpL',Download xf0 x9f x94 x9https cryptocurrency cryo cryptocurrencynews cryptolife itcoinmining xe2 x80 xa6
2019-11-17T08:28:23.000Z,b'3 Things Stopping #Bitcoin From Returning to $20k reported by https://t.co/vogDFu6sUM ---- #Institutional_Investors\xe2\x80\xa6 https://t.co/7dHFhzpU0l',3 Things Stopping Bitcoin From Returning to 20k reported y Institutional Investors xe2 x80 xa6
2019-11-17T08:28:26.000Z,b'@extstock @dcs_token #cryptocurrency #bitcoin Vamos por esos DCS',cryptocurrency itcoin Vamos por esos DCS
2019-11-17T08:28:33.000Z,"b'Bitcoin Revolution Meets Protestant Reformation, Crypto Drives Change? https://t.co/gk2FCsTySI #Bitcoin https://t.co/Wr1cr4hKOc'",Bitcoin Revolution Meets Protestant Reformation Crypto Drives Change Bitcoin
2019-11-17T08:28:37.000Z,b'#Bitcoin \n\n$8.610 \xc3\xbcst\xc3\xbcne atarsa ne \xc3\xa2l\xc3\xa2 e\xc4\x9fer atamazsa $7.900 g\xc3\xb6r\xc3\xbclecek gibi duruyor.\n$Btc #Btcusd https://t.co/cVXozpSBZC',Bitcoin n n 8 610 xc3 xcst xc3 xcne atarsa ne xc3 xa2l xc3 xa2 e xc4 x9fer atamazsa 7 900 g xc3 x6r xc3 xclecek gii duruyor n Btc Btcusd
2019-11-17T08:28:49.000Z,b'please give me\n32yyeXCAqrxbKMvSDP9ymib64wJfB8GUbe\n\n#Bitcoin',please give me n32yyeXCAqrxKMvSDP9ymi64wJfB8GUe n n Bitcoin
2019-11-17T08:29:05.000Z,"b'Bitcoin Price at Last Line of Defense: $8,270 Must Hold #BTC #Bitcoin #price #HODL https://t.co/HM3bkOmLWt'",Bitcoin Price at Last Line of Defense 8 270 Must Hold BTC Bitcoin price HODL
2019-11-17T08:29:07.000Z,b'#ff #followfriday #followback #giveaway #contest #win #competition #crypto #ico #bitcoin #funny #photography #pets\xe2\x80\xa6 https://t.co/SNFMpJvsQq',ff followfriday followack giveaway contest win competition crypto ico itcoin funny photography pets xe2 x80 xa6
2019-11-17T08:29:17.000Z,"b'\\xe9\\x80\\xb1\\xe8\\xb6\\xb3\\xe3\\x82\\x92\\xe7\\xa2\\xba\\xe8\\xaa\\x8d\\xe3\\x81\\x97\\xe3\\x82\\x8d #fx,#bitcoin'",xe9 x80 x1 xe8 x6 x3 xe3 x82 x92 xe7 xa2 xa xe8 xaa x8d xe3 x81 x97 xe3 x82 x8d fx itcoin
2019-11-17T08:29:35.000Z,b'@extstock @dcs_token #cryptocurrency\xc2\xa0#bitcoin',cryptocurrency xc2 xa0 itcoin
2019-11-17T08:29:46.000Z,b'Gorilla illustration.\nhttps://t.co/kEEj9Q1d5q\n#Bangladesh #HarryOnSNL #WordPress #blockchain #bitcoin #Taehyung\xe2\x80\xa6 https://t.co/GtsobEK0yq',Gorilla illustration nhttps HarryOnSNL WordPress lockchain itcoin Taehyung xe2 x80 xa6
2019-11-17T08:29:47.000Z,b'\xc2\xa1El \xc3\xbaltimo The Quantum Computing Daily! https://t.co/z9sLInKrfE Gracias a @pfish3r #bitcoin #quantum',xc2 xa1El xc3 xaltimo The Quantum Computing Daily Gracias a itcoin quantum
2019-11-17T08:29:52.000Z,"\"b\"\"C'mon #bitcoin It's not your character to be this indecisive. It's disappointing and boring. Make decision!!!  \\xf0\\x9f\\x98\\x92\"\"\"",C mon itcoin It s not your character to e this indecisive It s disappointing and oring Make decision xf0 x9f x98 x92
2019-11-17T08:29:55.000Z,b'Dear stranger to you Salvation to me\n#BTC #Bitcoin #Cryptocurrency #Crypto #BNB\n\n1AcnZqfZWPqK8PcpfXxTTPCe4NXMb8x4DT https://t.co/ncbUXU9ZXA',Dear stranger to you Salvation to me n BTC Bitcoin Cryptocurrency Crypto BNB n n1AcnZqfZWPqK8PcpfXxTTPCe4NXM8x4DT
