2019-11-17T14:44:08.000Z,b'Risk reward seems to be favoring the short side from this price but the downside seems limited based on that primar\xe2\x80\xa6 https://t.co/avLW2zO0Yj',Risk reward seems to e favoring the short side from this price ut the downside seems limited ased on that primar xe2 x80 xa6
2019-11-17T14:44:11.000Z,"b'@swapzillaco A Talented team, great idea. A project that there is a desire to see more in work. I wish the team suc\\xe2\\x80\\xa6 https://t.co/iYghBEZG3Y'",A Talented team great idea A project that there is a desire to see more in work I wish the team suc xe2 x80 xa6
2019-11-17T14:44:15.000Z,"\"b\"\"Don't make the same mistake. DCA to play it safe $btc #btc #bitcoin https://t.co/7eMDFAgEXJ\"\"\"",Don t make the same mistake DCA to play it safe tc tc itcoin
2019-11-17T14:44:28.000Z,b'@lopp @hajek_miloslav @bitcoingold @atombitcoin @BitcoinDiamond_ #Bitcoin',Bitcoin
2019-11-17T14:44:31.000Z,b'\xe2\x99\x92 #Bitcoin \xe2\x99\x92 The Trading Bar is now in the know. https://t.co/qHl3OXdvdm Reply with your Bitcoin Address for tips!\xe2\x80\xa6 https://t.co/HD6S5ntnUg',xe2 x99 x92 Bitcoin xe2 x99 x92 The Trading Bar is now in the know Reply with your Bitcoin Address for tips xe2 x80 xa6
2019-11-17T14:44:33.000Z,b'ProtonMail Reveals It\xe2\x80\x99s Been \xe2\x80\x98HODLing\xe2\x80\x99 Its #Bitcoin Payments for Years https://t.co/6NGpxLRXAd',ProtonMail Reveals It xe2 x80 x99s Been xe2 x80 x98HODLing xe2 x80 x99 Its Bitcoin Payments for Years
2019-11-17T14:44:37.000Z,"b'Bitcoin price prediction: BTC/USD claws back ground above $8,500 \\xe2\\x80\\x93 Confluence Detector https://t.co/5HHgqHqg6E\\xe2\\x80\\xa6 https://t.co/EEIX6hihuF'",Bitcoin price prediction BTC USD claws ack ground aove 8 500 xe2 x80 x93 Confluence Detector
2019-11-17T14:44:40.000Z,b'Every day a lot of projects appear on the network. This project is from the small number that really deserve attent\xe2\x80\xa6 https://t.co/jWByJ59Y8F',Every day a lot of projects appear on the network This project is from the small numer that really deserve attent xe2 x80 xa6
2019-11-17T14:44:56.000Z,b'#ff #followfriday #followback #giveaway #contest #win #competition #crypto #ico #bitcoin #funny #photography #pets\xe2\x80\xa6 https://t.co/pcESflUKi0',ff followfriday followack giveaway contest win competition crypto ico itcoin funny photography pets xe2 x80 xa6
2019-11-17T14:44:59.000Z,b'@djajmora When you cannot validate your business claims or inspire investors resort to non-related memes! $APL\xe2\x80\xa6 https://t.co/4PRezt7BNC',When you cannot validate your usiness claims or inspire investors resort to non related memes APL xe2 x80 xa6
2019-11-17T14:45:00.000Z,b'El #Bitcoin es una herramienta perfecta para pagar en el #casino: https://t.co/qXKmxkOAIZ https://t.co/v8zw4zYrwO',El Bitcoin es una herramienta perfecta para pagar en el casino
2019-11-17T14:45:11.000Z,b'#ff #followfriday #followback #giveaway #contest #win #competition #crypto #ico #bitcoin #funny #photography #pets\xe2\x80\xa6 https://t.co/zNZAcdhYcN',ff followfriday followack giveaway contest win competition crypto ico itcoin funny photography pets xe2 x80 xa6
2019-11-17T14:45:14.000Z,b'Andrew Yang Will \xe2\x80\x98Literally Give Everybody Money\xe2\x80\x99 \xe2\x80\x94 Like #OneCoin Did reported by https://t.co/Jce3RiCmjh ---- #Bitcoin #Fiat_Money #USA',Andrew Yang Will xe2 x80 x98Literally Give Everyody Money xe2 x80 x99 xe2 x80 x94 Like OneCoin Did reported y Bitcoin Fiat Money USA
2019-11-17T14:45:25.000Z,b'Take your 5 BTC sign up bonus at https://t.co/bNwFq6sa2E\nNo Tricks. %100 Sign up #Bonus!\n#bitcoin #btc #gambling\xe2\x80\xa6 https://t.co/SVPveGXkUF',Take your 5 BTC sign up onus at Tricks 100 Sign up Bonus n itcoin tc gamling xe2 x80 xa6
2019-11-17T14:45:34.000Z,b'#ff #followfriday #followback #giveaway #contest #win #competition #crypto #ico #bitcoin #funny #photography #pets\xe2\x80\xa6 https://t.co/a6mZg2g9Ie',ff followfriday followack giveaway contest win competition crypto ico itcoin funny photography pets xe2 x80 xa6
2019-11-17T14:45:52.000Z,b'#ff #followfriday #followback #giveaway #contest #win #competition #crypto #ico #bitcoin #funny #photography #pets\xe2\x80\xa6 https://t.co/WpKxFoRbde',ff followfriday followack giveaway contest win competition crypto ico itcoin funny photography pets xe2 x80 xa6
2019-11-17T14:45:53.000Z,b'Happy Sunday y\xe2\x80\x99all \n#forex #business #entrepreneur #investors #profitsoverwages #trader #profit #workfromhome\xe2\x80\xa6 https://t.co/3C5KmsQ69t',Happy Sunday y xe2 x80 x99all n forex usiness entrepreneur investors profitsoverwages trader profit workfromhome xe2 x80 xa6
2019-11-17T14:46:00.000Z,"\"b\"\"$DIRV DirectView's Roger Ralston",DIRV DirectView s Roger Ralston
2019-11-17T14:46:13.000Z,b'#ff #followfriday #followback #giveaway #contest #win #competition #crypto #ico #bitcoin #funny #photography #pets\xe2\x80\xa6 https://t.co/4parsfOxLT',ff followfriday followack giveaway contest win competition crypto ico itcoin funny photography pets xe2 x80 xa6
2019-11-17T14:46:19.000Z,"b'Nuovo post su Bitcoin News: #Nuovo #Record Per #Gli #Atm ##Bitcoin, #Superate #Le 6.000 #Macchine In #Tutto #Il\\xe2\\x80\\xa6 https://t.co/SdLRvLGZG1'",Nuovo post su Bitcoin News Nuovo Record Per Gli Atm Bitcoin Superate Le 6 000 Macchine In Tutto Il xe2 x80 xa6
2019-11-17T14:46:29.000Z,"\"b\"\"@TheMrDev I'm not sure if Will come new  Serious Buy Signal...long-term Chart  \\nAre still bearish imho $BTCUSD #Bitcoin\"\"\"",I m not sure if Will come new Serious Buy Signal long term Chart nAre still earish imho BTCUSD Bitcoin
2019-11-17T14:46:38.000Z,b'95% of spot #bitcoin trading volume faked - study finds that only $273m of $6B is legitimate.\n\n#VC #fintech\xe2\x80\xa6 https://t.co/THjQcAQf1m',95 of spot itcoin trading volume faked study finds that only 273m of 6B is legitimate n n VC fintech xe2 x80 xa6
2019-11-17T14:46:43.000Z,b'Velas Masternodes Staking Program is Now Live #Bitcoin #Btc #Cryptocurrency #finance #forex #markets #fx $BTC $Gold\xe2\x80\xa6 https://t.co/jocDjBoMyp',Velas Masternodes Staking Program is Now Live Bitcoin Btc Cryptocurrency finance forex markets fx BTC Gold xe2 x80 xa6
2019-11-17T14:47:00.000Z,"b'The number of #Bitcoin ATMs installed worldwide has now surpassed a new milestone surpassing 6,000.\\nhttps://t.co/Jyo4D6hfQJ'",The numer of Bitcoin ATMs installed worldwide has now surpassed a new milestone surpassing 6 000
2019-11-17T14:47:09.000Z,b'\xf0\x9f\x94\x84 Prices update in $USDT (1 hour):\n\n$BTC - 8533.31 $       (-0.03 %)\n$ETH - 184.28 $        (-0.15 %)\n$XRP - 0.26 $\xe2\x80\xa6 https://t.co/JcuqwwKaB6',xf0 x9f x94 x84 Prices update in USDT 1 hour n n BTC 8533 31 0 03 n ETH 184 28 0 15 n XRP 0 26 xe2 x80 xa6
2019-11-17T14:47:10.000Z,b'\xf0\x9f\x94\x84 Prices update in $USD (1 hour):\n\n$BTC   - 8523.6 $    (-0.05 %)\n$ETH   - 184.34 $    (-0.09 %)\n$XRP   - 0.26 $\xe2\x80\xa6 https://t.co/bFL2qzJoKD',xf0 x9f x94 x84 Prices update in USD 1 hour n n BTC 8523 6 0 05 n ETH 184 34 0 09 n XRP 0 26 xe2 x80 xa6
2019-11-17T14:47:11.000Z,b'\xf0\x9f\x94\x84 Prices update in $EUR (1 hour):\n\n$BTC   - 7725.6 \xe2\x82\xac  (-0.03 %)\n$ETH   - 166.93 \xe2\x82\xac  (-0.05 %)\n$XRP   - 0.24 \xe2\x82\xac    (-0\xe2\x80\xa6 https://t.co/QR7KSmAhPj',xf0 x9f x94 x84 Prices update in EUR 1 hour n n BTC 7725 6 xe2 x82 xac 0 03 n ETH 166 93 xe2 x82 xac 0 05 n XRP 0 24 xe2 x82 xac 0 xe2 x80 xa6
2019-11-17T14:47:23.000Z,b'Substrate Blockchains and Runtime Modules: An Introduction\n\n\xe2\x98\x9e https://t.co/Stg6juwrFl\n\n#bitcoin #cryptocurrency https://t.co/ydqeUdZhYM',Sustrate Blockchains and Runtime Modules An Introduction n n xe2 x98 x9e cryptocurrency
2019-11-17T14:47:23.000Z,b'\xf0\x9f\x94\x84 Prices update in $USDT (1 hour):\n\n$BTC - 8522.76 $ (-0.08 %)\n$ETH - 184.15 $  (-0.1 %)\n$XRP - 0.26 $    (-0.08 %)\xe2\x80\xa6 https://t.co/hblLMGWsjS',xf0 x9f x94 x84 Prices update in USDT 1 hour n n BTC 8522 76 0 08 n ETH 184 15 0 1 n XRP 0 26 0 08 xe2 x80 xa6
2019-11-17T14:47:24.000Z,b'#SwapZilla #crypto #bitcoin #ethereum #blockchain #btc https://t.co/5BjSVrqLii',SwapZilla crypto itcoin ethereum lockchain tc
2019-11-17T14:47:35.000Z,b'#ff #followfriday #followback #giveaway #contest #win #competition #crypto #ico #bitcoin #funny #photography #pets\xe2\x80\xa6 https://t.co/mVAqfrzAdp',ff followfriday followack giveaway contest win competition crypto ico itcoin funny photography pets xe2 x80 xa6
2019-11-17T14:47:39.000Z,b'@TLJ03255214 @garylbrowning Banks are no longer needed.  Play again?  #bitcoin #cryptocurrency And info graphics ar\xe2\x80\xa6 https://t.co/rYxB7fRLYn',Banks are no longer needed Play again itcoin cryptocurrency And info graphics ar xe2 x80 xa6
2019-11-17T14:47:40.000Z,b'Bluffing On The Flop The flop is the pivotal time of decision in a round of Texas hold\xe2\x80\x99em Poker. It is the one roun\xe2\x80\xa6 https://t.co/hOSfHFknwz',Bluffing On The Flop The flop is the pivotal time of decision in a round of Texas hold xe2 x80 x99em Poker It is the one roun xe2 x80 xa6
2019-11-17T14:47:49.000Z,b'#ff #followfriday #followback #giveaway #contest #win #competition #crypto #ico #bitcoin #funny #photography #pets\xe2\x80\xa6 https://t.co/intnkrGwZY',ff followfriday followack giveaway contest win competition crypto ico itcoin funny photography pets xe2 x80 xa6
2019-11-17T14:48:05.000Z,b'Jed McCaleb has sold half the XRP he received; left with ~4.5 billion\nhttps://t.co/j907Kgvnmf\n#Bitcoin #Markethive\xe2\x80\xa6 https://t.co/dDJ2W4s6V8',Jed McCale has sold half the XRP he received left with 4 5 illion nhttps Markethive xe2 x80 xa6
2019-11-17T14:48:06.000Z,b'\xef\xbc\x88\xe5\xaf\x84\xe7\xa8\xbf\xef\xbc\x89\xe3\x83\x93\xe3\x83\x83\xe3\x83\x88\xe3\x82\xb3\xe3\x82\xa4\xe3\x83\xb3\xe3\x81\xae\xe5\x8f\xaf\xe8\x83\xbd\xe6\x80\xa7\xe3\x81\xaf\xe3\x80\x8c\xe3\x83\x9e\xe3\x83\x8d\xe3\x83\xbc\xe3\x80\x8d\xe4\xbb\xa5\xe5\xa4\x96\xe3\x81\xae\xe3\x81\xa8\xe3\x81\x93\xe3\x82\x8d\xe3\x81\xab\n\xe5\xb7\xa8\xe5\xa4\xa7\xe3\x81\xaa\xe3\x82\xaf\xe3\x83\xa9\xe3\x82\xa6\xe3\x83\x89\xe5\x87\xba\xe7\xb4\x8d\xe7\xb0\xbf\xe3\x81\xa8\xe3\x81\x97\xe3\x81\xa6\xe3\x81\xae\xe3\x83\x93\xe3\x83\x83\xe3\x83\x88\xe3\x82\xb3\xe3\x82\xa4\xe3\x83\xb3\xe3\x82\xb7\xe3\x82\xb9\xe3\x83\x86\xe3\x83\xa0\xe3\x81\xaf\xe5\xa4\x9a\xe6\x96\xb9\xe9\x9d\xa2\xe3\x81\xa7\xe5\xbf\x9c\xe7\x94\xa8\xe3\x81\xa7\xe3\x81\x8d\xe3\x82\x8b\n\n#bitcoin #blockchain #\xe3\x83\x96\xe3\x83\xad\xe3\x83\x83\xe3\x82\xaf\xe3\x83\x81\xe3\x82\xa7\xe3\x83\xbc\xe3\x83\xb3 #\xe3\x83\x93\xe3\x83\x83\xe3\x83\x88\xe3\x82\xb3\xe3\x82\xa4\xe3\x83\xb3 #JBpress\n#\xe5\x89\xaf\xe6\xa5\xad #\xe3\x83\x93\xe3\x83\x83\xe3\x83\x88\xe3\x82\xb3\xe3\x82\xa4\xe3\x83\xb3 #\xe4\xbb\xae\xe6\x83\xb3\xe9\x80\x9a\xe8\xb2\xa8',xef xc x88 xe5 xaf x84 xe7 xa8 xf xef xc x89 xe3 x83 x93 xe3 x83 x83 xe3 x83 x88 xe3 x82 x3 xe3 x82 xa4 xe3 x83 x3 xe3 x81 xae xe5 x8f xaf xe8 x83 xd xe6 x80 xa7 xe3 x81 xaf xe3 x80 x8c xe3 x83 x9e xe3 x83 x8d xe3 x83 xc xe3 x80 x8d xe4 x xa5 xe5 xa4 x96 xe3 x81 xae xe3 x81 xa8 xe3 x81 x93 xe3 x82 x8d xe3 x81 xa n xe5 x7 xa8 xe5 xa4 xa7 xe3 x81 xaa xe3 x82 xaf xe3 x83 xa9 xe3 x82 xa6 xe3 x83 x89 xe5 x87 xa xe7 x4 x8d xe7 x0 xf xe3 x81 xa8 xe3 x81 x97 xe3 x81 xa6 xe3 x81 xae xe3 x83 x93 xe3 x83 x83 xe3 x83 x88 xe3 x82 x3 xe3 x82 xa4 xe3 x83 x3 xe3 x82 x7 xe3 x82 x9 xe3 x83 x86 xe3 x83 xa0 xe3 x81 xaf xe5 xa4 x9a xe6 x96 x9 xe9 x9d xa2 xe3 x81 xa7 xe5 xf x9c xe7 x94 xa8 xe3 x81 xa7 xe3 x81 x8d xe3 x82 x8 n n itcoin lockchain xe3 x83 x96 xe3 x83 xad xe3 x83 x83 xe3 x82 xaf xe3 x83 x81 xe3 x82 xa7 xe3 x83 xc xe3 x83 x3 xe3 x83 x93 xe3 x83 x83 xe3 x83 x88 xe3 x82 x3 xe3 x82 xa4 xe3 x83 x3 JBpress n xe5 x89 xaf xe6 xa5 xad xe3 x83 x93 xe3 x83 x83 xe3 x83 x88 xe3 x82 x3 xe3 x82 xa4 xe3 x83 x3 xe4 x xae xe6 x83 x3 xe9 x80 x9a xe8 x2 xa8
2019-11-17T14:48:12.000Z,"b'Bitcoin Should Hit $150,000 Before an ETF Can Work, Fundstrat\\xe2\\x80\\x99s Lee Says #crypto #bitcoin\\nhttps://t.co/N0vBaYm648'",Bitcoin Should Hit 150 000 Before an ETF Can Work Fundstrat xe2 x80 x99s Lee Says crypto itcoin
2019-11-17T14:48:12.000Z,b'ProtonMail Reveals It\xe2\x80\x99s Been \xe2\x80\x98HODLing\xe2\x80\x99 Its Bitcoin Payments for Years https://t.co/yjTkmrrVR8\n#bitcoin #crypto\xe2\x80\xa6 https://t.co/Pq1TNPYRju',ProtonMail Reveals It xe2 x80 x99s Been xe2 x80 x98HODLing xe2 x80 x99 Its Bitcoin Payments for Years crypto xe2 x80 xa6
2019-11-17T14:48:36.000Z,b'@Square \xf0\x9f\x96\xa4#Cryptonews #DeleteFacebook #Blockchain #Digitalisierung #Bitcoin - Actually likely to happen....https://t.co/WkAiqOg5Jn',xf0 x9f x96 xa4 Cryptonews DeleteFaceook Blockchain Digitalisierung Bitcoin Actually likely to happen
2019-11-17T14:48:40.000Z,b'\xf0\x9f\x94\x84 Prices update in $USD (1 hour):\n\n$BTC - 8523.6 $  (+0.02 %)\n$ETH - 184.34 $  (+0.05 %)\n$XRP - 0.26 $    (-0.12 %)\xe2\x80\xa6 https://t.co/q4JNxc9Ejt',xf0 x9f x94 x84 Prices update in USD 1 hour n n BTC 8523 6 0 02 n ETH 184 34 0 05 n XRP 0 26 0 12 xe2 x80 xa6
2019-11-17T14:48:55.000Z,b'Teddy Bear Keyholder # unikat handmade # arms and legs movable \n\nlouis vuitton style LV\n\nhttps://t.co/0fCR9ao6hZ\xe2\x80\xa6 https://t.co/pdJAMY0LT5',Teddy Bear Keyholder unikat handmade arms and legs movale n nlouis vuitton style LV n nhttps
