2019-11-17T01:00:05.000Z,b'TOP-12 most-mentioned #crypto this hour:\n1. #bitcoin\n2. #tron\n3. #ethereum\n4. #xrp\n5. #ardor\n6. #tezos\n7. #nem\n8.\xe2\x80\xa6 https://t.co/3I23Xib5OV',TOP 12 most mentioned crypto this hour n1 itcoin n2 tron n3 ethereum n4 xrp n5 ardor n6 tezos n7 nem n8 xe2 x80 xa6
2019-11-17T01:00:05.000Z,b'One Bitcoin now worth $8507.943. Market Cap $153.582 Billion. Based on #coindesk BPI #bitcoin',One Bitcoin now worth 8507 943 Market Cap 153 582 Billion Based on coindesk BPI itcoin
2019-11-17T01:00:06.000Z,"b'\\xf0\\x9f\\x92\\xb0Bitcoin\\xe3\\x83\\x88\\xe3\\x83\\xa9\\xe3\\x83\\xb3\\xe3\\x82\\xb6\\xe3\\x82\\xaf\\xe3\\x82\\xb7\\xe3\\x83\\xa7\\xe3\\x83\\xb3\\xe7\\x8a\\xb6\\xe6\\xb3\\x81\\xf0\\x9f\\x92\\xb0\\n\\n\\xf0\\x9f\\x94\\xa7HashRate:9,890,323,221,256 KH/s\\n\\xf0\\x9f\\x94\\x9cNetworkDiff:12,720,005,267,390\\n\\xe2\\x9a\\xa0\\xe6\\x9c\\xaa\\xe7\\xa2\\xba\\xe8\\xaa\\x8d\\xe5\\x8f\\x96\\xe5\\xbc\\x95\\xe6\\x95\\xb0:0 \\xe4\\xbb\\xb6\\n\\n#bitcoin #ethereum #cryptocurrency #\\xe4\\xbb\\xae\\xe6\\x83\\xb3\\xe9\\x80\\x9a\\xe8\\xb2\\xa8'",xf0 x9f x92 x0Bitcoin xe3 x83 x88 xe3 x83 xa9 xe3 x83 x3 xe3 x82 x6 xe3 x82 xaf xe3 x82 x7 xe3 x83 xa7 xe3 x83 x3 xe7 x8a x6 xe6 x3 x81 xf0 x9f x92 x0 n n xf0 x9f x94 xa7HashRate 9 890 323 221 256 KH s n xf0 x9f x94 x9cNetworkDiff 12 720 005 267 390 n xe2 x9a xa0 xe6 x9c xaa xe7 xa2 xa xe8 xaa x8d xe5 x8f x96 xe5 xc x95 xe6 x95 x0 0 xe4 x x6 n n itcoin ethereum cryptocurrency xe4 x xae xe6 x83 x3 xe9 x80 x9a xe8 x2 xa8
2019-11-17T01:00:08.000Z,"b'Nov 17, 2019 01:00:00 UTC | 8,509.60$ | 7,700.10\\xe2\\x82\\xac | 6,594.80\\xc2\\xa3 | #Bitcoin #BTC $BTC #crypto #financial #news https://t.co/PNZdYK3ORu'",Nov 17 2019 01 00 00 UTC 8 509 60 7 700 10 xe2 x82 xac 6 594 80 xc2 xa3 Bitcoin BTC BTC crypto financial news
2019-11-17T01:00:08.000Z,"\"b'1. Why #Quantum Supremacy will Disappear\\n2. Diversify #Crypto #Portfolios with \"\"Holy Grail\"\"\\xc2\\xa0Strategy\\n3. #SEC Policy\\xe2\\x80\\xa6 https://t.co/yu56he3jUt'\"",1 Why Quantum Supremacy will Disappear n2 Diversify Crypto Portfolios with Holy Grail xc2 xa0Strategy n3 SEC Policy xe2 x80 xa6
2019-11-17T01:00:08.000Z,"b'Blockchain Technology and Decentralized Governance: Is the State Still Necessary?. Marcella Atzori, Ph. D.*\\xe2\\x80\\xa6 https://t.co/RMeQ52RBR7'",Blockchain Technology and Decentralized Governance Is the State Still Necessary Marcella Atzori Ph D xe2 x80 xa6
2019-11-17T01:00:09.000Z,"b'#BTC: \\xe2\\x82\\xba48.909,00\\n#ETH: \\xe2\\x82\\xba1.049,92\\n#LTC:  \\xe2\\x82\\xba336,78\\n#XRP: \\xe2\\x82\\xba1,51\\n\\n17.11.19 - 04:00\\n\\n#Bitcoin #Litecoin #Ethereum #Ripple\\xe2\\x80\\xa6 https://t.co/7NwSYZJpHJ'",BTC xe2 x82 xa48 909 00 n ETH xe2 x82 xa1 049 92 n LTC xe2 x82 xa336 78 n XRP xe2 x82 xa1 51 n n17 11 19 04 00 n n Bitcoin Litecoin Ethereum Ripple xe2 x80 xa6
2019-11-17T01:00:12.000Z,"b'Nov 16, 2019 05:00PM #Bitcoin Price:\\nUSD 8658.20 | EUR 7679.07 | JPY 922561.06'",Nov 16 2019 05 00PM Bitcoin Price nUSD 8658 20 EUR 7679 07 JPY 922561 06
2019-11-17T01:00:14.000Z,"b'Top 100 avg 24h return: 1.0\\xc2\\xb13.3%; 73 up, 26 down\\n$BTC 0.7%  $ETH 1.6%\\nBest:\\n13.0% $SNX @synthetix_io\\n11.4% $EKT\\xe2\\x80\\xa6 https://t.co/WJ1MRUuSpU'",Top 100 avg 24h return 1 0 xc2 x13 3 73 up 26 down n BTC 0 7 ETH 1 6 nBest n13 0 SNX n11 4 EKT xe2 x80 xa6
2019-11-17T01:00:16.000Z,b'#bitcoin Earn FREE bitcoin with this easy strategy \xe2\x96\xb6 https://t.co/K41USsQ7H8 https://t.co/jsicYnJA95',itcoin Earn FREE itcoin with this easy strategy xe2 x96 x6
2019-11-17T01:00:19.000Z,b'#Bitcoin Traders Are Finding Creative Ways to Avoid KYC #Btc #Cryptocurrency #finance #forex #markets #fx $BTC\xe2\x80\xa6 https://t.co/dJ5ufveiXV',Bitcoin Traders Are Finding Creative Ways to Avoid KYC Btc Cryptocurrency finance forex markets fx BTC xe2 x80 xa6
2019-11-17T01:00:23.000Z,b'Come and have a chat with us on telegram https://t.co/8gG6IdZSuN and learn more about the best mining platform for\xe2\x80\xa6 https://t.co/nKdIfZV2cD',Come and have a chat with us on telegram and learn more aout the est mining platform for xe2 x80 xa6
2019-11-17T01:00:30.000Z,b'#\xe4\xbb\xae\xe6\x83\xb3\xe9\x80\x9a\xe8\xb2\xa8\xe9\x80\x9f\xe5\xa0\xb1 IRS\xe6\x8d\x9c\xe6\x9f\xbb\xe5\xae\x98\xe3\x82\x89\xe3\x80\x81\xe4\xbb\xae\xe6\x83\xb3\xe9\x80\x9a\xe8\xb2\xa8ATM\xe3\x82\x84\xe3\x82\xad\xe3\x82\xaa\xe3\x82\xb9\xe3\x82\xaf\xe3\x81\xab\xe7\x84\xa6\xe7\x82\xb9 #\xe4\xbb\xae\xe6\x83\xb3\xe9\x80\x9a\xe8\xb2\xa8 #\xe7\xb1\xb3\xe5\x9b\xbd #Bitcoin',xe4 x xae xe6 x83 x3 xe9 x80 x9a xe8 x2 xa8 xe9 x80 x9f xe5 xa0 x1 IRS xe6 x8d x9c xe6 x9f x xe5 xae x98 xe3 x82 x89 xe3 x80 x81 xe4 x xae xe6 x83 x3 xe9 x80 x9a xe8 x2 xa8ATM xe3 x82 x84 xe3 x82 xad xe3 x82 xaa xe3 x82 x9 xe3 x82 xaf xe3 x81 xa xe7 x84 xa6 xe7 x82 x9 xe4 x xae xe6 x83 x3 xe9 x80 x9a xe8 x2 xa8 xe7 x1 x3 xe5 x9 xd Bitcoin
2019-11-17T01:00:30.000Z,b'BTC hourly update\n$8513.05    |    +0.0015%\xf0\x9f\x93\x88\n$BTC #BTCUSD #Bitcoin',BTC hourly update n 8513 05 0 0015 xf0 x9f x93 x88 n BTC BTCUSD Bitcoin
2019-11-17T01:00:34.000Z,b'#bitcoin A very easy way to earn money. Do you want to get free bitcoin? Discover the magic \xe2\x96\xb6\xe2\x80\xa6 https://t.co/NXSsatkd4I',itcoin A very easy way to earn money Do you want to get free itcoin Discover the magic xe2 x96 x6 xe2 x80 xa6
2019-11-17T01:00:41.000Z,b'Facebook\xe2\x80\x99s Libra coin will be a useful and welcome on-ramp to #cryptocurrency for billions of underbanked people bu\xe2\x80\xa6 https://t.co/gq5kLlJGiG',Faceook xe2 x80 x99s Lira coin will e a useful and welcome on ramp to cryptocurrency for illions of underanked people u xe2 x80 xa6
2019-11-17T01:00:57.000Z,b'#bitcoin #futures #options: #movement and #market #impact in #2020 \n#instabitcoin #btc #ethereum #binance #bittrex\xe2\x80\xa6 https://t.co/voBo9z8faR',itcoin futures options movement and market impact in 2020 n instaitcoin tc ethereum inance ittrex xe2 x80 xa6
2019-11-17T01:00:59.000Z,"b'Top 5 #cryptocurrencies \\n Alert Time: 2019-11-17 04:00:57\\n#Bitcoin: $8,562.990\\n#Ethereum: $183.704\\n#XRP: $0.265\\xe2\\x80\\xa6 https://t.co/geSxWQ367u'",Top 5 cryptocurrencies n Alert Time 2019 11 17 04 00 57 n Bitcoin 8 562 990 n Ethereum 183 704 n XRP 0 265 xe2 x80 xa6
2019-11-17T01:01:01.000Z,b'Top 5 #crypto losers \n Alert Time: 2019-11-17 04:01:00\n#BLOCKv: $0.002\n#ZeusCrowdfunding: $0.000\n#USDX: $0.015\xe2\x80\xa6 https://t.co/VNNIYH52JX',Top 5 crypto losers n Alert Time 2019 11 17 04 01 00 n BLOCKv 0 002 n ZeusCrowdfunding 0 000 n USDX 0 015 xe2 x80 xa6
2019-11-17T01:01:01.000Z,b'Venture Capital TV Showcase \xe2\x80\x93 #FedTech https://t.co/Z3G39tRntD \n#ad #wsj #nytimes #reuters #bloomberg #forbes\xe2\x80\xa6 https://t.co/UrpLSgglvH',Venture Capital TV Showcase xe2 x80 x93 FedTech n ad wsj nytimes reuters loomerg fores xe2 x80 xa6
2019-11-17T01:01:07.000Z,b'1 #BTC (#Bitcoin) quotes:\n$8499.02/$8506.39 #Bitstamp\n$8499.90/$8500.16 #Kraken\n\xe2\x87\xa2$-6.49/$1.14',1 BTC Bitcoin quotes n 8499 02 8506 39 Bitstamp n 8499 90 8500 16 Kraken n xe2 x87 xa2 6 49 1 14
2019-11-17T01:01:13.000Z,b'\xe2\x82\xac 7752.06 #bitcoin',xe2 x82 xac 7752 06 itcoin
2019-11-17T01:01:13.000Z,b'#CryptoCotizaci\xc3\xb3n\n\xf0\x9f\x93\xa3 Precios actualizados a las 02:01:10.\n #Bitcoin #Ethereum #XRP #BitcoinCash #Tether #Litecoin\xe2\x80\xa6 https://t.co/962Qw9o4pY',CryptoCotizaci xc3 x3n n xf0 x9f x93 xa3 Precios actualizados a las 02 01 10 n Bitcoin Ethereum XRP BitcoinCash Tether Litecoin xe2 x80 xa6
2019-11-17T01:01:17.000Z,"b'\\xe2\\x82\\xbf Actual #Bitcoin #BTC price is \\n1 BTC = 7.752,064 \\xe2\\x82\\xac #EUR\\n1 BTC = 8.567,038 $ #USD\\nChange last 24 hours 0.86% \\xf0\\x9f\\x93\\x88\\nChange last hour 0.21% \\xf0\\x9f\\x93\\x88'",xe2 x82 xf Actual Bitcoin BTC price is n1 BTC 7 752 064 xe2 x82 xac EUR n1 BTC 8 567 038 USD nChange last 24 hours 0 86 xf0 x9f x93 x88 nChange last hour 0 21 xf0 x9f x93 x88
2019-11-17T01:01:19.000Z,b'@kraeol @TomCryptoBE @BitcoinSV2019 @_drgo @wisewizzz @bobbyclee Actually the bottom line is:\n\n0-conf\n\nAnd to back\xe2\x80\xa6 https://t.co/VhAKx4pBPT',Actually the ottom line is n n0 conf n nAnd to ack xe2 x80 xa6
2019-11-17T01:01:26.000Z,b'#crypto price changes last hour\n\n\xf0\x9f\x9a\x80\n$NPXS +50.16%\n$ENG +15.19%\n$XDN +14.41%\n\n\xf0\x9f\x8c\xa7\xef\xb8\x8f\n$IOST -8.04%\n$GAME -6.59%\n$VEE -6.56\xe2\x80\xa6 https://t.co/3BdOOFVgbz',crypto price changes last hour n n xf0 x9f x9a x80 n NPXS 50 16 n ENG 15 19 n XDN 14 41 n n xf0 x9f x8c xa7 xef x8 x8f n IOST 8 04 n GAME 6 59 n VEE 6 56 xe2 x80 xa6
2019-11-17T01:01:42.000Z,b'Hans Moog thinks he found the holy grail for consensus mechanism. Here is his final blogpost where he discusses att\xe2\x80\xa6 https://t.co/Nx13sO8Zb8',Hans Moog thinks he found the holy grail for consensus mechanism Here is his final logpost where he discusses att xe2 x80 xa6
2019-11-17T01:02:01.000Z,b'#crypto #tipping #point: #insider says #bitcoin #(btc) #users will #shift from #\xe2\x80\x98acquire to #defend\xe2\x80\x99 \n#instabtc\xe2\x80\xa6 https://t.co/R7tL6pgc2D',crypto tipping point insider says itcoin tc users will shift from xe2 x80 x98acquire to defend xe2 x80 x99 n instatc xe2 x80 xa6
2019-11-17T01:02:01.000Z,b'Los factores clave que las empresas de transporte deben considerar antes de lanzar aplicaciones de IoT -\xe2\x80\xa6 https://t.co/oA6GyNYG4o',Los factores clave que las empresas de transporte deen considerar antes de lanzar aplicaciones de IoT xe2 x80 xa6
2019-11-17T01:02:09.000Z,b'Bitcoin Traders Are Finding Creative Ways to Avoid KYC https://t.co/jvtr1TIJn1  #XBT #BTC #Bitcoin',Bitcoin Traders Are Finding Creative Ways to Avoid KYC XBT BTC Bitcoin
2019-11-17T01:02:15.000Z,b'ROMPIENDO: el hijo de George Bush recibi\xc3\xb3 $ 300K de OneCoin Scammer - https://t.co/JglUoJZh4f #cryptocurrencies #criptomonedas #bitcoin #btc',ROMPIENDO el hijo de George Bush recii xc3 x3 300K de OneCoin Scammer cryptocurrencies criptomonedas itcoin tc
2019-11-17T01:02:41.000Z,b'By end 2019 people will realise that $ALGO is the real #bitcoin for BINANCE:ALGOUSDT by ZonedOutDad $ALGO\xe2\x80\xa6 https://t.co/Jog1hPPplr',By end 2019 people will realise that ALGO is the real itcoin for BINANCE ALGOUSDT y ZonedOutDad ALGO xe2 x80 xa6
2019-11-17T01:02:50.000Z,"b'\\xe7\\x8f\\xbe\\xe5\\x9c\\xa8\\xe3\\x81\\xae1\\xe3\\x83\\x93\\xe3\\x83\\x83\\xe3\\x83\\x88\\xe3\\x82\\xb3\\xe3\\x82\\xa4\\xe3\\x83\\xb3\\xe3\\x81\\x82\\xe3\\x81\\x9f\\xe3\\x82\\x8a\\xe3\\x81\\xae\\xe5\\x80\\xa4\\xe6\\xae\\xb5\\xe3\\x81\\xaf925,949.9293\\xe5\\x86\\x86\\xe3\\x81\\xa7\\xe3\\x81\\x99\\xe3\\x80\\x82\\xe5\\x80\\xa4\\xe6\\xae\\xb5\\xe3\\x81\\xae\\xe5\\x8f\\x96\\xe5\\xbe\\x97\\xe6\\x97\\xa5\\xe6\\x99\\x82\\xe3\\x81\\xafNov 17, 2019 01:02:00 UTC\\xe3\\x81\\xa7\\xe3\\x81\\x99 #bitcoin #\\xe3\\x83\\x93\\xe3\\x83\\x83\\xe3\\x83\\x88\\xe3\\x82\\xb3\\xe3\\x82\\xa4\\xe3\\x83\\xb3'",xe7 x8f xe xe5 x9c xa8 xe3 x81 xae1 xe3 x83 x93 xe3 x83 x83 xe3 x83 x88 xe3 x82 x3 xe3 x82 xa4 xe3 x83 x3 xe3 x81 x82 xe3 x81 x9f xe3 x82 x8a xe3 x81 xae xe5 x80 xa4 xe6 xae x5 xe3 x81 xaf925 949 9293 xe5 x86 x86 xe3 x81 xa7 xe3 x81 x99 xe3 x80 x82 xe5 x80 xa4 xe6 xae x5 xe3 x81 xae xe5 x8f x96 xe5 xe x97 xe6 x97 xa5 xe6 x99 x82 xe3 x81 xafNov 17 2019 01 02 00 UTC xe3 x81 xa7 xe3 x81 x99 itcoin xe3 x83 x93 xe3 x83 x83 xe3 x83 x88 xe3 x82 x3 xe3 x82 xa4 xe3 x83 x3
2019-11-17T01:03:01.000Z,b'#bitcoin #traders are #finding #creative #ways to #avoid #kyc \n#instavenezuela #ethereum #ripplenews #trx #trading\xe2\x80\xa6 https://t.co/wz8Bo5mTml',itcoin traders are finding creative ways to avoid kyc n instavenezuela ethereum ripplenews trx trading xe2 x80 xa6
2019-11-17T01:03:46.000Z,"b'$bqx / $btc\\n\\nNo sign of a reversal, but we could still see a move from 467sat to 593sat to stay in the current chan\\xe2\\x80\\xa6 https://t.co/n18ZTN2Hkv'",qx tc n nNo sign of a reversal ut we could still see a move from 467sat to 593sat to stay in the current chan xe2 x80 xa6
2019-11-17T01:04:20.000Z,"b'LNKO Leader in #DeFi, releases new App, stay tuned for more info #blockchain #bitcoin #cryotocurrency https://t.co/1yChLuTHhL'",LNKO Leader in DeFi releases new App stay tuned for more info lockchain itcoin cryotocurrency
2019-11-17T01:04:28.000Z,b'@extstock @dcs_token #cryptocurrency #bitcoin',cryptocurrency itcoin
2019-11-17T01:04:35.000Z,"b'The #Bitcoin market is so bearish now, is there any good news to come? https://t.co/15AUYT1git https://t.co/Ziym3PyhJg'",The Bitcoin market is so earish now is there any good news to come
2019-11-17T01:04:56.000Z,"b'$4,676,047 are ready to liquidated! --- 100X at $8452.5 / 50X at $8369.5 / and 25X at $8207 --- Be ready for you Lo\\xe2\\x80\\xa6 https://t.co/mSDdeTdAvb'",4 676 047 are ready to liquidated 100X at 8452 5 50X at 8369 5 and 25X at 8207 Be ready for you Lo xe2 x80 xa6
2019-11-17T01:05:00.000Z,b'Ripple (XRP) contar\xc3\xa1 con nuevas innovaciones en este nuevo a\xc3\xb1o 2019 https://t.co/Rove5nZU2M #Criptomonedas #Bitcoin\xe2\x80\xa6 https://t.co/c275ZXbEXw',Ripple XRP contar xc3 xa1 con nuevas innovaciones en este nuevo a xc3 x1o 2019 Criptomonedas Bitcoin xe2 x80 xa6
2019-11-17T01:05:02.000Z,b'BTC Close: 8496.30 USD  \xe2\x96\xb216.28\nHigh: 8539.85   Low: 8456.34\nhttps://t.co/J6BpTFNrAG\n#bitcoin #btc #bitcoinsqueeze https://t.co/bB4oMvum75',BTC Close 8496 30 USD xe2 x96 x216 28 nHigh 8539 85 Low 8456 34 nhttps tc itcoinsqueeze
