2019-11-17T06:40:51.000Z,b'#Iran #Bitcoin what\xe2\x80\x99s your say? @swissborg #CHSB prepared for this? https://t.co/alaMsiSLKR',Iran Bitcoin what xe2 x80 x99s your say CHSB prepared for this
2019-11-17T06:41:13.000Z,b'How is #Bitcoin is better than Fiat Currency?\n\nhttps://t.co/GUGFO058nX',How is Bitcoin is etter than Fiat Currency n
2019-11-17T06:41:18.000Z,b'Golden\xf0\x9f\x8f\x85 Money\xf0\x9f\x92\xb2Team \xf0\x9f\xa4\x9d Presents\n\xf0\x9f\x8e\xb6GOOD MUSIC\xf0\x9f\x8e\xb6\xf0\x9f\x9a\xa8ALERT\xf0\x9f\x9a\xa8\n@TrillWillIsrael - Come Get It\n.\n.\n#goldenmoneyteam #Agodgmt\xe2\x80\xa6 https://t.co/w0rpzHbu2J',Golden xf0 x9f x8f x85 Money xf0 x9f x92 x2Team xf0 x9f xa4 x9d Presents n xf0 x9f x8e x6GOOD MUSIC xf0 x9f x8e x6 xf0 x9f x9a xa8ALERT xf0 x9f x9a xa8 n Come Get It n n n goldenmoneyteam Agodgmt xe2 x80 xa6
2019-11-17T06:41:43.000Z,"b'\\xe2\\x8f\\xb0 09:41:43 #Piyasa #D\\xc3\\xb6viz\\n\\xe2\\x96\\xac USD: 5,7453 \\xe2\\x82\\xba\\n\\xe2\\x96\\xac EUR: 6,3498 \\xe2\\x82\\xba\\n\\xe2\\x96\\xac GBP: 7,4139 \\xe2\\x82\\xba\\n\\xe2\\x96\\xac EUR/USD: 1,1052 $\\n\\xe2\\x96\\xbc Bitcoin: 8.503,3 $\\xe2\\x80\\xa6 https://t.co/PwQD5xWIiP'",xe2 x8f x0 09 41 43 Piyasa D xc3 x6viz n xe2 x96 xac USD 5 7453 xe2 x82 xa n xe2 x96 xac EUR 6 3498 xe2 x82 xa n xe2 x96 xac GBP 7 4139 xe2 x82 xa n xe2 x96 xac EUR USD 1 1052 n xe2 x96 xc Bitcoin 8 503 3 xe2 x80 xa6
2019-11-17T06:41:47.000Z,b'3 Extremely Bullish Analyst Predictions for Bitcoin  $BTC #Bitcoin  https://t.co/USoaDnPKjA',3 Extremely Bullish Analyst Predictions for Bitcoin BTC Bitcoin
2019-11-17T06:42:17.000Z,"b'#Bitcoin Binance 4h BTCUSDT:8475.76 RSI(34.77) StochRSI(56.13,52.24) macd(-69.08,-77.34) sma21:8561.74 sma50:8702.8\\xe2\\x80\\xa6 https://t.co/uJEUiB95k3'",Bitcoin Binance 4h BTCUSDT 8475 76 RSI 34 77 StochRSI 56 13 52 24 macd 69 08 77 34 sma21 8561 74 sma50 8702 8 xe2 x80 xa6
2019-11-17T06:42:17.000Z,b'\xf0\x9f\x97\xa3\xef\xb8\x8fDOES AGOD VERSE COMPETE WITH JAY-Z?\xf0\x9f\x91\x82Listen and find out (JAY-Z REMIX) @agodgmt (B12 BOMBER) \n.\n.\n.\xe2\x80\xa6 https://t.co/RqyhcsIKni',xf0 x9f x97 xa3 xef x8 x8fDOES AGOD VERSE COMPETE WITH JAY Z xf0 x9f x91 x82Listen and find out JAY Z REMIX B12 BOMBER n n n xe2 x80 xa6
2019-11-17T06:42:28.000Z,b'@TPinandhito @JDalmulder @humoalex @Muzank1 @Johno_98 @ciccio73it Receive 500 AMPX for early signup. 100 AMPX per r\xe2\x80\xa6 https://t.co/j2LV6E8KT9',Receive 500 AMPX for early signup 100 AMPX per r xe2 x80 xa6
2019-11-17T06:42:56.000Z,b'#ff #followfriday #followback #giveaway #contest #win #competition #crypto #ico #bitcoin #funny #photography #pets\xe2\x80\xa6 https://t.co/Q6jMTv5Vr9',ff followfriday followack giveaway contest win competition crypto ico itcoin funny photography pets xe2 x80 xa6
2019-11-17T06:43:00.000Z,b'@Cointelegraph #Bitcoin fixes this.',Bitcoin fixes this
2019-11-17T06:43:02.000Z,"\"b\"\"I've been learning how to trade fantasy crypto with Altcoin Fantasy. Join me and get 500 bonus ACF Points (redeemab\\xe2\\x80\\xa6 https://t.co/yzYilESDLI\"\"\"",I ve een learning how to trade fantasy crypto with Altcoin Fantasy Join me and get 500 onus ACF Points redeema xe2 x80 xa6
2019-11-17T06:43:22.000Z,"\"b\"\"#Binance's CEO: #Bitcoin is Small Today",Binance s CEO Bitcoin is Small Today
2019-11-17T06:43:45.000Z,"b'For the record:\\n\\nI Paul Colombo, am not #Satoshi #Nakamoto #Bitcoin https://t.co/qnIIvWYU8J'",For the record n nI Paul Colomo am not Satoshi Nakamoto Bitcoin
2019-11-17T06:44:20.000Z,"\"b\"\"Somebody's gonna buy this did up quick! #btfd $BTC #Bitcoin live chart courtesy of @RobinhoodApp \\nBUY OR SELL???\\xe2\\x80\\xa6 https://t.co/yhddqXoNXA\"\"\"",Someody s gonna uy this did up quick tfd BTC Bitcoin live chart courtesy of nBUY OR SELL xe2 x80 xa6
2019-11-17T06:44:27.000Z,"\"b\"\"Expand your knowledge base and make little cash with it \\xf0\\x9f\\x99\\x8f\\nTrust the process! \\n*The Major Academy*\\nHere's the link t\\xe2\\x80\\xa6 https://t.co/ubtv8vyhD8\"\"\"",Expand your knowledge ase and make little cash with it xf0 x9f x99 x8f nTrust the process n The Major Academy nHere s the link t xe2 x80 xa6
2019-11-17T06:44:35.000Z,b'#ff #followfriday #followback #giveaway #contest #win #competition #crypto #ico #bitcoin #funny #photography #pets\xe2\x80\xa6 https://t.co/JCxG18ppDD',ff followfriday followack giveaway contest win competition crypto ico itcoin funny photography pets xe2 x80 xa6
2019-11-17T06:44:47.000Z,b'#ff #followfriday #followback #giveaway #contest #win #competition #crypto #ico #bitcoin #funny #photography #pets\xe2\x80\xa6 https://t.co/Ho3abXZG5l',ff followfriday followack giveaway contest win competition crypto ico itcoin funny photography pets xe2 x80 xa6
2019-11-17T06:45:37.000Z,b'\xf0\x9f\x94\x84 Prices update in $USDT (1 hour):\n\n$BTC - 8481.93 $       (-0.07 %)\n$ETH - 181.35 $        (+0.02 %)\n$XRP - 0.26 $\xe2\x80\xa6 https://t.co/hkWmsG5hrw',xf0 x9f x94 x84 Prices update in USDT 1 hour n n BTC 8481 93 0 07 n ETH 181 35 0 02 n XRP 0 26 xe2 x80 xa6
2019-11-17T06:45:37.000Z,b'\xf0\x9f\x94\x84 Prices update in $USD (1 hour):\n\n$BTC   - 8473.1 $    (-0.13 %)\n$ETH   - 181.09 $    (-0.14 %)\n$XRP   - 0.26 $\xe2\x80\xa6 https://t.co/jrnHgdlXSI',xf0 x9f x94 x84 Prices update in USD 1 hour n n BTC 8473 1 0 13 n ETH 181 09 0 14 n XRP 0 26 xe2 x80 xa6
2019-11-17T06:45:39.000Z,b'\xf0\x9f\x94\x84 Prices update in $EUR (1 hour):\n\n$BTC   - 7671.8 \xe2\x82\xac  (-0.11 %)\n$ETH   - 163.95 \xe2\x82\xac  (-0.24 %)\n$XRP   - 0.24 \xe2\x82\xac    (-0\xe2\x80\xa6 https://t.co/bwLPHC0wOF',xf0 x9f x94 x84 Prices update in EUR 1 hour n n BTC 7671 8 xe2 x82 xac 0 11 n ETH 163 95 xe2 x82 xac 0 24 n XRP 0 24 xe2 x82 xac 0 xe2 x80 xa6
2019-11-17T06:45:51.000Z,b'\xf0\x9f\x94\x84 Prices update in $USDT (1 hour):\n\n$BTC - 8478.36 $ (-0.09 %)\n$ETH - 181.34 $  (-0.09 %)\n$XRP - 0.26 $    (-0.28 %\xe2\x80\xa6 https://t.co/jcWSyZKNZW',xf0 x9f x94 x84 Prices update in USDT 1 hour n n BTC 8478 36 0 09 n ETH 181 34 0 09 n XRP 0 26 0 28 xe2 x80 xa6
2019-11-17T06:46:18.000Z,b'U.S. Democratic presidential candidate Andrew Yang thinks cryptocurrencies experience fraud due to lack of regulati\xe2\x80\xa6 https://t.co/0Yq6yKIZOJ',U S Democratic presidential candidate Andrew Yang thinks cryptocurrencies experience fraud due to lack of regulati xe2 x80 xa6
2019-11-17T06:46:27.000Z,b'\xe4\xbb\x8a\xe3\x83\x9d\xe3\x83\xb3\xe3\x82\xb8\xe8\xa6\x81\xe7\xb4\xa0\xe3\x81\x8c\xe4\xb8\x80\xe5\x88\x87\xe3\x81\xaa\xe3\x81\x84\xe6\xa1\x88\xe4\xbb\xb6\xe3\x82\x92\xe7\xb2\xbe\xe6\x9f\xbb\xe3\x81\x97\xe3\x81\xa6\xe3\x81\x84\xe3\x81\xbe\xe3\x81\x99\xe3\x80\x82\n1\xe3\x80\x812\xe5\xb9\xb4\xe3\x81\xaf\xe5\xae\x89\xe5\xbf\x83\xe3\x81\x97\xe3\x81\xa6\xe9\x81\x8b\xe7\x94\xa8\xe3\x81\xa7\xe3\x81\x8d\xe3\x82\x8b\xe3\x81\xae\xe3\x81\xa7\xe8\x87\xaa\xe4\xbf\xa1\xe3\x81\x82\xe3\x82\x8a\xe3\x81\xa7\xe3\x81\x99\xe3\x80\x82\n\n\xe3\x80\x8ehttps://t.co/34ISHck2n7\xe3\x80\x8f\n\n#blockeco #\xe3\x83\x96\xe3\x83\xad\xe3\x83\x83\xe3\x82\xaf\xe3\x82\xa8\xe3\x82\xb3 #sblock #KOK #skytex\xe2\x80\xa6 https://t.co/5Wj74rcm6t',xe4 x x8a xe3 x83 x9d xe3 x83 x3 xe3 x82 x8 xe8 xa6 x81 xe7 x4 xa0 xe3 x81 x8c xe4 x8 x80 xe5 x88 x87 xe3 x81 xaa xe3 x81 x84 xe6 xa1 x88 xe4 x x6 xe3 x82 x92 xe7 x2 xe xe6 x9f x xe3 x81 x97 xe3 x81 xa6 xe3 x81 x84 xe3 x81 xe xe3 x81 x99 xe3 x80 x82 n1 xe3 x80 x812 xe5 x9 x4 xe3 x81 xaf xe5 xae x89 xe5 xf x83 xe3 x81 x97 xe3 x81 xa6 xe9 x81 x8 xe7 x94 xa8 xe3 x81 xa7 xe3 x81 x8d xe3 x82 x8 xe3 x81 xae xe3 x81 xa7 xe8 x87 xaa xe4 xf xa1 xe3 x81 x82 xe3 x82 x8a xe3 x81 xa7 xe3 x81 x99 xe3 x80 x82 n n xe3 x80 x8ehttps xe3 x83 x96 xe3 x83 xad xe3 x83 x83 xe3 x82 xaf xe3 x82 xa8 xe3 x82 x3 slock KOK skytex xe2 x80 xa6
2019-11-17T06:46:40.000Z,b'Do you think that social status clams like #firstclass have a negative impact socially? #bitcoin #appearance',Do you think that social status clams like firstclass have a negative impact socially itcoin appearance
2019-11-17T06:46:50.000Z,b'Scalping with Parabolic SAR and Fibonacci https://t.co/qmvz6XewY4 #prorealtime #trading #markets #stockmarket\xe2\x80\xa6 https://t.co/LHbYej4j1b',Scalping with Paraolic SAR and Fionacci prorealtime trading markets stockmarket xe2 x80 xa6
2019-11-17T06:47:05.000Z,b'\xf0\x9f\x94\x84 Prices update in $USD (1 hour):\n\n$BTC - 8473.9 $  (-0.15 %)\n$ETH - 181.09 $  (-0.17 %)\n$XRP - 0.26 $    (-0.32 %)\xe2\x80\xa6 https://t.co/nzQlvpVGHe',xf0 x9f x94 x84 Prices update in USD 1 hour n n BTC 8473 9 0 15 n ETH 181 09 0 17 n XRP 0 26 0 32 xe2 x80 xa6
2019-11-17T06:47:09.000Z,b'#ff #followfriday #followback #giveaway #contest #win #competition #crypto #ico #bitcoin #funny #photography #pets\xe2\x80\xa6 https://t.co/BTvXU45HkM',ff followfriday followack giveaway contest win competition crypto ico itcoin funny photography pets xe2 x80 xa6
2019-11-17T06:47:40.000Z,b'\xe3\x81\xbe\xe3\x81\xa0\xe3\x81\xbe\xe3\x81\xa0\xe5\xa7\x8b\xe3\x81\xbe\xe3\x81\xa3\xe3\x81\x9f\xe3\x81\xb0\xe3\x81\x8b\xe3\x82\x8a....\xe4\xbb\x8a\xe3\x81\x99\xe3\x81\x90\xe8\xb2\xb7\xe3\x81\xa3\xe3\x81\xa6\xe3\x82\xb9\xe3\x83\x86\xe3\x83\xbc\xe3\x82\xad\xe3\x83\xb3\xe3\x82\xb0\xef\xbc\x81\xef\xbc\x81\n #cennz #centrality #centrapay #\xe3\x82\xbb\xe3\x83\xb3\xe3\x83\x88\xe3\x83\xa9\xe3\x83\xaa\xe3\x83\x86\xe3\x82\xa3 #\xe3\x82\xb9\xe3\x83\x86\xe3\x83\xbc\xe3\x82\xad\xe3\x83\xb3\xe3\x82\xb0 #cryptocurrency #bitcoin #btc #\xe4\xbb\xae\xe6\x83\xb3\xe9\x80\x9a\xe8\xb2\xa8\xe2\x80\xa6 https://t.co/Agzm5Z3bFB',xe3 x81 xe xe3 x81 xa0 xe3 x81 xe xe3 x81 xa0 xe5 xa7 x8 xe3 x81 xe xe3 x81 xa3 xe3 x81 x9f xe3 x81 x0 xe3 x81 x8 xe3 x82 x8a xe4 x x8a xe3 x81 x99 xe3 x81 x90 xe8 x2 x7 xe3 x81 xa3 xe3 x81 xa6 xe3 x82 x9 xe3 x83 x86 xe3 x83 xc xe3 x82 xad xe3 x83 x3 xe3 x82 x0 xef xc x81 xef xc x81 n cennz centrality centrapay xe3 x82 x xe3 x83 x3 xe3 x83 x88 xe3 x83 xa9 xe3 x83 xaa xe3 x83 x86 xe3 x82 xa3 xe3 x82 x9 xe3 x83 x86 xe3 x83 xc xe3 x82 xad xe3 x83 x3 xe3 x82 x0 cryptocurrency itcoin tc xe4 x xae xe6 x83 x3 xe9 x80 x9a xe8 x2 xa8 xe2 x80 xa6
2019-11-17T06:47:45.000Z,"b'#Ripple Protocol Developer Jed McCaleb On Discovering #Bitcoin, Founding Mt. Gox, And Launching #Stellar\\xe2\\x80\\xa6 https://t.co/AsKd5J6Xxm'",Ripple Protocol Developer Jed McCale On Discovering Bitcoin Founding Mt Gox And Launching Stellar xe2 x80 xa6
2019-11-17T06:48:11.000Z,"b'@Barclaycard You may have beaten me into bankruptcy, but your days are still numbered.\\n\\n#Crypto #Bitcoin #EatTheRich'",You may have eaten me into ankruptcy ut your days are still numered n n Crypto Bitcoin EatTheRich
2019-11-17T06:48:23.000Z,b'Me pregunto si alg\xc3\xban d\xc3\xada servir\xc3\xa1n para algo las #altcoins/#shitcoins que tengo como:\n\n#Doge\n #ETN\n#PundiX\n#BNB\n#ADA\xe2\x80\xa6 https://t.co/osdgjb5pKX',Me pregunto si alg xc3 xan d xc3 xada servir xc3 xa1n para algo las altcoins shitcoins que tengo como n n Doge n ETN n PundiX n BNB n ADA xe2 x80 xa6
2019-11-17T06:49:11.000Z,"\"b\"\"The #Bamboo platform can automatically rebalance users' portfolio",The Bamoo platform can automatically realance users portfolio
2019-11-17T06:50:02.000Z,"b'Top 5 #cryptocurrencies \\n Alert Time: 2019-11-17 09:50:02\\n#Bitcoin: $8,536.684\\n#Ethereum: $182.580\\n#XRP: $0.264\\xe2\\x80\\xa6 https://t.co/slXdu4UdnO'",Top 5 cryptocurrencies n Alert Time 2019 11 17 09 50 02 n Bitcoin 8 536 684 n Ethereum 182 580 n XRP 0 264 xe2 x80 xa6
2019-11-17T06:50:12.000Z,b'Benefit Coordinator Entry Level Manager - Pappas Partners NY - [ \xe2\x9e\xa1 https://t.co/9YAvhowocN ] #Agile #Scrum #Agile\xe2\x80\xa6 https://t.co/TaCPpHB8mx',Benefit Coordinator Entry Level Manager Pappas Partners NY xe2 x9e xa1 Agile Scrum Agile xe2 x80 xa6
2019-11-17T06:50:30.000Z,"b'Digital Agile Scrum Master, CRM, Dynamics365 - [ \\xf0\\x9f\\x93\\x8b More Info  https://t.co/g3pEVJWn0U ] #Agile #Scrum #Agile\\xe2\\x80\\xa6 https://t.co/DnqFK7DYMD'",Digital Agile Scrum Master CRM Dynamics365 xf0 x9f x93 x8 More Info Agile Scrum Agile xe2 x80 xa6
2019-11-17T06:51:07.000Z,"b'Senior Agile Project Manager - Southern Lights ( Bristol, UK )  - [ \\xf0\\x9f\\x93\\x8b More Info  https://t.co/qGnkdee0EG ] #Agile\\xe2\\x80\\xa6 https://t.co/lcTg7DGOBE'",Senior Agile Project Manager Southern Lights Bristol UK xf0 x9f x93 x8 More Info Agile xe2 x80 xa6
2019-11-17T06:51:08.000Z,b'Serbest #Piyasa\n\nTarih: 16.11.2019 23:59:58\nDolar: \xe2\x82\xba5.7449\nEuro: \xe2\x82\xba6.3531\n24 Ayar Gram: \xe2\x82\xba270.97\n22 Ayar Gram: \xe2\x82\xba247.1\xe2\x80\xa6 https://t.co/iTNYjYWlXF',Serest Piyasa n nTarih 16 11 2019 23 59 58 nDolar xe2 x82 xa5 7449 nEuro xe2 x82 xa6 3531 n24 Ayar Gram xe2 x82 xa270 97 n22 Ayar Gram xe2 x82 xa247 1 xe2 x80 xa6
2019-11-17T06:51:09.000Z,b'Bitcoin Falls Through Key Average as Traditional Markets Hit Record Highs #CryptoCurrency #Bitcoin #Crypto via\xe2\x80\xa6 https://t.co/J2at7jC4eh',Bitcoin Falls Through Key Average as Traditional Markets Hit Record Highs CryptoCurrency Bitcoin Crypto via xe2 x80 xa6
2019-11-17T06:52:35.000Z,b'$ETH looks set to break 2 year bear market against $BTC\n\nhttps://t.co/BE6U5pEZF0\n\n#cryptocurrency #bitcoin #ethereum #blockchain #crypto',ETH looks set to reak 2 year ear market against BTC n nhttps itcoin ethereum lockchain crypto
2019-11-17T06:52:52.000Z,"b'\\xe0\\xa6\\x86\\xe0\\xa6\\xaa\\xe0\\xa6\\xa8\\xe0\\xa6\\xbf \\xe0\\xa6\\x95\\xe0\\xa6\\xbf https://t.co/7PyzuRKmAq, Daraz, Bikroy, Picaboo \\xe0\\xa6\\xb0 \\xe0\\xa6\\xae\\xe0\\xa6\\xa4\\xe0\\xa7\\x8b \\xe0\\xa6\\x87-\\xe0\\xa6\\x95\\xe0\\xa6\\xae\\xe0\\xa6\\xbe\\xe0\\xa6\\xb0\\xe0\\xa7\\x8d\\xe0\\xa6\\xb8 \\xe0\\xa6\\x85\\xe0\\xa6\\xa5\\xe0\\xa6\\xac\\xe0\\xa6\\xbe \\xe0\\xa6\\x85\\xe0\\xa6\\xa8\\xe0\\xa6\\xb2\\xe0\\xa6\\xbe\\xe0\\xa6\\x87\\xe0\\xa6\\xa8 \\xe0\\xa6\\xae\\xe0\\xa6\\xbe\\xe0\\xa6\\xb0\\xe0\\xa7\\x8d\\xe0\\xa6\\x95\\xe0\\xa7\\x87\\xe0\\xa6\\x9f\\xe0\\xa6\\xaa\\xe0\\xa7\\x8d\\xe0\\xa6\\xb2\\xe0\\xa7\\x87\\xe0\\xa6\\xb8 \\xe0\\xa6\\xac\\xe0\\xa6\\xbe\\xe0\\xa6\\xa8\\xe0\\xa6\\xbe\\xe0\\xa6\\xa4\\xe0\\xa7\\x87 \\xe0\\xa6\\x9a\\xe0\\xa6\\xbe\\xe0\\xa6\\x9a\\xe0\\xa7\\x8d\\xe0\\xa6\\x9b\\xe0\\xa7\\x87\\xe0\\xa6\\xa8?\\xe2\\x80\\xa6 https://t.co/jEzOdX0g1E'",xe0 xa6 x86 xe0 xa6 xaa xe0 xa6 xa8 xe0 xa6 xf xe0 xa6 x95 xe0 xa6 xf Daraz Bikroy Picaoo xe0 xa6 x0 xe0 xa6 xae xe0 xa6 xa4 xe0 xa7 x8 xe0 xa6 x87 xe0 xa6 x95 xe0 xa6 xae xe0 xa6 xe xe0 xa6 x0 xe0 xa7 x8d xe0 xa6 x8 xe0 xa6 x85 xe0 xa6 xa5 xe0 xa6 xac xe0 xa6 xe xe0 xa6 x85 xe0 xa6 xa8 xe0 xa6 x2 xe0 xa6 xe xe0 xa6 x87 xe0 xa6 xa8 xe0 xa6 xae xe0 xa6 xe xe0 xa6 x0 xe0 xa7 x8d xe0 xa6 x95 xe0 xa7 x87 xe0 xa6 x9f xe0 xa6 xaa xe0 xa7 x8d xe0 xa6 x2 xe0 xa7 x87 xe0 xa6 x8 xe0 xa6 xac xe0 xa6 xe xe0 xa6 xa8 xe0 xa6 xe xe0 xa6 xa4 xe0 xa7 x87 xe0 xa6 x9a xe0 xa6 xe xe0 xa6 x9a xe0 xa7 x8d xe0 xa6 x9 xe0 xa7 x87 xe0 xa6 xa8 xe2 x80 xa6
2019-11-17T06:53:25.000Z,b'If #BTC bounce back up when it reaches $7570k then it will rise again but if it crosses down then it will continue\xe2\x80\xa6 https://t.co/cHa0lZyHRD',If BTC ounce ack up when it reaches 7570k then it will rise again ut if it crosses down then it will continue xe2 x80 xa6
