2019-11-17T09:06:27.000Z,b'Which day trading indicator is best https://t.co/vYVZN2HG60 #forex #money #bitcoin https://t.co/h75HRsNBQx\xe2\x80\xa6 https://t.co/vLy23PJqH4',Which day trading indicator is est forex money itcoin
2019-11-17T09:06:28.000Z,b'Purchased some more $DCR which was tough because I never like to buy after a nice run. Still feels undervalued thou\xe2\x80\xa6 https://t.co/ugIBOeHJlb',Purchased some more DCR which was tough ecause I never like to uy after a nice run Still feels undervalued thou xe2 x80 xa6
2019-11-17T09:06:54.000Z,b'Using #Bitcoin at #Bovada This article will guide you through using bitcoins to play at Bovada and other online cas\xe2\x80\xa6 https://t.co/qI0ji8BPTH',Using Bitcoin at Bovada This article will guide you through using itcoins to play at Bovada and other online cas xe2 x80 xa6
2019-11-17T09:07:16.000Z,b'FOMO season has definitely come as I told you before...\n\nMany examples can be listed:\n#iExec #RLC\n#Aave #Lend\xe2\x80\xa6 https://t.co/pk4S2wHh0l',FOMO season has definitely come as I told you efore n nMany examples can e listed n iExec RLC n Aave Lend xe2 x80 xa6
2019-11-17T09:07:21.000Z,b'The latest The Online casino Daily! https://t.co/bwdeo1HeEF Thanks to @akynnis @vy_ales #bitcoin #onlinecasino',The latest The Online casino Daily Thanks to itcoin onlinecasino
2019-11-17T09:07:30.000Z,b'BestChange - Claim free Bitcoin and get e-currency exchange rates! https://t.co/xriaOAgc43 #bitcoin \xf0\x9f\x98\x8d',BestChange Claim free Bitcoin and get e currency exchange rates itcoin xf0 x9f x98 x8d
2019-11-17T09:07:30.000Z,"\"b\"\"Hey guys I need some help! :) (Reddit #Bitcoin) \\n\\nI'm a NSFW model who makes videos and pictures. I pay taxes and w\\xe2\\x80\\xa6 https://t.co/mBQ32jwMlV\"\"\"",Hey guys I need some help Reddit Bitcoin n nI m a NSFW model who makes videos and pictures I pay taxes and w xe2 x80 xa6
2019-11-17T09:07:41.000Z,b'Proof-of-Authority Algorithm Use Cases Grow: From Pharma to Games https://t.co/flGy3HCXnw #Bitcoin',Proof of Authority Algorithm Use Cases Grow From Pharma to Games Bitcoin
2019-11-17T09:07:46.000Z,b'https://t.co/LAMfzv1SQe yap\xc4\xb1lan zalime sessiz kalma t\xc3\xbcrkiye payla\xc5\x9f herkes g\xc3\xb6rs\xc3\xbcn #zalimesessizkalma #uygurT\xc3\xbcrkleri\xe2\x80\xa6 https://t.co/zpKpCrwTpf',yap xc4 x1lan zalime sessiz kalma t xc3 xcrkiye payla xc5 x9f herkes g xc3 x6rs xc3 xcn zalimesessizkalma uygurT xc3 xcrkleri xe2 x80 xa6
2019-11-17T09:07:47.000Z,b'#Bitcoin \xf0\x9f\x93\x88 \n\n\xe2\x96\x93\xe2\x96\x93\xe2\x96\x93\xe2\x96\x93\xe2\x96\x93\xe2\x96\x93\xe2\x96\x93\xe2\x96\x91\xe2\x96\x91\xe2\x96\x91\xe2\x96\x91\xe2\x96\x91\xe2\x96\x91\xe2\x96\x91\xe2\x96\x91 44%\n\n price: $8520.33',Bitcoin xf0 x9f x93 x88 n n xe2 x96 x93 xe2 x96 x93 xe2 x96 x93 xe2 x96 x93 xe2 x96 x93 xe2 x96 x93 xe2 x96 x93 xe2 x96 x91 xe2 x96 x91 xe2 x96 x91 xe2 x96 x91 xe2 x96 x91 xe2 x96 x91 xe2 x96 x91 xe2 x96 x91 44 n n price 8520 33
2019-11-17T09:08:07.000Z,"b'Tom Lee Acknowledges the Bitcoin Price Won\\xe2\\x80\\x99t Hit $40,000 Soon https://t.co/Z5erJvs9uP\\n#bitcoin #crypto #blockchain\\xe2\\x80\\xa6 https://t.co/96gYarU4vk'",Tom Lee Acknowledges the Bitcoin Price Won xe2 x80 x99t Hit 40 000 Soon crypto lockchain xe2 x80 xa6
2019-11-17T09:08:24.000Z,b'1 #satoshi =        0.03302 $KZT \xf0\x9f\x87\xb0\xf0\x9f\x87\xbf\n0.00543 $RUB \xf0\x9f\x87\xb7\xf0\x9f\x87\xba   0.01321 $PKR \xf0\x9f\x87\xb5\xf0\x9f\x87\xb0\n0.00131 $MVR \xf0\x9f\x87\xb2\xf0\x9f\x87\xbb   0.80830 $UZS \xf0\x9f\x87\xba\xf0\x9f\x87\xbf\n0.00009\xe2\x80\xa6 https://t.co/4GE8M7y1Uj',1 satoshi 0 03302 KZT xf0 x9f x87 x0 xf0 x9f x87 xf n0 00543 RUB xf0 x9f x87 x7 xf0 x9f x87 xa 0 01321 PKR xf0 x9f x87 x5 xf0 x9f x87 x0 n0 00131 MVR xf0 x9f x87 x2 xf0 x9f x87 x 0 80830 UZS xf0 x9f x87 xa xf0 x9f x87 xf n0 00009 xe2 x80 xa6
2019-11-17T09:08:41.000Z,b'#EMJ #IEO #Crypto #Blockchain #ethereum #bitcoin #ether #cryptocurrency #tokensale https://t.co/QVtPzeIAsm https://t.co/PaDaLttaov',EMJ IEO Crypto Blockchain ethereum itcoin ether cryptocurrency tokensale
2019-11-17T09:09:00.000Z,b'Bitcoin DOCU Zondag! \xf0\x9f\x8e\xac\n\nhttps://t.co/xHwp87LY0W #cryptocollege #bitcoin #btc #ethereum #eth #fintech #blockchain\xe2\x80\xa6 https://t.co/oNF26Q6gI6',Bitcoin DOCU Zondag xf0 x9f x8e xac n nhttps cryptocollege itcoin tc ethereum eth fintech lockchain xe2 x80 xa6
2019-11-17T09:09:11.000Z,"b'#Entrevistas Carlos Rold\\xc3\\xa1n, el fundador de @SatoshisGames, considera que un #videojuego ser\\xc3\\xada clave para la adopci\\xc3\\xb3\\xe2\\x80\\xa6 https://t.co/aEafVSPOUf'",Entrevistas Carlos Rold xc3 xa1n el fundador de considera que un videojuego ser xc3 xada clave para la adopci xc3 x3 xe2 x80 xa6
2019-11-17T09:09:11.000Z,b'Entre el 9 y el 15 de noviembre el mercado de las #criptomonedas se mantuvo fluctuante\xf0\x9f\x93\x8a\xf0\x9f\x93\xb0. Varios criptoactivos regi\xe2\x80\xa6 https://t.co/2K2k1Orw0J',Entre el 9 y el 15 de noviemre el mercado de las criptomonedas se mantuvo fluctuante xf0 x9f x93 x8a xf0 x9f x93 x0 Varios criptoactivos regi xe2 x80 xa6
2019-11-17T09:09:12.000Z,b'Los mezcladores de #bitcoin agregan una capa adicional de anonimato a las transacciones en la red. Aprende m\xc3\xa1s al r\xe2\x80\xa6 https://t.co/7tgNR6ymRo',Los mezcladores de itcoin agregan una capa adicional de anonimato a las transacciones en la red Aprende m xc3 xa1s al r xe2 x80 xa6
2019-11-17T09:09:15.000Z,"b'#Ficci\\xc3\\xb3n \\xc2\\xa1Contin\\xc3\\xbaa la segunda parte! Los misteriosos #hackers han robado millones de d\\xc3\\xb3lares, pero quiz\\xc3\\xa1s hay algui\\xe2\\x80\\xa6 https://t.co/nk5JNYIK1w'",Ficci xc3 x3n xc2 xa1Contin xc3 xaa la segunda parte Los misteriosos hackers han roado millones de d xc3 x3lares pero quiz xc3 xa1s hay algui xe2 x80 xa6
2019-11-17T09:09:16.000Z,"b'Digamos que quieres invertir 4.000 d\\xc3\\xb3lares en #BTC, pero s\\xc3\\xb3lo tienes depositados 2.000. La casa de cambio puede pre\\xe2\\x80\\xa6 https://t.co/uk17SHQc1e'",Digamos que quieres invertir 4 000 d xc3 x3lares en BTC pero s xc3 x3lo tienes depositados 2 000 La casa de camio puede pre xe2 x80 xa6
2019-11-17T09:09:17.000Z,"b'#Opini\\xc3\\xb3n Las #tecnolog\\xc3\\xadas no cambian al hombre \\xe2\\x80\\x94o al menos no lo hacen por arte de magia\\xe2\\x80\\x94, sino m\\xc3\\xa1s bien son aquell\\xe2\\x80\\xa6 https://t.co/pPnwEhG4eF'",Opini xc3 x3n Las tecnolog xc3 xadas no camian al homre xe2 x80 x94o al menos no lo hacen por arte de magia xe2 x80 x94 sino m xc3 xa1s ien son aquell xe2 x80 xa6
2019-11-17T09:09:17.000Z,"b'\\xc2\\xbfSab\\xc3\\xadas que a pesar de que #SatoshiNakamoto, creador de #Bitcoin, se comunic\\xc3\\xb3 con otros desde 2008, no se sabe nada\\xe2\\x80\\xa6 https://t.co/zTkUARcEVV'",xc2 xfSa xc3 xadas que a pesar de que SatoshiNakamoto creador de Bitcoin se comunic xc3 x3 con otros desde 2008 no se sae nada xe2 x80 xa6
2019-11-17T09:09:21.000Z,b'#pazar #BizGeliyoruz #iskandinav #ivanasert #Ales #FatihErbakan #bitcoin #gazetesozcu #Iran #StrictlySpoiler https://t.co/dqzTYFKkFj',pazar BizGeliyoruz iskandinav ivanasert Ales FatihErakan itcoin gazetesozcu Iran StrictlySpoiler
2019-11-17T09:09:46.000Z,"b'Bitcoin ATMs Worldwide Hit New Milestone, Surpassing 6,000 #Austria #btm #bitcoin #a #btc https://t.co/Q46fYx9hfa'",Bitcoin ATMs Worldwide Hit New Milestone Surpassing 6 000 Austria tm itcoin a tc
2019-11-17T09:09:58.000Z,"b'\\xe2\\x80\\x9cHow To Shortcut Your Learning Curve To Trade Successfully &amp; Get Market Tested, Proven, Strategies Without Making C\\xe2\\x80\\xa6 https://t.co/D4iikcQEQA'",xe2 x80 x9cHow To Shortcut Your Learning Curve To Trade Successfully amp Get Market Tested Proven Strategies Without Making C xe2 x80 xa6
2019-11-17T09:10:02.000Z,b'Tecnologia Blockchain E Governance Decentralizzata: Lo Stato \xc3\x88 Ancora Necessario? Marcella\xc2\xa0Atzori\nBlockchain Techno\xe2\x80\xa6 https://t.co/B6FMZ4yYUd',Tecnologia Blockchain E Governance Decentralizzata Lo Stato xc3 x88 Ancora Necessario Marcella xc2 xa0Atzori nBlockchain Techno xe2 x80 xa6
2019-11-17T09:10:03.000Z,"b'Top 5 #cryptocurrencies \\n Alert Time: 2019-11-17 12:10:02\\n#Bitcoin: $8,571.150\\n#Ethereum: $183.912\\n#XRP: $0.264\\xe2\\x80\\xa6 https://t.co/RWQPnrlM2r'",Top 5 cryptocurrencies n Alert Time 2019 11 17 12 10 02 n Bitcoin 8 571 150 n Ethereum 183 912 n XRP 0 264 xe2 x80 xa6
2019-11-17T09:10:04.000Z,"b'Bitcoin BTC Current Price:\\n$8,573.78\\n1 Hour: 0.62 % | 24 Hours: 0.35 % | 7 Days: -3.29 %\\n#btc #bitcoin'",Bitcoin BTC Current Price n 8 573 78 n1 Hour 0 62 24 Hours 0 35 7 Days 3 29 n tc itcoin
2019-11-17T09:10:15.000Z,b'Bitcoin is passion. Bitcoin is rage. #Bitcoin is this video \xf0\x9f\x91\x87\n\nhttps://t.co/B5uk6XZtMg',Bitcoin is passion Bitcoin is rage Bitcoin is this video xf0 x9f x91 x87 n
2019-11-17T09:10:18.000Z,b'Globaler Partner des Premier League Teams \xc3\xb6ffnet 13 Krypto-M\xc3\xa4rkte im US-Markt f\xc3\xbcr seinen CoinDeal Token CoinDeal -\xe2\x80\xa6 https://t.co/z34c2NLbIW',Gloaler Partner des Premier League Teams xc3 x6ffnet 13 Krypto M xc3 xa4rkte im US Markt f xc3 xcr seinen CoinDeal Token CoinDeal xe2 x80 xa6
2019-11-17T09:10:29.000Z,"b'Fed + ECB will buy $420bn assets next 6 months, the equivalent of 49 million BTC (Reddit #Bitcoin) \\n\\n   submitted b\\xe2\\x80\\xa6 https://t.co/VnYSk0FT6y'",Fed ECB will uy 420n assets next 6 months the equivalent of 49 million BTC Reddit Bitcoin n n sumitted xe2 x80 xa6
2019-11-17T09:10:32.000Z,"\"b\"\"Aaaaand it is going up now. Nice play whales. First wiping out all longs and then moving toward flip long. Let's se\\xe2\\x80\\xa6 https://t.co/smQYJ7iBDb\"\"\"",Aaaaand it is going up now Nice play whales First wiping out all longs and then moving toward flip long Let s se xe2 x80 xa6
2019-11-17T09:10:40.000Z,b'https://t.co/YfOv7H4fVT\n\n#pazar #kykbursu #BizGeliyoruz #iskandinav #ivanasert #Ales #FatihErbakan #bitcoin\xe2\x80\xa6 https://t.co/lqPbuzdmYi',kykursu BizGeliyoruz iskandinav ivanasert Ales FatihErakan itcoin xe2 x80 xa6
2019-11-17T09:10:46.000Z,"b'#Bitcoin #ATMs Worldwide Hit New Milestone, Surpassing 6,000 reported by https://t.co/2d4GbbB3GC ---- #Adoption #Cryptocurrencies'",Bitcoin ATMs Worldwide Hit New Milestone Surpassing 6 000 reported y Adoption Cryptocurrencies
2019-11-17T09:10:50.000Z,b'1 BTC Price: Bitstamp 8513.10 USD Coinbase  USD #btc #bitcoin 2019-11-17 04:10 https://t.co/EaqMH0oFmf',1 BTC Price Bitstamp 8513 10 USD Coinase USD tc itcoin 2019 11 17 04 10
2019-11-17T09:11:10.000Z,"b'Reel Splitter Slot Welcome to REEL SPLITTER, a fresh take on classic slot machines one may find in Las Vegas. The g\\xe2\\x80\\xa6 https://t.co/axHKV6ykMs'",Reel Splitter Slot Welcome to REEL SPLITTER a fresh take on classic slot machines one may find in Las Vegas The g xe2 x80 xa6
2019-11-17T09:11:36.000Z,"b'#bitcoin \\n\\n\\xe2\\x80\\xa2 Price today: $8,587\\n\\xe2\\x80\\xa2 Market Cap: $155,019,013,012\\n\\xe2\\x80\\xa2 Dominance: 65,9%\\n\\n\\xe2\\x80\\xa2 BTC in existence: 18,052,125\\xe2\\x80\\xa6 https://t.co/ru6ZaiQgA7'",itcoin n n xe2 x80 xa2 Price today 8 587 n xe2 x80 xa2 Market Cap 155 019 013 012 n xe2 x80 xa2 Dominance 65 9 n n xe2 x80 xa2 BTC in existence 18 052 125 xe2 x80 xa6
2019-11-17T09:11:51.000Z,"b'It would be auspicious to buy at https://t.co/bWQefrnx5Y \\xc2\\xa36,804.76 per BTC. (BPI +2.91%) #buy #bitcoin #banktrans'",It would e auspicious to uy at xc2 xa36 804 76 per BTC BPI 2 91 uy itcoin anktrans
2019-11-17T09:12:10.000Z,"b'Tom Lee Acknowledges the Bitcoin Price Won\\xe2\\x80\\x99t Hit $40,000 Soon https://t.co/0vDYK6a7Gj\\n#bitcoin #crypto #blockchain\\xe2\\x80\\xa6 https://t.co/LRxaOE0QOO'",Tom Lee Acknowledges the Bitcoin Price Won xe2 x80 x99t Hit 40 000 Soon crypto lockchain xe2 x80 xa6
2019-11-17T09:12:19.000Z,"b'Espectacular d\\xc3\\xada, que preciosidad el sitio. Totalmente recomendado gente.\\n_\\n_\\n_\\n#forex #trading #bitcoin #portugal\\xe2\\x80\\xa6 https://t.co/DvS32BjGq2'",Espectacular d xc3 xada que preciosidad el sitio Totalmente recomendado gente n n n n forex trading itcoin portugal xe2 x80 xa6
2019-11-17T09:13:08.000Z,b'#pazar en sevdi\xc4\x9fim \xf0\x9f\x92\x9e\n#BizGeliyoruz nereye?\xf0\x9f\xa7\x90\n#Iran bunlar iyi g\xc3\xbcnlerin\xf0\x9f\x92\x83\n#\xeb\xb0\xa9\xed\x83\x84\xec\x86\x8c\xeb\x85\x84\xeb\x8b\xa8 bende isterim\xf0\x9f\x99\x8f\n#ivanasert dahasertini\xe2\x80\xa6 https://t.co/sYKFUJ2d3k',pazar en sevdi xc4 x9fim xf0 x9f x92 x9e n BizGeliyoruz nereye xf0 x9f xa7 x90 n Iran unlar iyi g xc3 xcnlerin xf0 x9f x92 x83 n xe x0 xa9 xed x83 x84 xec x86 x8c xe x85 x84 xe x8 xa8 ende isterim xf0 x9f x99 x8f n ivanasert dahasertini xe2 x80 xa6
