2019-11-17T08:43:21.000Z,"b'@TuurDemeester But Tuur, whagt will happen to these things without the state, like all true libertarians in the\\xe2\\x80\\xa6 https://t.co/a0M859D1xa'",But Tuur whagt will happen to these things without the state like all true liertarians in the xe2 x80 xa6
2019-11-17T08:43:43.000Z,"\"b'\"\"I definitely do not advocate #Bitcoin and #Ethereum becoming world\\'s unit of accounts.\"\" by @VitalikButerin'\"",I definitely do not advocate Bitcoin and Ethereum ecoming world s unit of accounts y
2019-11-17T08:44:04.000Z,b'@FmFrancoise @nodexl @mihkal @BonnieBaehr @VivianFrancos @tutormentorteam @smr_foundation @ConnectedAction\xe2\x80\xa6 https://t.co/wHjUTS2Wm6',xe2 x80 xa6
2019-11-17T08:44:19.000Z,b'Father of C++ Dislikes Bitcoin Being Based on His Programming Language #cpp #bitcoin #programming #language https://t.co/vZfk6EStMR',Father of C Dislikes Bitcoin Being Based on His Programming Language cpp itcoin programming language
2019-11-17T08:45:00.000Z,"b'Coinbase recently decided that it is safe to reduce its confirmation times for #Bitcoin, #Zcash, and\\xe2\\x80\\xa6 https://t.co/5wsD3WLCr4'",Coinase recently decided that it is safe to reduce its confirmation times for Bitcoin Zcash and xe2 x80 xa6
2019-11-17T08:45:13.000Z,b'Sharp drop was denied completely.\n#bitcoin #bitcoincash #ripple #ethereum #btc #bch #xrp #eth #ltc #etc #zec #xmr\xe2\x80\xa6 https://t.co/nPb9D4qWnd',Sharp drop was denied completely n itcoin itcoincash ripple ethereum tc ch xrp eth ltc etc zec xmr xe2 x80 xa6
2019-11-17T08:45:19.000Z,b'#crypto price changes last 4 hours\n\n\xf0\x9f\x9a\x80\n$NPXS +49.97%\n$DENT +49.97%\n$FX +29.29%\n\n\xf0\x9f\x8c\xa7\xef\xb8\x8f\n$BTT -20.02%\n$PAL -11.13%\n$JNT -7\xe2\x80\xa6 https://t.co/06BwpHY5Iw',crypto price changes last 4 hours n n xf0 x9f x9a x80 n NPXS 49 97 n DENT 49 97 n FX 29 29 n n xf0 x9f x8c xa7 xef x8 x8f n BTT 20 02 n PAL 11 13 n JNT 7 xe2 x80 xa6
2019-11-17T08:45:35.000Z,b'Follow Liquiditex official reddit here \nhttps://t.co/LjUmoWLyLL and read important articles about the project.\xe2\x80\xa6 https://t.co/SvDZuIf2qc',Follow Liquiditex official reddit here nhttps and read important articles aout the project xe2 x80 xa6
2019-11-17T08:46:00.000Z,b'\xf0\x9f\x94\x84 Prices update in $USDT (1 hour):\n\n$BTC - 8481.59 $      (+0.18 %)\n$ETH - 181.5 $        (+0.28 %)\n$XRP - 0.26 $\xe2\x80\xa6 https://t.co/98a1YkIYaH',xf0 x9f x94 x84 Prices update in USDT 1 hour n n BTC 8481 59 0 18 n ETH 181 5 0 28 n XRP 0 26 xe2 x80 xa6
2019-11-17T08:46:00.000Z,b'\xf0\x9f\x94\x84 Prices update in $USD (1 hour):\n\n$BTC   - 8481.1 $    (+0.29 %)\n$ETH   - 182.16 $    (+0.77 %)\n$XRP   - 0.26 $\xe2\x80\xa6 https://t.co/t88DAjpbvH',xf0 x9f x94 x84 Prices update in USD 1 hour n n BTC 8481 1 0 29 n ETH 182 16 0 77 n XRP 0 26 xe2 x80 xa6
2019-11-17T08:46:02.000Z,b'\xf0\x9f\x94\x84 Prices update in $EUR (1 hour):\n\n$BTC   - 7694.7 \xe2\x82\xac  (+0.34 %)\n$ETH   - 164.92 \xe2\x82\xac  (+0.6 %) \n$XRP   - 0.24 \xe2\x82\xac    (+0\xe2\x80\xa6 https://t.co/QeUdtJ0wok',xf0 x9f x94 x84 Prices update in EUR 1 hour n n BTC 7694 7 xe2 x82 xac 0 34 n ETH 164 92 xe2 x82 xac 0 6 n XRP 0 24 xe2 x82 xac 0 xe2 x80 xa6
2019-11-17T08:46:14.000Z,b'\xf0\x9f\x94\x84 Prices update in $USDT (1 hour):\n\n$BTC - 8491.0 $  (+0.36 %)\n$ETH - 182.33 $  (+0.7 %)\n$XRP - 0.26 $    (+0.25 %)\xe2\x80\xa6 https://t.co/BcEoQh4kva',xf0 x9f x94 x84 Prices update in USDT 1 hour n n BTC 8491 0 0 36 n ETH 182 33 0 7 n XRP 0 26 0 25 xe2 x80 xa6
2019-11-17T08:46:16.000Z,b'Thank you all for your stop losses monies. \xe2\x82\xbf\n\n#bitcoin',Thank you all for your stop losses monies xe2 x82 xf n n itcoin
2019-11-17T08:46:22.000Z,"\"b'Next time when somones ask\\'s me \"\"Why should I buy bitcoin?\"\"  I will show this video.\\n@maxkeiser destroys\\xe2\\x80\\xa6 https://t.co/E4KMybiwcp'\"",Next time when somones ask s me Why should I uy itcoin I will show this video n destroys xe2 x80 xa6
2019-11-17T08:46:24.000Z,b'Krypto-Regulation: US-Steuerbeh\xc3\xb6rde nimmt Bitcoin-Automaten ins Visier - Coin Update\n#Krypto #Kryptow\xc3\xa4hrungen\xe2\x80\xa6 https://t.co/dyYPiwoBL1',Krypto Regulation US Steuereh xc3 x6rde nimmt Bitcoin Automaten ins Visier Coin Update n Krypto Kryptow xc3 xa4hrungen xe2 x80 xa6
2019-11-17T08:46:32.000Z,b'#BitcoinCash is a sinking ship. I was so sad when they became the monsters they were throwing stones at. I am glad\xe2\x80\xa6 https://t.co/5lNbHHMwd9',BitcoinCash is a sinking ship I was so sad when they ecame the monsters they were throwing stones at I am glad xe2 x80 xa6
2019-11-17T08:46:32.000Z,"b'Back from the Pirate festival, @TheInfamousKata gives an update on what is to come with the most secure &amp; private\\xe2\\x80\\xa6 https://t.co/OqKWInLPkv'",Back from the Pirate festival gives an update on what is to come with the most secure amp private xe2 x80 xa6
2019-11-17T08:47:18.000Z,b'Write how many #bitcoin you would need to be totally happy!\n#cryptocurrency',Write how many itcoin you would need to e totally happy n cryptocurrency
2019-11-17T08:47:26.000Z,"\"b'People ask \"\"Why $NASH?\"\"\\n\\nSimply put:\\n\\n\\xe2\\x9a\\xa1Soeed\\xe2\\x9a\\xa1\\n\\xf0\\x9f\\x94\\x92Security\\xf0\\x9f\\x94\\x92\\n\\xf0\\x9f\\x99\\x82 Full control of your funds\\xf0\\x9f\\x99\\x82\\n\\xe2\\x9a\\x96\\xef\\xb8\\x8fLegal\\xe2\\x9a\\x96\\xef\\xb8\\x8f\\n\\xf0\\x9f\\x92\\xb8Buy with cash\\xf0\\x9f\\x92\\xb8\\n\\xf0\\x9f\\xa4\\x91\\xe2\\x80\\xa6 https://t.co/HuGKYpQ0Gq'\"",People ask Why NASH n nSimply put n n xe2 x9a xa1Soeed xe2 x9a xa1 n xf0 x9f x94 x92Security xf0 x9f x94 x92 n xf0 x9f x99 x82 Full control of your funds xf0 x9f x99 x82 n xe2 x9a x96 xef x8 x8fLegal xe2 x9a x96 xef x8 x8f n xf0 x9f x92 x8Buy with cash xf0 x9f x92 x8 n xf0 x9f xa4 x91 xe2 x80 xa6
2019-11-17T08:47:26.000Z,b'Btc block times are so fucking random no where near 10 minutes intervals. Like 3 1 7 23 55 min this is fucking insane $btc #bitcoin sucks',Btc lock times are so fucking random no where near 10 minutes intervals Like 3 1 7 23 55 min this is fucking insane tc itcoin sucks
2019-11-17T08:47:29.000Z,b'\xf0\x9f\x94\x84 Prices update in $USD (1 hour):\n\n$BTC - 8504.7 $ (+0.57 %)\n$ETH - 182.34 $ (+0.87 %)\n$XRP - 0.26 $   (+0.22 %)\xe2\x80\xa6 https://t.co/EqvolGlNcD',xf0 x9f x94 x84 Prices update in USD 1 hour n n BTC 8504 7 0 57 n ETH 182 34 0 87 n XRP 0 26 0 22 xe2 x80 xa6
2019-11-17T08:48:11.000Z,b'I wanted to share with you the unique opportunity to participate in the Discoin project https://t.co/TSdwFLJKXe\xe2\x80\xa6 https://t.co/nKG6gF7gwv',I wanted to share with you the unique opportunity to participate in the Discoin project
2019-11-17T08:48:20.000Z,b'#bitcoin #Ethereum #Binance #bittrex #Poloniex #XRPcommunity #Litecoin #rich #Finanza #LTC #dogecoin\xe2\x80\xa6 https://t.co/hKKCH4L0XY',itcoin Ethereum Binance ittrex Poloniex XRPcommunity Litecoin rich Finanza LTC dogecoin xe2 x80 xa6
2019-11-17T08:48:28.000Z,b'#bitcoin #Ethereum #Binance #bittrex #Poloniex #XRPcommunity #Litecoin #rich #Finanza #LTC #dogecoin\xe2\x80\xa6 https://t.co/A70d9gur5P',itcoin Ethereum Binance ittrex Poloniex XRPcommunity Litecoin rich Finanza LTC dogecoin xe2 x80 xa6
2019-11-17T08:48:34.000Z,b'GitHub Actions for Azure is now generally available https://t.co/s2CkW73PYg #bitcoin #media #news #education #distributedledger',GitHu Actions for Azure is now generally availale itcoin media news education distriutedledger
2019-11-17T08:48:40.000Z,b'G\xc3\xbcnayd\xc4\xb1n arkada\xc5\x9flar \xf0\x9f\x92\x8b#IranProtests #bitcoin #Pazar https://t.co/iobBUDyX3p',G xc3 xcnayd xc4 x1n arkada xc5 x9flar xf0 x9f x92 x8 IranProtests itcoin Pazar
2019-11-17T08:48:41.000Z,b'LAST TRADE: BUY 0.10735479BTC@7712.8EUR\nSELL WALL: 29.889BTC@7759.6EUR\nBUY WALL: 59.289BTC@7500.0EUR\nSUM SHORTS: 39\xe2\x80\xa6 https://t.co/x900AKYVxj',LAST TRADE BUY 0 10735479BTC 8EUR nSELL WALL 29 889BTC 6EUR nBUY WALL 59 289BTC 0EUR nSUM SHORTS 39 xe2 x80 xa6
2019-11-17T08:48:46.000Z,b'I honestly am worried. This is dump again very soon. Oh boy... #Bitcoin',I honestly am worried This is dump again very soon Oh oy Bitcoin
2019-11-17T08:49:05.000Z,"b'\\xf0\\x9f\\x94\\xbc \\xe2\\x82\\xbf1 = $8,509 (08:49 UTC)\\n$BTC prices rise!\\n#Bitcoin $btcusd #btcusd #btc https://t.co/VUqdWX7y4h'",xf0 x9f x94 xc xe2 x82 xf1 8 509 08 49 UTC n BTC prices rise n Bitcoin tcusd tcusd tc
2019-11-17T08:49:20.000Z,b'Bank of Tanzania Issues Warning on Cryptocurrency #Tanzania #Bitcoin #Cryptocurrency https://t.co/LO6RWxM1y8',Bank of Tanzania Issues Warning on Cryptocurrency Tanzania Bitcoin Cryptocurrency
2019-11-17T08:50:03.000Z,"b'Top 5 #cryptocurrencies \\n Alert Time: 2019-11-17 11:50:03\\n#Bitcoin: $8,564.979\\n#Ethereum: $183.471\\n#XRP: $0.264\\xe2\\x80\\xa6 https://t.co/fCiJfaNLUB'",Top 5 cryptocurrencies n Alert Time 2019 11 17 11 50 03 n Bitcoin 8 564 979 n Ethereum 183 471 n XRP 0 264 xe2 x80 xa6
2019-11-17T08:50:21.000Z,b'G\xc3\xbcnayd\xc4\xb1n arkada\xc5\x9flar \xf0\x9f\x92\x8b#IranProtests #bitcoin https://t.co/KQ4McDczex',G xc3 xcnayd xc4 x1n arkada xc5 x9flar xf0 x9f x92 x8 IranProtests itcoin
2019-11-17T08:50:51.000Z,"b'#Xino_Moongate North Korean CCP broker, Lim Jongseok. As soon as I left the latest text on economy, he announced el\\xe2\\x80\\xa6 https://t.co/dGrf2KL4KU'",Xino Moongate North Korean CCP roker Lim Jongseok As soon as I left the latest text on economy he announced el xe2 x80 xa6
2019-11-17T08:51:07.000Z,b'Mood\n#Golden_Child #\xea\xb3\xa8\xeb\x93\xa0\xec\xb0\xa8\xec\x9d\xbc\xeb\x93\x9c\n#WANNABE #\xec\x9b\x8c\xeb\x84\x88\xeb\xb9\x84\n#NCTDREAM #INFINITE #Exo #BTSWORLD #BTS #Army #exol #Goldeness #Inspirit\xe2\x80\xa6 https://t.co/qbA4AqgRX9',Mood n Golden Child xea x3 xa8 xe x93 xa0 xec x0 xa8 xec x9d xc xe x93 x9c n WANNABE xec x9 x8c xe x84 x88 xe x9 x84 n NCTDREAM INFINITE Exo BTSWORLD BTS Army exol Goldeness Inspirit xe2 x80 xa6
2019-11-17T08:51:08.000Z,b'Serbest #Piyasa\n\nTarih: 16.11.2019 23:59:58\nDolar: \xe2\x82\xba5.7449\nEuro: \xe2\x82\xba6.3531\n24 Ayar Gram: \xe2\x82\xba270.97\n22 Ayar Gram: \xe2\x82\xba247.1\xe2\x80\xa6 https://t.co/xUOfM4ezUq',Serest Piyasa n nTarih 16 11 2019 23 59 58 nDolar xe2 x82 xa5 7449 nEuro xe2 x82 xa6 3531 n24 Ayar Gram xe2 x82 xa270 97 n22 Ayar Gram xe2 x82 xa247 1 xe2 x80 xa6
2019-11-17T08:51:09.000Z,"b'BTC, ETH, XRP, BCH, LTC, EOS, BNB, BSV, XLM, TRX #Ethereum #Bitcoin  https://t.co/yLkB6ErL3h'",BTC ETH XRP BCH LTC EOS BNB BSV XLM TRX Ethereum Bitcoin
2019-11-17T08:51:20.000Z,"b'Dear friends, investors You have a chance to make a successful investment this year! Participate  to get many benef\\xe2\\x80\\xa6 https://t.co/Abffb4tLtr'",Dear friends investors You have a chance to make a successful investment this year Participate to get many enef xe2 x80 xa6
2019-11-17T08:51:22.000Z,b'3 Things Stopping Bitcoin From Returning to $20k https://t.co/P8QFFQF2G7  #XBT #BTC #Bitcoin',3 Things Stopping Bitcoin From Returning to 20k XBT BTC Bitcoin
2019-11-17T08:51:23.000Z,b'Mood\n#Golden_Child #\xea\xb3\xa8\xeb\x93\xa0\xec\xb0\xa8\xec\x9d\xbc\xeb\x93\x9c\n#WANNABE #\xec\x9b\x8c\xeb\x84\x88\xeb\xb9\x84\n#NCTDREAM #INFINITE #Exo #BTSWORLD #BTS #Army #exol #Goldeness #Inspirit\xe2\x80\xa6 https://t.co/2HQVTsMH1l',Mood n Golden Child xea x3 xa8 xe x93 xa0 xec x0 xa8 xec x9d xc xe x93 x9c n WANNABE xec x9 x8c xe x84 x88 xe x9 x84 n NCTDREAM INFINITE Exo BTSWORLD BTS Army exol Goldeness Inspirit xe2 x80 xa6
2019-11-17T08:51:27.000Z,"b'\\xf0\\x9f\\x94\\xbc \\xe2\\x82\\xbf1 = $8,509 (08:49 UTC)\\n$BTC prices rise!\\n#Bitcoin $btcusd #btcusd #btc https://t.co/RALdF3vLG0'",xf0 x9f x94 xc xe2 x82 xf1 8 509 08 49 UTC n BTC prices rise n Bitcoin tcusd tcusd tc
