2019-11-17T19:53:56.000Z,b'Maybe we should learn to decide before venturing\nFollow the steps and lead your way to success...\nContact me for th\xe2\x80\xa6 https://t.co/Df4g30neII',Maye we should learn to decide efore venturing nFollow the steps and lead your way to success nContact me for th xe2 x80 xa6
2019-11-17T19:54:02.000Z,b'Now $DIRV DirectView Holdings A Small-Cap Stock On The Move https://t.co/VxsJGptZLu #bodycamera #Camera #security\xe2\x80\xa6 https://t.co/6CxCpQZJRh',Now DIRV DirectView Holdings A Small Cap Stock On The Move odycamera Camera security xe2 x80 xa6
2019-11-17T19:54:50.000Z,b'@AndroidPolice Buy #Bitcoin buy #Digibyte instead.',Buy Bitcoin uy Digiyte instead
2019-11-17T19:54:53.000Z,"\"b'$EPAZ ZenaPay Drone is shown on \"\"Ear to the Ground\"\" with GreenHart talking about their hemp farm and CBD products.\\xe2\\x80\\xa6 https://t.co/w3mk36L890'\"",EPAZ ZenaPay Drone is shown on Ear to the Ground with GreenHart talking aout their hemp farm and CBD products xe2 x80 xa6
2019-11-17T19:55:02.000Z,b'Can you please help me.\n\n32yyeXCAqrxbKMvSDP9ymib64wJfB8GUbe\n\n#bitcoin\n#cryptocurrency\n#crypto\n#help\n#giveme',Can you please help me n n32yyeXCAqrxKMvSDP9ymi64wJfB8GUe n n itcoin n cryptocurrency n crypto n help n giveme
2019-11-17T19:55:08.000Z,b'Dear #Bitcoinlivers comment what CREATES your MOST positive #feeling \xe2\x9d\xa4\xf0\x9f\x8c\x8e\n\nThe best 3 comments wil recieve\n \xf0\x9f\x8f\x8650 #Trx\xe2\x80\xa6 https://t.co/VTATOLs0qW',Dear Bitcoinlivers comment what CREATES your MOST positive feeling xe2 x9d xa4 xf0 x9f x8c x8e n nThe est 3 comments wil recieve n xf0 x9f x8f x8650 Trx xe2 x80 xa6
2019-11-17T19:55:19.000Z,"b'#Bitcoin goes through an important bull market test, relevant for the whole #crypto market: the .50 Fibonacci level\\xe2\\x80\\xa6 https://t.co/fpT03gZOZT'",Bitcoin goes through an important ull market test relevant for the whole crypto market the 50 Fionacci level xe2 x80 xa6
2019-11-17T19:56:01.000Z,b'Social Start Now New video on Venture Capital TV https://t.co/Sg8oZyTKgH #ad #wsj #nytimes #reuters #bloomberg\xe2\x80\xa6 https://t.co/NUl4bg7o4C',Social Start Now New video on Venture Capital TV ad wsj nytimes reuters loomerg xe2 x80 xa6
2019-11-17T19:56:11.000Z,b'Something tells me this guy got in too late. https://t.co/U4lsnIi3YQ https://t.co/BkqFpIGfQt $btc #bitcoin #crypto https://t.co/ARpSTrPslB',Something tells me this guy got in too late tc itcoin crypto
2019-11-17T19:56:17.000Z,b'$EPAZ ZenaPay indoor drone will allow us to enter multiple industries. The drone will be tested with an Irish Green\xe2\x80\xa6 https://t.co/2vDjxFl0ZP',EPAZ ZenaPay indoor drone will allow us to enter multiple industries The drone will e tested with an Irish Green xe2 x80 xa6
2019-11-17T19:56:54.000Z,b'2k oldum bundan ba\xc5\x9fka atmayacam nefsim doydu dknepxmw\xc5\x9fzi\xc3\xb6w\n#S\xc3\xb6zle\xc5\x9fmeliKadroluOlsun\n#EytOyununaGelmeTuerkiyem\xe2\x80\xa6 https://t.co/gywxtR7SZN',2k oldum undan a xc5 x9fka atmayacam nefsim doydu dknepxmw xc5 x9fzi xc3 x6w n S xc3 x6zle xc5 x9fmeliKadroluOlsun n EytOyununaGelmeTuerkiyem xe2 x80 xa6
2019-11-17T19:57:07.000Z,"b'Almost 2 months straight of 1-3% returns Monday to Friday, gotta love it! Time for another withdrawl. \\xf0\\x9f\\x98\\x8a #Forex\\xe2\\x80\\xa6 https://t.co/RgtUpi52WN'",Almost 2 months straight of 1 3 returns Monday to Friday gotta love it Time for another withdrawl xf0 x9f x98 x8a Forex xe2 x80 xa6
2019-11-17T19:57:15.000Z,b'\xf0\x9f\x8c\xb4Get your ticket for the Mallorca Blockchain Days 2020: https://t.co/2O5zbrKKBg \n#Mallorca #bitcoin #liberty #mises\xe2\x80\xa6 https://t.co/mHea4Bblpu',xf0 x9f x8c x4Get your ticket for the Mallorca Blockchain Days 2020 n Mallorca itcoin lierty mises xe2 x80 xa6
2019-11-17T19:57:20.000Z,"b'New Game started Just now!!! Be the first, get dividends! Earn TRX!  \\n\\ntelegram group \\n\\nhttps://t.co/RItckIHNzR\\xe2\\x80\\xa6 https://t.co/SvBCe2L5lL'",New Game started Just now Be the first get dividends Earn TRX n ntelegram group n nhttps
2019-11-17T19:57:33.000Z,b'@APompliano @polina_marinova #Bitcoin doesnt get married\n\nCongrats though',Bitcoin doesnt get married n nCongrats though
2019-11-17T19:57:38.000Z,b'Bitcoin breaks $8700 #bitcoin #btc #bitcointrading #bitcoinmemes #bitcointechnology #bitcoinmillionaires\xe2\x80\xa6 https://t.co/uPsU28YzST',Bitcoin reaks 8700 itcoin tc itcointrading itcoinmemes itcointechnology itcoinmillionaires xe2 x80 xa6
2019-11-17T19:57:39.000Z,b'@AttentionToken $bat directa hacia el primer objetivo a corto plazo. Las gr\xc3\xa1ficas contra $btc y $eth tambi\xc3\xa9n pintan\xe2\x80\xa6 https://t.co/kLbKPYBPcH',at directa hacia el primer ojetivo a corto plazo Las gr xc3 xa1ficas contra tc y eth tami xc3 xa9n pintan xe2 x80 xa6
2019-11-17T19:57:58.000Z,b'ProtonMail Reveals It\xe2\x80\x99s Been \xe2\x80\x98HODLing\xe2\x80\x99 Its #Bitcoin Payments for Years By Cointelegraph\n\nhttps://t.co/PCRD7yVMsS',ProtonMail Reveals It xe2 x80 x99s Been xe2 x80 x98HODLing xe2 x80 x99 Its Bitcoin Payments for Years By Cointelegraph n
2019-11-17T19:58:01.000Z,b'Start Today! https://t.co/MsU3yfcA3O \n#ad #wsj #nytimes #reuters #bloomberg #thestreet #forbes #nasdaq\xe2\x80\xa6 https://t.co/k2FSgQQQ8j',Start Today n ad wsj nytimes reuters loomerg thestreet fores nasdaq xe2 x80 xa6
2019-11-17T19:58:32.000Z,"\"b'Matte\\xc3\\xbcs 22:21\\n\"\"Geef aan God wat God toebehoort.\"\"\\n\\nMatte\\xc3\\xbcs 22:21bis\\n\"\"Uw bitcoins!\"\"\\n\\n#humor #bitcoin'\"",Matte xc3 xcs 22 21 n Geef aan God wat God toeehoort n nMatte xc3 xcs 22 21is n Uw itcoins n n humor itcoin
2019-11-17T19:58:34.000Z,"b'New Game started Just now!!! Be the first, get dividends! Earn TRX!  \\n\\ntelegram group \\n\\nhttps://t.co/tKVxWoNwef\\xe2\\x80\\xa6 https://t.co/AQsxLKcC1w'",New Game started Just now Be the first get dividends Earn TRX n ntelegram group n nhttps
2019-11-17T19:58:59.000Z,b'@extstock @dcs_token #cryptocurrency #bitcoin\n\nA promising project',cryptocurrency itcoin n nA promising project
2019-11-17T19:59:41.000Z,"b'1,125 #Bitcoin mined since last tweet.\\n \\n New Supply: 18,053,112 \\n \\n It represents $9,713,439 (At $8,634 per $BTC #BTC) \\n Progress: 85.97 %'",1 125 Bitcoin mined since last tweet n n New Supply 18 053 112 n n It represents 9 713 439 At 8 634 per BTC BTC n Progress 85 97
2019-11-17T20:00:00.000Z,"b'Bitcoin: $8,562.63\\n +1.12% (+$94.43)\\nHigh: $8,585.12\\nLow: $8,372.71\\nVolume: 42\\n\\n$BTC #BTC #bitcoin'",Bitcoin 8 562 63 n 1 12 94 43 nHigh 8 585 12 nLow 8 372 71 nVolume 42 n n BTC BTC itcoin
2019-11-17T20:00:00.000Z,b'A federal judge has ordered Kingdom Trust to return customer data access to their own account information on Bitcoi\xe2\x80\xa6 https://t.co/Cp57yCPLTK',A federal judge has ordered Kingdom Trust to return customer data access to their own account information on Bitcoi xe2 x80 xa6
2019-11-17T20:00:01.000Z,b'https://t.co/6bFbDHx3BE #futures #commodities #oil #gold #trading #bitcoin #forex #art #usd #crudeoil #market\xe2\x80\xa6 https://t.co/RsIfykKNGU',futures commodities oil gold trading itcoin forex art usd crudeoil market xe2 x80 xa6
2019-11-17T20:00:01.000Z,"b'#HourlyCryptoStatus (#1 to #3):\\n\\n#1 #btc (#bitcoin): 8,562.83 USD | 0.96% 24h\\n\\n#2 #eth (#ethereum): 185.21 USD | 1.\\xe2\\x80\\xa6 https://t.co/CnAZcvVggz'",HourlyCryptoStatus 1 to 3 n n 1 tc itcoin 8 562 83 USD 0 96 24h n n 2 eth ethereum 185 21 USD 1 xe2 x80 xa6
2019-11-17T20:00:02.000Z,b'MercadoBitcoin(BTC) =&gt; R$36399 | BlockChain(BTC) =&gt; R$35915 | MercadoBitcoin(LTC) =&gt; R$254 #bitcoin #litecoin',MercadoBitcoin BTC gt R 36399 BlockChain BTC gt R 35915 MercadoBitcoin LTC gt R 254 itcoin litecoin
2019-11-17T20:00:02.000Z,b'\xf0\x9f\x93\x88 #Bitcoin (#BTC $BTC) global volume weighted average is currently $8548.935 | 0.84% change over 24hrs.  #crypto\xe2\x80\xa6 https://t.co/seBY2PkK81',xf0 x9f x93 x88 Bitcoin BTC BTC gloal volume weighted average is currently 8548 935 0 84 change over 24hrs crypto xe2 x80 xa6
2019-11-17T20:00:02.000Z,"b'In the context of financial markets, we may define risk as the amount of money one can lose when trading or investi\\xe2\\x80\\xa6 https://t.co/ZjODTWm9fO'",In the context of financial markets we may define risk as the amount of money one can lose when trading or investi xe2 x80 xa6
2019-11-17T20:00:02.000Z,"\"b\"\"Join 'The Signal Premium' \\n\\n- Daily early trade Signals\\n- 80%+ success rate\\n- Premium Telegram &amp; Twitter access\\n- S\\xe2\\x80\\xa6 https://t.co/Tm12rygWn6\"\"\"",Join The Signal Premium n n Daily early trade Signals n 80 success rate n Premium Telegram amp Twitter access n S xe2 x80 xa6
2019-11-17T20:00:02.000Z,b'BitcoinAverage - bitcoin price index - ($ 8575.7) - https://t.co/z6cbnPDdmv #bitcoin https://t.co/tPMnBPn5gy',BitcoinAverage itcoin price index 8575 7 itcoin
2019-11-17T20:00:02.000Z,"\"b\"\"The Bitcoin $BTC price is currently 8634.17 $USD or 7812.81 $EUR.\\nIt's the number #1 cryptocurrency on the Earth wi\\xe2\\x80\\xa6 https://t.co/Eo2MUbUJ3J\"\"\"",The Bitcoin BTC price is currently 8634 17 USD or 7812 81 EUR nIt s the numer 1 cryptocurrency on the Earth wi xe2 x80 xa6
2019-11-17T20:00:02.000Z,"b'11/18 05:00\\xe7\\x8f\\xbe\\xe5\\x9c\\xa8\\n\\n#Bitcoin : 931,890\\xe5\\x86\\x86\\xe2\\x86\\x91\\n#NEM #XEM : 4.5321\\xe5\\x86\\x86\\xe2\\x86\\x93\\n#Monacoin : 115.1\\xe5\\x86\\x86\\xe2\\x86\\x93\\n#Ethereum : 20,090\\xe5\\x86\\x86\\xe2\\x86\\x92\\n#Zaif : 0.1564\\xe5\\x86\\x86\\xe2\\x86\\x92'",11 18 05 00 xe7 x8f xe xe5 x9c xa8 n n Bitcoin 931 890 xe5 x86 x86 xe2 x86 x91 n NEM XEM 4 5321 xe5 x86 x86 xe2 x86 x93 n Monacoin 115 1 xe5 x86 x86 xe2 x86 x93 n Ethereum 20 090 xe5 x86 x86 xe2 x86 x92 n Zaif 0 1564 xe5 x86 x86 xe2 x86 x92
2019-11-17T20:00:03.000Z,b'NOW SHILLING: #SONICPEPE\nhttps://t.co/Bbqs5I3R9g\n#RarePepe #PEPEwisdom #Pepecash #Bitcoin $BTC $XCP https://t.co/pTNpiojoqV',NOW SHILLING SONICPEPE nhttps PEPEwisdom Pepecash Bitcoin BTC XCP
2019-11-17T20:00:03.000Z,"b'Last hourly biggest #BITCOIN blockchain transaction : \\n \\n218 #BTC (1,875,873 USD) from #bitstamp to #bitstamp\\n \\nDet\\xe2\\x80\\xa6 https://t.co/bF1m8ZmCUv'",Last hourly iggest BITCOIN lockchain transaction n n218 BTC 1 875 873 USD from itstamp to itstamp n nDet xe2 x80 xa6
2019-11-17T20:00:03.000Z,"b'\\xe2\\x8f\\xb0 23:00\\n\\xe2\\x82\\xbf Bitcoin = 8.474,5763 $\\n#bitcoin #btc #BTCUSD'",xe2 x8f x0 23 00 n xe2 x82 xf Bitcoin 8 474 5763 n itcoin tc BTCUSD
2019-11-17T20:00:04.000Z,b'One Bitcoin now worth $8557.76@bitstamp. High $8589.100. Low $8375.000. Market Cap $154.481 Billion #bitcoin https://t.co/6qIKlWxFFl',One Bitcoin now worth 8557 76 High 8589 100 Low 8375 000 Market Cap 154 481 Billion itcoin
2019-11-17T20:00:04.000Z,b'One Bitcoin now worth $8569.000. Market Cap $154.697 Billion. Based on #coindesk BPI #bitcoin',One Bitcoin now worth 8569 000 Market Cap 154 697 Billion Based on coindesk BPI itcoin
2019-11-17T20:00:04.000Z,b'Cleveland Cavaliers vs Philadelphia 76ers. #bitcoin #betting - https://t.co/3sm3VV1lEo',Cleveland Cavaliers vs Philadelphia 76ers itcoin etting
2019-11-17T20:00:04.000Z,b'#MurthaBurke #Cryptoclarifications!  @thecollectivego \nOn Altcoin and Bitcoin Valuation \nhttps://t.co/vKu463XVTO\xe2\x80\xa6 https://t.co/r36A8wsjIG',MurthaBurke Cryptoclarifications nOn Altcoin and Bitcoin Valuation nhttps
