2019-11-17T07:00:05.000Z,b'2019/11/17 16:00\n\nBTC 922778.5\xe5\x86\x86\nETH 19721.1\xe5\x86\x86\nETC 501.7\xe5\x86\x86\nBCH 28722.7\xe5\x86\x86\nXRP 28.5\xe5\x86\x86\nXEM 4.6\xe5\x86\x86\nLSK 85.4\xe5\x86\x86\nMONA 114.8\xe5\x86\x86\xe2\x80\xa6 https://t.co/ImKCvB3aJM',2019 11 17 16 00 n nBTC 922778 5 xe5 x86 x86 nETH 19721 1 xe5 x86 x86 nETC 501 7 xe5 x86 x86 nBCH 28722 7 xe5 x86 x86 nXRP 28 5 xe5 x86 x86 nXEM 4 6 xe5 x86 x86 nLSK 85 4 xe5 x86 x86 nMONA 114 8 xe5 x86 x86 xe2 x80 xa6
2019-11-17T07:00:06.000Z,b'A new post: Germany Forces Apple to Allow Mobile Payment Competition on iPhones is added on https://t.co/9bbe9EB2gZ\xe2\x80\xa6 https://t.co/HIiVKEEtbI',A new post Germany Forces Apple to Allow Moile Payment Competition on iPhones is added on
2019-11-17T07:00:07.000Z,b'TOP-12 most-mentioned #crypto this hour:\n1. #bitcoin\n2. #tron\n3. #ethereum\n4. #xrp\n5. #ardor\n6. #nem\n7. #litecoin\n8\xe2\x80\xa6 https://t.co/qel6SAbohR',TOP 12 most mentioned crypto this hour n1 itcoin n2 tron n3 ethereum n4 xrp n5 ardor n6 nem n7 litecoin n8 xe2 x80 xa6
2019-11-17T07:00:07.000Z,b'#bitcoin Earn FREE bitcoin with this easy strategy \xe2\x96\xb6 https://t.co/K41USsQ7H8 https://t.co/o74VyN7uQe',itcoin Earn FREE itcoin with this easy strategy xe2 x96 x6
2019-11-17T07:00:07.000Z,"b'\\xf0\\x9f\\x92\\xb0Bitcoin\\xe3\\x83\\x88\\xe3\\x83\\xa9\\xe3\\x83\\xb3\\xe3\\x82\\xb6\\xe3\\x82\\xaf\\xe3\\x82\\xb7\\xe3\\x83\\xa7\\xe3\\x83\\xb3\\xe7\\x8a\\xb6\\xe6\\xb3\\x81\\xf0\\x9f\\x92\\xb0\\n\\n\\xf0\\x9f\\x94\\xa7HashRate:10,082,721,609,832 KH/s\\n\\xf0\\x9f\\x94\\x9cNetworkDiff:12,720,005,267,390\\n\\xe2\\x9a\\xa0\\xe6\\x9c\\xaa\\xe7\\xa2\\xba\\xe8\\xaa\\x8d\\xe5\\x8f\\x96\\xe5\\xbc\\x95\\xe6\\x95\\xb0:0 \\xe4\\xbb\\xb6\\n\\n#bitcoin #ethereum #cryptocurrency #\\xe4\\xbb\\xae\\xe6\\x83\\xb3\\xe9\\x80\\x9a\\xe8\\xb2\\xa8'",xf0 x9f x92 x0Bitcoin xe3 x83 x88 xe3 x83 xa9 xe3 x83 x3 xe3 x82 x6 xe3 x82 xaf xe3 x82 x7 xe3 x83 xa7 xe3 x83 x3 xe7 x8a x6 xe6 x3 x81 xf0 x9f x92 x0 n n xf0 x9f x94 xa7HashRate 10 082 721 609 832 KH s n xf0 x9f x94 x9cNetworkDiff 12 720 005 267 390 n xe2 x9a xa0 xe6 x9c xaa xe7 xa2 xa xe8 xaa x8d xe5 x8f x96 xe5 xc x95 xe6 x95 x0 0 xe4 x x6 n n itcoin ethereum cryptocurrency xe4 x xae xe6 x83 x3 xe9 x80 x9a xe8 x2 xa8
2019-11-17T07:00:08.000Z,"\"b\"\"NEW INVESTIGATION: \\xf0\\x9f\\x92\\xb1 #Bitcoin exchange site deemed a 'hub for drug-dealing",NEW INVESTIGATION xf0 x9f x92 x1 Bitcoin exchange site deemed a hu for drug dealing
2019-11-17T07:00:09.000Z,"b'Nov 17, 2019 06:59:00 UTC | 8,483.80$ | 7,676.70\\xe2\\x82\\xac | 6,574.80\\xc2\\xa3 | #Bitcoin #BTC $BTC #crypto #financial #news https://t.co/Qif2fjzGzA'",Nov 17 2019 06 59 00 UTC 8 483 80 7 676 70 xe2 x82 xac 6 574 80 xc2 xa3 Bitcoin BTC BTC crypto financial news
2019-11-17T07:00:09.000Z,"b'Nov 16, 2019 11:00PM #Bitcoin Price:\\nUSD 8648.33 | EUR 7683.26 | JPY 923322.60'",Nov 16 2019 11 00PM Bitcoin Price nUSD 8648 33 EUR 7683 26 JPY 923322 60
2019-11-17T07:00:12.000Z,b'Le cours du #Bitcoin est de 7673.84\xe2\x82\xac\xf0\x9f\x87\xaa\xf0\x9f\x87\xba  (8473.94$\xf0\x9f\x87\xba\xf0\x9f\x87\xb8) #Blockchain #Cryptocurrency',Le cours du Bitcoin est de 7673 84 xe2 x82 xac xf0 x9f x87 xaa xf0 x9f x87 xa 8473 94 xf0 x9f x87 xa xf0 x9f x87 x8 Blockchain Cryptocurrency
2019-11-17T07:00:13.000Z,"b'Top 100 avg 24h return: 0.6\\xc2\\xb13.7%; 65 up, 35 down\\n$BTC 0.1%  $ETH 0.4%\\nBest:\\n20.6% $SNX @synthetix_io\\n14.4% $EKT\\xe2\\x80\\xa6 https://t.co/lmElNU4KC4'",Top 100 avg 24h return 0 6 xc2 x13 7 65 up 35 down n BTC 0 1 ETH 0 4 nBest n20 6 SNX n14 4 EKT xe2 x80 xa6
2019-11-17T07:00:14.000Z,"b'#BTC: \\xe2\\x82\\xba48.730,00\\n#ETH: \\xe2\\x82\\xba1.042,48\\n#LTC:  \\xe2\\x82\\xba334,00\\n#XRP: \\xe2\\x82\\xba1,51\\n\\n17.11.19 - 10:00\\n\\n#Bitcoin #Litecoin #Ethereum #Ripple\\xe2\\x80\\xa6 https://t.co/OSfqVDn7xX'",BTC xe2 x82 xa48 730 00 n ETH xe2 x82 xa1 042 48 n LTC xe2 x82 xa334 00 n XRP xe2 x82 xa1 51 n n17 11 19 10 00 n n Bitcoin Litecoin Ethereum Ripple xe2 x80 xa6
2019-11-17T07:00:14.000Z,b'Ethereum (ETH) Price Weekly Forecast: Crucial Support At Risk #Bitcoin #Btc #Cryptocurrency #finance #forex\xe2\x80\xa6 https://t.co/QDIsw6gR1m',Ethereum ETH Price Weekly Forecast Crucial Support At Risk Bitcoin Btc Cryptocurrency finance forex xe2 x80 xa6
2019-11-17T07:00:19.000Z,"\"b\"\"#computerart : #bitcoin #blockchain 's\\nLAST Block",computerart itcoin lockchain s nLAST Block
2019-11-17T07:00:27.000Z,"b'ABD Ba\\xc5\\x9fkan Aday\\xc4\\xb1, Kripto Paralara Y\\xc3\\xb6nelik Planlar\\xc4\\xb1n\\xc4\\xb1 A\\xc3\\xa7\\xc4\\xb1klad\\xc4\\xb1!   https://t.co/nJJTYHVEcg #bitcoin #ethereum\\xe2\\x80\\xa6 https://t.co/7z0i829hgG'",ABD Ba xc5 x9fkan Aday xc4 x1 Kripto Paralara Y xc3 x6nelik Planlar xc4 x1n xc4 x1 A xc3 xa7 xc4 x1klad xc4 x1 itcoin ethereum xe2 x80 xa6
2019-11-17T07:00:30.000Z,b'BTC hourly update\n$8478.66    |    -0.0015%\xf0\x9f\x93\x89\n$BTC #BTCUSD #Bitcoin',BTC hourly update n 8478 66 0 0015 xf0 x9f x93 x89 n BTC BTCUSD Bitcoin
2019-11-17T07:00:32.000Z,"b'#PHP #Developer - Interact Consulting Limited ( Leicester, UK )  - [ \\xf0\\x9f\\x93\\x8b More Info  https://t.co/jI1t4sy7eo ] #AI\\xe2\\x80\\xa6 https://t.co/MNpPdJ5mVE'",PHP Developer Interact Consulting Limited Leicester UK xf0 x9f x93 x8 More Info AI xe2 x80 xa6
2019-11-17T07:00:40.000Z,b'#bitcoin A very easy way to earn money. Do you want to get free bitcoin? Discover the magic \xe2\x96\xb6\xe2\x80\xa6 https://t.co/Ky7i5JUB2d',itcoin A very easy way to earn money Do you want to get free itcoin Discover the magic xe2 x96 x6 xe2 x80 xa6
2019-11-17T07:00:46.000Z,b'#BTCUSD Market #1H timeframe on  November 17 at 06:00 (UTC)  is #Bullish.  #cryptocurrency #bitcoin  #btc #crypto\xe2\x80\xa6 https://t.co/GRbmrbyRBd',BTCUSD Market 1H timeframe on Novemer 17 at 06 00 UTC is Bullish cryptocurrency itcoin tc crypto xe2 x80 xa6
2019-11-17T07:00:50.000Z,b'Try your luck now at https://t.co/sGCErQhgPd Slot game and win up to 5 BTC! Catch the Winning Spirit!\n\n#gambling\xe2\x80\xa6 https://t.co/WhECF0XD5d',Try your luck now at Slot game and win up to 5 BTC Catch the Winning Spirit n n gamling xe2 x80 xa6
2019-11-17T07:00:51.000Z,b'#CryptoCotizaci\xc3\xb3n\n\xf0\x9f\x93\xa3 Precios actualizados a las 08:00:47.\n #Bitcoin #Ethereum #XRP #BitcoinCash #Tether #Litecoin\xe2\x80\xa6 https://t.co/bl9fdGPlEm',CryptoCotizaci xc3 x3n n xf0 x9f x93 xa3 Precios actualizados a las 08 00 47 n Bitcoin Ethereum XRP BitcoinCash Tether Litecoin xe2 x80 xa6
2019-11-17T07:00:53.000Z,"b'DACX will in general use DLT and AI to encourage cross-outskirt exchanges of multi-money installments, resources an\\xe2\\x80\\xa6 https://t.co/grBk95TAmT'",DACX will in general use DLT and AI to encourage cross outskirt exchanges of multi money installments resources an xe2 x80 xa6
2019-11-17T07:00:53.000Z,b'Top 5 crypto stijgers van dit moment:\n\n#Ubricoin: $0.00096\n#NewtonCoinProject: $0.00001\n#Voltz: $0.30225\n#JesusCoin\xe2\x80\xa6 https://t.co/i1q08rajHy',Top 5 crypto stijgers van dit moment n n Uricoin 0 00096 n NewtonCoinProject 0 00001 n Voltz 0 30225 n JesusCoin xe2 x80 xa6
2019-11-17T07:00:57.000Z,"b'Top 5 #cryptocurrencies \\n Alert Time: 2019-11-17 10:00:57\\n#Bitcoin: $8,545.978\\n#Ethereum: $182.734\\n#XRP: $0.264\\xe2\\x80\\xa6 https://t.co/NHEXfnoPDp'",Top 5 cryptocurrencies n Alert Time 2019 11 17 10 00 57 n Bitcoin 8 545 978 n Ethereum 182 734 n XRP 0 264 xe2 x80 xa6
2019-11-17T07:00:57.000Z,"b'#bitcoin #revolution #meets #protestant #reformation, #crypto #drives #change? \\n#instacryptocurrency #instabtc\\xe2\\x80\\xa6 https://t.co/hNVnjRB6A5'",itcoin revolution meets protestant reformation crypto drives change n instacryptocurrency instatc xe2 x80 xa6
2019-11-17T07:00:59.000Z,b'Top 5 #crypto gainers \n Alert Time: 2019-11-17 10:00:58\n#Ubricoin: $0.001\n#MMOCoin: $0.057\n#SwiftCash: $0.003\xe2\x80\xa6 https://t.co/M6hRQCApMM',Top 5 crypto gainers n Alert Time 2019 11 17 10 00 58 n Uricoin 0 001 n MMOCoin 0 057 n SwiftCash 0 003 xe2 x80 xa6
2019-11-17T07:01:03.000Z,"b'Perhaps @Google Will Kill #Bitcoin, After All https://t.co/hBqyivTRaw @billybambrough https://t.co/lLBabPlaQC'",Perhaps Will Kill Bitcoin After All
2019-11-17T07:01:07.000Z,b'1 #BTC (#Bitcoin) quotes:\n$8468.28/$8478.31 #Bitstamp\n$8472.15/$8474.00 #Kraken\n\xe2\x87\xa2$-6.16/$5.72',1 BTC Bitcoin quotes n 8468 28 8478 31 Bitstamp n 8472 15 8474 00 Kraken n xe2 x87 xa2 6 16 5 72
2019-11-17T07:01:12.000Z,b'\xe2\x82\xac 7733.69 #bitcoin',xe2 x82 xac 7733 69 itcoin
2019-11-17T07:01:26.000Z,b'#crypto price changes last hour\n\n\xf0\x9f\x9a\x80\n$WAXP +12.34%\n$EDG +5.87%\n$GO +5.47%\n\n\xf0\x9f\x8c\xa7\xef\xb8\x8f\n$JNT -7.47%\n$COSM -4.34%\n$PINK -4.02%\n\n#bitcoin #cryptocurrency',crypto price changes last hour n n xf0 x9f x9a x80 n WAXP 12 34 n EDG 5 87 n GO 5 47 n n xf0 x9f x8c xa7 xef x8 x8f n JNT 7 47 n COSM 4 34 n PINK 4 02 n n itcoin cryptocurrency
2019-11-17T07:01:37.000Z,b'BTC $8545.98 Down -$1.68 -0.02% in the last hour #bitcoin #bitsmart',BTC 8545 98 Down 1 68 0 02 in the last hour itcoin itsmart
2019-11-17T07:01:53.000Z,"b'Obsidian anuncia juego de supervivencia en microescala, conectado a tierra - https://t.co/1TutAi91go #noticias\\xe2\\x80\\xa6 https://t.co/nMORjKeah0'",Osidian anuncia juego de supervivencia en microescala conectado a tierra noticias xe2 x80 xa6
2019-11-17T07:01:55.000Z,b'#Bitcoin\n#blockchain\n#HarryOnSNL\n#Bangladesh\n#HarryOnSNL\n#MacKinnon\n#WatermelonSugar\n#BrasilContraGilmarMendes\xe2\x80\xa6 https://t.co/dGqxchuBas',Bitcoin n lockchain n HarryOnSNL n Bangladesh n HarryOnSNL n MacKinnon n WatermelonSugar n BrasilContraGilmarMendes xe2 x80 xa6
2019-11-17T07:02:00.000Z,b'Intertops Casino - 50 Free Spins Sign Up Bonus and New $777 Weekend Bonus with 77 Free Spins\xe2\x80\xa6 https://t.co/W5rC77Dmao',Intertops Casino 50 Free Spins Sign Up Bonus and New 777 Weekend Bonus with 77 Free Spins xe2 x80 xa6
2019-11-17T07:02:01.000Z,"b'FORGET #BITCOIN, #ALTCOINS are MOVING! With https://t.co/tywhOroEMh you can analyze where the VOLUME/PRICE is movin\\xe2\\x80\\xa6 https://t.co/3fzhPkpHzY'",FORGET BITCOIN ALTCOINS are MOVING With you can analyze where the VOLUME PRICE is movin xe2 x80 xa6
2019-11-17T07:02:07.000Z,b'#ImpeachmentHearing #impeach get off that train and hop on the #bitcoin and #alts rocket. Future of #internet tradi\xe2\x80\xa6 https://t.co/IhLbNfoo9E',ImpeachmentHearing impeach get off that train and hop on the itcoin and alts rocket Future of internet tradi xe2 x80 xa6
2019-11-17T07:02:52.000Z,"b'Bitcoin Revolution Meets Protestant Reformation, Crypto Drives Change? https://t.co/qaPV13VeST  #XBT #BTC #Bitcoin'",Bitcoin Revolution Meets Protestant Reformation Crypto Drives Change XBT BTC Bitcoin
2019-11-17T07:02:52.000Z,"b'\\xe7\\x8f\\xbe\\xe5\\x9c\\xa8\\xe3\\x81\\xae1\\xe3\\x83\\x93\\xe3\\x83\\x83\\xe3\\x83\\x88\\xe3\\x82\\xb3\\xe3\\x82\\xa4\\xe3\\x83\\xb3\\xe3\\x81\\x82\\xe3\\x81\\x9f\\xe3\\x82\\x8a\\xe3\\x81\\xae\\xe5\\x80\\xa4\\xe6\\xae\\xb5\\xe3\\x81\\xaf922,769.3426\\xe5\\x86\\x86\\xe3\\x81\\xa7\\xe3\\x81\\x99\\xe3\\x80\\x82\\xe5\\x80\\xa4\\xe6\\xae\\xb5\\xe3\\x81\\xae\\xe5\\x8f\\x96\\xe5\\xbe\\x97\\xe6\\x97\\xa5\\xe6\\x99\\x82\\xe3\\x81\\xafNov 17, 2019 07:02:00 UTC\\xe3\\x81\\xa7\\xe3\\x81\\x99 #bitcoin #\\xe3\\x83\\x93\\xe3\\x83\\x83\\xe3\\x83\\x88\\xe3\\x82\\xb3\\xe3\\x82\\xa4\\xe3\\x83\\xb3'",xe7 x8f xe xe5 x9c xa8 xe3 x81 xae1 xe3 x83 x93 xe3 x83 x83 xe3 x83 x88 xe3 x82 x3 xe3 x82 xa4 xe3 x83 x3 xe3 x81 x82 xe3 x81 x9f xe3 x82 x8a xe3 x81 xae xe5 x80 xa4 xe6 xae x5 xe3 x81 xaf922 769 3426 xe5 x86 x86 xe3 x81 xa7 xe3 x81 x99 xe3 x80 x82 xe5 x80 xa4 xe6 xae x5 xe3 x81 xae xe5 x8f x96 xe5 xe x97 xe6 x97 xa5 xe6 x99 x82 xe3 x81 xafNov 17 2019 07 02 00 UTC xe3 x81 xa7 xe3 x81 x99 itcoin xe3 x83 x93 xe3 x83 x83 xe3 x83 x88 xe3 x82 x3 xe3 x82 xa4 xe3 x83 x3
2019-11-17T07:04:29.000Z,b'Dacx exchange platform vision is to provide a next generation digital asset exchange which will leverage machine le\xe2\x80\xa6 https://t.co/CymyzafWtT',Dacx exchange platform vision is to provide a next generation digital asset exchange which will leverage machine le xe2 x80 xa6
2019-11-17T07:04:55.000Z,"\"b\"\"#Bitcoin exchange site a 'hub for drug-dealing",Bitcoin exchange site a hu for drug dealing
2019-11-17T07:05:02.000Z,b'30 Min Bottom on $ZEC at $35.6050 #ZEC #cryptocurrencies #BTC #Bitcoin $BTC.X https://t.co/AvSVkeT7VY https://t.co/CaGUF7Bxke',30 Min Bottom on ZEC at 35 6050 ZEC cryptocurrencies BTC Bitcoin BTC X
