2019-11-17T14:49:13.000Z,b'ProtonMail Reveals It\xe2\x80\x99s Been \xe2\x80\x98HODLing\xe2\x80\x99 Its Bitcoin Payments for Years\n#Bitcoin #Crypto #Cryptocurrency #October1st\xe2\x80\xa6 https://t.co/m6wdlYxCsE',ProtonMail Reveals It xe2 x80 x99s Been xe2 x80 x98HODLing xe2 x80 x99 Its Bitcoin Payments for Years n Bitcoin Crypto Cryptocurrency Octoer1st xe2 x80 xa6
2019-11-17T14:49:18.000Z,b'https://t.co/BO8J9sNKi7\n#bitcoin #song',song
2019-11-17T14:49:20.000Z,b'LAST TRADE: BUY 0.02231500BTC@7725.7EUR\nSELL WALL: 30.93BTC@7742.2EUR\nBUY WALL: 53.355BTC@7500.0EUR\nSUM SHORTS: 399\xe2\x80\xa6 https://t.co/FmiPl2U5Pp',LAST TRADE BUY 0 02231500BTC 7EUR nSELL WALL 30 93BTC 2EUR nBUY WALL 53 355BTC 0EUR nSUM SHORTS 399 xe2 x80 xa6
2019-11-17T14:49:22.000Z,"b'DACX Exchange aim to provide two types of order on their platform, ENTRY ORDERS and CLOSING ORDERS in 3 different f\\xe2\\x80\\xa6 https://t.co/cKflLHEILL'",DACX Exchange aim to provide two types of order on their platform ENTRY ORDERS and CLOSING ORDERS in 3 different f xe2 x80 xa6
2019-11-17T14:49:29.000Z,b'It is very hard to find a good project in Your days. Good luck guys! Very promising #ICO. #DACX #IEO\xe2\x80\xa6 https://t.co/XwcS8hpyps',It is very hard to find a good project in Your days Good luck guys Very promising ICO DACX IEO xe2 x80 xa6
2019-11-17T14:49:31.000Z,b'Be bullish be happy! #litecoin #bitcoin',Be ullish e happy litecoin itcoin
2019-11-17T14:49:32.000Z,b'#NitroNFLFreeBet I just placed a bet with #bitcoin! Follow or fade @NitrogenSports! https://t.co/JEP4NHmruO',NitroNFLFreeBet I just placed a et with itcoin Follow or fade
2019-11-17T14:50:00.000Z,b'Velas Masternodes Staking Program is Now Live \xf0\x9f\x91\x89 #NewsBTC #CryptocoinFactory #Bitcoin https://t.co/yIFFnbLXYv',Velas Masternodes Staking Program is Now Live xf0 x9f x91 x89 NewsBTC CryptocoinFactory Bitcoin
2019-11-17T14:50:03.000Z,"b'$LINK All Targets hit! 18% profit \\xf0\\x9f\\x94\\xa5\\n\\nFor Free signals,Join; https://t.co/NZqAqBQMUw\\n   \\n$BTC $ETH $XRP $LINK $LTC\\xe2\\x80\\xa6 https://t.co/FCkB2zkYAU'",LINK All Targets hit 18 profit xf0 x9f x94 xa5 n nFor Free signals Join n BTC ETH XRP LINK LTC xe2 x80 xa6
2019-11-17T14:50:03.000Z,"b'Top 5 #cryptocurrencies \\n Alert Time: 2019-11-17 17:50:02\\n#Bitcoin: $8,587.334\\n#Ethereum: $185.179\\n#XRP: $0.265\\xe2\\x80\\xa6 https://t.co/44tx3lpnrq'",Top 5 cryptocurrencies n Alert Time 2019 11 17 17 50 02 n Bitcoin 8 587 334 n Ethereum 185 179 n XRP 0 265 xe2 x80 xa6
2019-11-17T14:50:05.000Z,b'Fam\xc3\xadlia de mochileiro desaparecido \xc3\xa9 surpreendida com pedido de resgate em #Bitcoin na Austr\xc3\xa1lia. Visto em\xe2\x80\xa6 https://t.co/GJQIR4XmTC',Fam xc3 xadlia de mochileiro desaparecido xc3 xa9 surpreendida com pedido de resgate em Bitcoin na Austr xc3 xa1lia Visto em xe2 x80 xa6
2019-11-17T14:50:11.000Z,"b'As of November 16, 2019 at 08:50AM, 1 BTC = 8477.0801 USD. \\xf0\\x9f\\x98\\x84 https://t.co/ksCOqyBwFU \\xf0\\x9f\\x98\\x8b #Investing #fire #ira #401k\\xe2\\x80\\xa6 https://t.co/VxjnumTvtB'",As of Novemer 16 2019 at 08 50AM 1 BTC 8477 0801 USD xf0 x9f x98 x84 xf0 x9f x98 x8 Investing fire ira 401k xe2 x80 xa6
2019-11-17T14:50:11.000Z,"b'DACX Token Great news, the company is working, go see! Will earn with this promising project! #DACX #IEO\\xe2\\x80\\xa6 https://t.co/3TDjgdXg3y'",DACX Token Great news the company is working go see Will earn with this promising project DACX IEO xe2 x80 xa6
2019-11-17T14:50:15.000Z,b'\xe9\x97\xaa\xe7\x94\xb5\xe2\x9a\xa1\xe8\xae\xa1\xe5\x88\x92\xe5\x90\xaf\xe5\x8a\xa8\xe5\x90\x8e\xef\xbc\x8c\xe4\xb8\xbb\xe6\xb5\x81\xe5\xb8\x81\xe7\xa7\x9f\xe8\xb5\x81\xe5\xa4\x84\xe7\x90\x86\xe5\x99\xa8\xe6\x94\xb6\xe7\x9b\x8a\xe7\x8e\x87\xe8\x8a\x82\xe8\x8a\x82\xe9\xab\x98\xe5\x8d\x87\xef\xbc\x81300\xe7\xbe\x8e\xe9\x87\x91(\xe7\xad\x89\xe5\x80\xbcBTC/ETH/USDT)\xe5\x8d\xb3\xe5\x8f\xaf\xe5\xbc\x80\xe5\x90\xaf\xef\xbc\x8c\xe8\xbf\x98\xe6\x9c\x89\xe5\x8a\xa8\xe6\x80\x81\xe5\xa5\x96\xe9\x87\x91\xe6\x97\xa0\xf0\x9f\x92\xb5\xe9\x99\x90\xf0\x9f\x92\xb5\xe4\xbb\xa3\xe6\x9a\xb4\xe5\x88\xa9\xe5\x88\xb6\xe5\xba\xa6\xf0\x9f\x92\xaa\n\n#cryptocurrency #dapp #bitcoin #ethereum #USDT\xe2\x80\xa6 https://t.co/sj0P3biyER',xe9 x97 xaa xe7 x94 x5 xe2 x9a xa1 xe8 xae xa1 xe5 x88 x92 xe5 x90 xaf xe5 x8a xa8 xe5 x90 x8e xef xc x8c xe4 x8 x xe6 x5 x81 xe5 x8 x81 xe7 xa7 x9f xe8 x5 x81 xe5 xa4 x84 xe7 x90 x86 xe5 x99 xa8 xe6 x94 x6 xe7 x9 x8a xe7 x8e x87 xe8 x8a x82 xe8 x8a x82 xe9 xa x98 xe5 x8d x87 xef xc x81300 xe7 xe x8e xe9 x87 x91 xe7 xad x89 xe5 x80 xcBTC ETH USDT xe5 x8d x3 xe5 x8f xaf xe5 xc x80 xe5 x90 xaf xef xc x8c xe8 xf x98 xe6 x9c x89 xe5 x8a xa8 xe6 x80 x81 xe5 xa5 x96 xe9 x87 x91 xe6 x97 xa0 xf0 x9f x92 x5 xe9 x99 x90 xf0 x9f x92 x5 xe4 x xa3 xe6 x9a x4 xe5 x88 xa9 xe5 x88 x6 xe5 xa xa6 xf0 x9f x92 xaa n n cryptocurrency dapp itcoin ethereum USDT xe2 x80 xa6
2019-11-17T14:50:35.000Z,b'@codeyisfun 1. #Bitcoin (BTC) \xf0\x9f\x98\x81\n2. #Ethereum (ETH)\n3. #Ripple (XRP)',1 Bitcoin BTC xf0 x9f x98 x81 n2 Ethereum ETH n3 Ripple XRP
2019-11-17T14:50:45.000Z,b'Perhaps #Google will kill #bitcoin after all. #crypto #cryptocurrency #cryptocurrencies #CryptoMarkets\xe2\x80\xa6 https://t.co/c243F6zY1l',Perhaps Google will kill itcoin after all crypto cryptocurrency cryptocurrencies CryptoMarkets xe2 x80 xa6
2019-11-17T14:50:55.000Z,"b'Similar to apex predators, which are at the top of the food chain in wildlife, #Bitcoin is the apex meme of the int\\xe2\\x80\\xa6 https://t.co/549BxHvCUV'",Similar to apex predators which are at the top of the food chain in wildlife Bitcoin is the apex meme of the int xe2 x80 xa6
2019-11-17T14:51:08.000Z,b'Serbest #Piyasa\n\nTarih: 16.11.2019 23:59:58\nDolar: \xe2\x82\xba5.7449\nEuro: \xe2\x82\xba6.3531\n24 Ayar Gram: \xe2\x82\xba270.97\n22 Ayar Gram: \xe2\x82\xba247.1\xe2\x80\xa6 https://t.co/KOT47P6SVK',Serest Piyasa n nTarih 16 11 2019 23 59 58 nDolar xe2 x82 xa5 7449 nEuro xe2 x82 xa6 3531 n24 Ayar Gram xe2 x82 xa270 97 n22 Ayar Gram xe2 x82 xa247 1 xe2 x80 xa6
2019-11-17T14:51:10.000Z,"b'\\xe2\\x80\\x9cThe Link Between Money, Exchanges, And #Cryptocurrencies \\xe2\\x80\\x9d by Sidra\\nhttps://t.co/jxZ4RLB8Ed \\n\\n#bitcoin #usd #news #blockchain'",xe2 x80 x9cThe Link Between Money Exchanges And Cryptocurrencies xe2 x80 x9d y Sidra nhttps n n itcoin usd news lockchain
2019-11-17T14:51:16.000Z,"b'Hey, @cryptomobuk are giving away $XRP and a course of a course from their platform. #cryptocurrency #xrp #bitcoin https://t.co/Kw2FH2IrmH'",Hey are giving away XRP and a course of a course from their platform cryptocurrency xrp itcoin
2019-11-17T14:51:19.000Z,b'Binance: The inside story of the world\xe2\x80\x99s biggest Bitcoin exchange #Bitcoin  https://t.co/Hgqp8YwliC',Binance The inside story of the world xe2 x80 x99s iggest Bitcoin exchange Bitcoin
2019-11-17T14:51:29.000Z,"b'1 Bitcoin ( #BTC )\\nDollar: 8522.68$ \\n\\n1 Bitcoin Cash ( #BCH )\\nDollar: 2,67.29$ \\n\\n1 Ethereum ( #ETH )\\nDollar: 184.32\\xe2\\x80\\xa6 https://t.co/oWX6Weprtr'",1 Bitcoin BTC nDollar 8522 68 n n1 Bitcoin Cash BCH nDollar 2 67 29 n n1 Ethereum ETH nDollar 184 32 xe2 x80 xa6
2019-11-17T14:52:11.000Z,b'r/#bitcoin - The Market https://t.co/lzu5KIoSO4',r itcoin The Market
2019-11-17T14:52:16.000Z,b'r/#bitcoin - The Elasticity of Demand for Bitcoin https://t.co/F0n0sE9UzQ',r itcoin The Elasticity of Demand for Bitcoin
2019-11-17T14:52:45.000Z,b'$mft #mainframe \xf0\x9f\x9a\x80\xf0\x9f\x9a\x80\xf0\x9f\x9a\x80\xf0\x9f\x9a\x80\xf0\x9f\x9a\x80\xf0\x9f\x9a\x80\xf0\x9f\x9a\x80\n\n$MFT MOONTIME\xf0\x9f\x9a\x80\xf0\x9f\x9a\x80\xf0\x9f\x9a\x80\n\n#btc #bch #xrp #eth #ltc #eos #neo #xlm #bitcoin https://t.co/bYnjTag4gz',mft mainframe xf0 x9f x9a x80 xf0 x9f x9a x80 xf0 x9f x9a x80 xf0 x9f x9a x80 xf0 x9f x9a x80 xf0 x9f x9a x80 xf0 x9f x9a x80 n n MFT MOONTIME xf0 x9f x9a x80 xf0 x9f x9a x80 xf0 x9f x9a x80 n n tc ch xrp eth ltc eos neo xlm itcoin
2019-11-17T14:52:49.000Z,b'ProtonMail Reveals It\xe2\x80\x99s Been \xe2\x80\x98HODLing\xe2\x80\x99 Its Bitcoin Payments for Years https://t.co/1X67XokqmX\n#bitcoin #crypto\xe2\x80\xa6 https://t.co/5oFARVNOCU',ProtonMail Reveals It xe2 x80 x99s Been xe2 x80 x98HODLing xe2 x80 x99 Its Bitcoin Payments for Years crypto xe2 x80 xa6
2019-11-17T14:52:50.000Z,b'\xe2\xad\x90\xef\xb8\x8fCrypto Platform Celsius Network Reaches $4.25 Billion in Total Loans\xe2\xad\x90\xef\xb8\x8f\nRead\xf0\x9f\x91\x89https://t.co/dg5E1uCiww\n\n#crypto\xe2\x80\xa6 https://t.co/h02f6Sv64n',xe2 xad x90 xef x8 x8fCrypto Platform Celsius Network Reaches 4 25 Billion in Total Loans xe2 xad x90 xef x8 x8f nRead xf0 x9f x91 x89https
2019-11-17T14:53:00.000Z,"\"b\"\"@allyouracid @lawmaster @DegenSpartan I'm calling those con artists out on every occasion i can. To protect others\\xe2\\x80\\xa6 https://t.co/INpRTPJaCu\"\"\"",I m calling those con artists out on every occasion i can To protect others xe2 x80 xa6
2019-11-17T14:53:08.000Z,b'Make your money on expert invest. #trade #bitcoin #investment #africa #pakistan #forex https://t.co/AMCawndNbr',Make your money on expert invest trade itcoin investment africa pakistan forex
2019-11-17T14:53:12.000Z,b'BTC Scam squeeze or ready to push higher? | Levels to watch for short v. long #cryptocurrency #bitcoin #crypto\xe2\x80\xa6 https://t.co/RqI71AdhTn',BTC Scam squeeze or ready to push higher Levels to watch for short v long cryptocurrency itcoin crypto xe2 x80 xa6
2019-11-17T14:53:42.000Z,"b'$btc #btc #bitcoin Global Bor\\xc3\\xa7, Bitcoin Ba\\xc5\\x9f\\xc4\\xb1na 12 Milyon Dolara \\xc3\\x87\\xc4\\xb1kt\\xc4\\xb1! #kriptopara\\nhttps://t.co/iCjLSMM8Z8'",tc tc itcoin Gloal Bor xc3 xa7 Bitcoin Ba xc5 x9f xc4 x1na 12 Milyon Dolara xc3 x87 xc4 x1kt xc4 x1 kriptopara
2019-11-17T14:53:54.000Z,b'@codeyisfun #bitcoin\n#steller\n#Ethereum',itcoin n steller n Ethereum
2019-11-17T14:54:22.000Z,b'Maintain Your Mindset https://t.co/7cKQgURwAv\n\n#finance #business #money #investing #investment #wealth #realestate\xe2\x80\xa6 https://t.co/jcrokVNqnS',Maintain Your Mindset usiness money investing investment wealth realestate xe2 x80 xa6
2019-11-17T14:54:24.000Z,b'How to Spot Bitcoin\xe2\x80\x99s Golden or Death Cross Using Simple Moving Averages (via @directorycoin) #bitcoin https://t.co/Lv85PgUb8E',How to Spot Bitcoin xe2 x80 x99s Golden or Death Cross Using Simple Moving Averages via itcoin
2019-11-17T14:54:56.000Z,b'#Bitcoin \xf0\x9f\x93\x88 \n\n\xe2\x96\x93\xe2\x96\x93\xe2\x96\x93\xe2\x96\x93\xe2\x96\x93\xe2\x96\x93\xe2\x96\x93\xe2\x96\x91\xe2\x96\x91\xe2\x96\x91\xe2\x96\x91\xe2\x96\x91\xe2\x96\x91\xe2\x96\x91\xe2\x96\x91 44%\n\n price: $8519.005',Bitcoin xf0 x9f x93 x88 n n xe2 x96 x93 xe2 x96 x93 xe2 x96 x93 xe2 x96 x93 xe2 x96 x93 xe2 x96 x93 xe2 x96 x93 xe2 x96 x91 xe2 x96 x91 xe2 x96 x91 xe2 x96 x91 xe2 x96 x91 xe2 x96 x91 xe2 x96 x91 xe2 x96 x91 44 n n price 8519 005
2019-11-17T14:55:02.000Z,b'1.c/ Great list of P2P #bitcoin exchanges.\nSource - https://t.co/UCazH3ahAC https://t.co/4S7Fsp66Wp',1 c Great list of P2P itcoin exchanges nSource
2019-11-17T14:55:04.000Z,b'#Twitter #Facebook #Bitcoin #Nifty #NSE #BusinessIntelligence #MindGame . https://t.co/rwOz5MzIt5',Twitter Faceook Bitcoin Nifty NSE BusinessIntelligence MindGame
2019-11-17T14:55:17.000Z,b'ProtonMail Reveals It\xe2\x80\x99s Been \xe2\x80\x98HODLing\xe2\x80\x99 Its Bitcoin Payments for Years\xe2\x80\xa6 https://t.co/V4OKz2nMlK #bitcoin',ProtonMail Reveals It xe2 x80 x99s Been xe2 x80 x98HODLing xe2 x80 x99 Its Bitcoin Payments for Years xe2 x80 xa6 itcoin
2019-11-17T14:55:19.000Z,b'\xf0\x9f\x91\x8c\n#Bitcoin #blockchain https://t.co/WThwB9TRo2',xf0 x9f x91 x8c n Bitcoin lockchain
2019-11-17T14:55:35.000Z,b'A unique company with phenomenal and innovative approach to their work. #thebamboo #ICO #Crowdsale #Bitcoin\xe2\x80\xa6 https://t.co/LqPTNdCBWv',A unique company with phenomenal and innovative approach to their work theamoo ICO Crowdsale Bitcoin xe2 x80 xa6
2019-11-17T14:55:45.000Z,b'\xe3\x83\x89\xe3\x83\xad\xe3\x83\xbc\xe3\x83\xb3\xe9\x96\xa2\xe9\x80\xa3\xe3\x81\xaeico\xe3\x81\xa7\xe3\x81\x99\n\xe3\x82\xa2\xe3\x83\xa1\xe3\x83\xaa\xe3\x82\xab\xe3\x81\xa7SEC\xe6\x89\xbf\xe8\xaa\x8d\xe6\xb8\x88\xe3\x81\xbf\nhttps://t.co/hoZ4P4fd8p\nSKYFCHAIN IS THE FIRST B2R (BUSINESS-TO-ROBOTS) BLOCKCHAIN BASED\xe2\x80\xa6 https://t.co/quDvWI3YKE',xe3 x83 x89 xe3 x83 xad xe3 x83 xc xe3 x83 x3 xe9 x96 xa2 xe9 x80 xa3 xe3 x81 xaeico xe3 x81 xa7 xe3 x81 x99 n xe3 x82 xa2 xe3 x83 xa1 xe3 x83 xaa xe3 x82 xa xe3 x81 xa7SEC xe6 x89 xf xe8 xaa x8d xe6 x8 x88 xe3 x81 xf nhttps IS THE FIRST B2R BUSINESS TO ROBOTS BLOCKCHAIN BASED xe2 x80 xa6
