2019-11-17T15:00:24.000Z,b'#bitcoin Earn FREE bitcoin with this easy strategy \xe2\x96\xb6 https://t.co/K41USsQ7H8 https://t.co/rmw656ri5r',itcoin Earn FREE itcoin with this easy strategy xe2 x96 x6
2019-11-17T15:00:30.000Z,b'#\xe4\xbb\xae\xe6\x83\xb3\xe9\x80\x9a\xe8\xb2\xa8\xe9\x80\x9f\xe5\xa0\xb1 Bobby Lee\xe6\xb0\x8f\xe3\x80\x81Satoshi\xe3\x81\xae\xe6\xad\xa3\xe4\xbd\x93\xe3\x81\xab\xe3\x81\xa4\xe3\x81\x84\xe3\x81\xa6\xe7\xa7\x81\xe8\xa6\x8b #\xe4\xbb\xae\xe6\x83\xb3\xe9\x80\x9a\xe8\xb2\xa8 #Bitcoin',xe4 x xae xe6 x83 x3 xe9 x80 x9a xe8 x2 xa8 xe9 x80 x9f xe5 xa0 x1 Boy Lee xe6 x0 x8f xe3 x80 x81Satoshi xe3 x81 xae xe6 xad xa3 xe4 xd x93 xe3 x81 xa xe3 x81 xa4 xe3 x81 x84 xe3 x81 xa6 xe7 xa7 x81 xe8 xa6 x8 xe4 x xae xe6 x83 x3 xe9 x80 x9a xe8 x2 xa8 Bitcoin
2019-11-17T15:00:30.000Z,b'BTC hourly update\n$8535.15    |    -0.0001%\xf0\x9f\x93\x89\n$BTC #BTCUSD #Bitcoin',BTC hourly update n 8535 15 0 0001 xf0 x9f x93 x89 n BTC BTCUSD Bitcoin
2019-11-17T15:00:33.000Z,"\"b\"\"Apollo Facts\\nA dose of Apollo facts you did and didn't know!\\n\\nApollo fact #100 #ApolloSupportTeam\\n\\nTelegram Communi\\xe2\\x80\\xa6 https://t.co/94MVBTKjjE\"\"\"",Apollo Facts nA dose of Apollo facts you did and didn t know n nApollo fact 100 ApolloSupportTeam n nTelegram Communi xe2 x80 xa6
2019-11-17T15:00:40.000Z,b'Interested in earning #Bitcoin every day in your sleep? Friend me on #Facebook https://t.co/2WJYXny55P',Interested in earning Bitcoin every day in your sleep Friend me on Faceook
2019-11-17T15:00:44.000Z,b'If china banned bitcoin mining and other crypto from there country.. where do you guys think #bitcoin will go..',If china anned itcoin mining and other crypto from there country where do you guys think itcoin will go
2019-11-17T15:00:45.000Z,b'#BTCUSD Market #1H timeframe on  November 17 at 14:00 (UTC)  is #Bullish.  #cryptocurrency #bitcoin  #btc #crypto\xe2\x80\xa6 https://t.co/WIE5G1dlLV',BTCUSD Market 1H timeframe on Novemer 17 at 14 00 UTC is Bullish cryptocurrency itcoin tc crypto xe2 x80 xa6
2019-11-17T15:00:49.000Z,"\"b\"\"SPECIALE: Basi per la TRANQUILLITA' \\\\ INDIPENDENZA FINANZIARIA https://t.co/DWG2FlzElA via @YouTube\\xe2\\x80\\xa6 https://t.co/Bmpdip63jM\"\"\"",SPECIALE Basi per la TRANQUILLITA INDIPENDENZA FINANZIARIA via xe2 x80 xa6
2019-11-17T15:00:51.000Z,b'Gr\xc3\xa1fico #BTCUSD $BTCUSD #Bitcoin intraday https://t.co/z4g2Pi4RHf',Gr xc3 xa1fico BTCUSD BTCUSD Bitcoin intraday
2019-11-17T15:00:56.000Z,b'#protonmail #reveals #it\xe2\x80\x99s been #\xe2\x80\x98hodling\xe2\x80\x99 its #bitcoin #payments for #years \n#instaairdrop #crypto #ripple #trx\xe2\x80\xa6 https://t.co/SXo83IIZge',protonmail reveals it xe2 x80 x99s een xe2 x80 x98hodling xe2 x80 x99 its itcoin payments for years n instaairdrop crypto ripple trx xe2 x80 xa6
2019-11-17T15:00:56.000Z,b'#CryptoCotizaci\xc3\xb3n\n\xf0\x9f\x93\xa3 Precios actualizados a las 16:00:48.\n #Bitcoin #Ethereum #XRP #BitcoinCash #Tether #Litecoin\xe2\x80\xa6 https://t.co/bqIWwHUwK7',CryptoCotizaci xc3 x3n n xf0 x9f x93 xa3 Precios actualizados a las 16 00 48 n Bitcoin Ethereum XRP BitcoinCash Tether Litecoin xe2 x80 xa6
2019-11-17T15:01:00.000Z,"b'#bitacademyweb\\nLa billetera Electrum, rapidez y movilidad \\nhttps://t.co/CxXD0rnYOn\\n#carteradigital  #claveprivada\\xe2\\x80\\xa6 https://t.co/sLJaAO0PCi'",itacademywe nLa illetera Electrum rapidez y movilidad nhttps claveprivada xe2 x80 xa6
2019-11-17T15:01:02.000Z,b'#adoption: #5 #business #industries that #accept #bitcoin in #2019 \n#instavenezuela #instanews #cryptocurrency\xe2\x80\xa6 https://t.co/rD9jUhVEyq',adoption 5 usiness industries that accept itcoin in 2019 n instavenezuela instanews cryptocurrency xe2 x80 xa6
2019-11-17T15:01:04.000Z,b'@Fidelity When are the #bitcoin options coming? #cryptocurrency',When are the itcoin options coming cryptocurrency
2019-11-17T15:01:07.000Z,b'1 #BTC (#Bitcoin) quotes:\n$8516.54/$8523.96 #Bitstamp\n$8518.64/$8519.50 #Kraken\n\xe2\x87\xa2$-5.32/$2.96',1 BTC Bitcoin quotes n 8516 54 8523 96 Bitstamp n 8518 64 8519 50 Kraken n xe2 x87 xa2 5 32 2 96
2019-11-17T15:01:11.000Z,b'Bitcoin SV (BSV) gana 0.6% respecto a #Bitcoin y cotiza a 125.245usd en el puesto #9 segun MarketCap.\xe2\x80\xa6 https://t.co/38NtTEuWgJ',Bitcoin SV BSV gana 0 6 respecto a Bitcoin y cotiza a 125 245usd en el puesto 9 segun MarketCap xe2 x80 xa6
2019-11-17T15:01:14.000Z,b'\xe2\x82\xac 7767.6 #bitcoin',xe2 x82 xac 7767 6 itcoin
2019-11-17T15:01:19.000Z,b'ProtonMail Reveals It\xe2\x80\x99s Been \xe2\x80\x98HODLing\xe2\x80\x99 Its #Bitcoin Payments for Years https://t.co/fHtLwFKhGL',ProtonMail Reveals It xe2 x80 x99s Been xe2 x80 x98HODLing xe2 x80 x99 Its Bitcoin Payments for Years
2019-11-17T15:01:19.000Z,b'Trust Deed Investments \n\n#investments #investment #investing #business #invest #money #investors #investor #finance\xe2\x80\xa6 https://t.co/zWGuqX40dm',Trust Deed Investments n n investments investment investing usiness invest money investors investor finance xe2 x80 xa6
2019-11-17T15:01:21.000Z,b'Finally. The time for plan B has come a long time ago. Hurry up! \xf0\x9f\xa7\x90 #bitcoin https://t.co/p25R5s6Rg6',Finally The time for plan B has come a long time ago Hurry up xf0 x9f xa7 x90 itcoin
2019-11-17T15:01:26.000Z,b'#crypto price changes last hour\n\n\xf0\x9f\x9a\x80\n$RLC +4.82%\n$GAME +3.75%\n$MUE +3.20%\n\n\xf0\x9f\x8c\xa7\xef\xb8\x8f\n$MER -10.46%\n$XHV -6.25%\n$FLO -6.14%\n\n#bitcoin #cryptocurrency',crypto price changes last hour n n xf0 x9f x9a x80 n RLC 4 82 n GAME 3 75 n MUE 3 20 n n xf0 x9f x8c xa7 xef x8 x8f n MER 10 46 n XHV 6 25 n FLO 6 14 n n itcoin cryptocurrency
2019-11-17T15:01:30.000Z,b'$BSV\nBuy at #OKEx-BTC and sell at #Crex24-BTC. Ratio: 1.63%\nBuy at #Digifinex-BTC and sell at #Crex24-BTC. Ratio: 1\xe2\x80\xa6 https://t.co/aJiFjljeX5',BSV nBuy at OKEx BTC and sell at Crex24 BTC Ratio 1 63 nBuy at Digifinex BTC and sell at Crex24 BTC Ratio 1 xe2 x80 xa6
2019-11-17T15:01:31.000Z,b'#BCH es m\xc3\xa1s utilizado en #Venezuela que #BTC seg\xc3\xban el mapa de adopci\xc3\xb3n de la criptomoneda resultante del hard fork\xe2\x80\xa6 https://t.co/EtZD1zoVSI',BCH es m xc3 xa1s utilizado en Venezuela que BTC seg xc3 xan el mapa de adopci xc3 x3n de la criptomoneda resultante del hard fork xe2 x80 xa6
2019-11-17T15:01:31.000Z,b'$BAT\nBuy at #Cryptosa-TRY and sell at #Oceanex-USDT. Ratio: 1.07%\nBuy at #Cryptosa-BTC and sell at #Bitrue-BTC. Rat\xe2\x80\xa6 https://t.co/BRaAxgBkRf',BAT nBuy at Cryptosa TRY and sell at Oceanex USDT Ratio 1 07 nBuy at Cryptosa BTC and sell at Bitrue BTC Rat xe2 x80 xa6
2019-11-17T15:01:32.000Z,b'Trading automatico e non solo... Creare bitcoin con noi \xc3\xa8 facilissimo\nInfo whatsapp 3408258759\n\n#bitcoin \n#mining\xe2\x80\xa6 https://t.co/IpeqIafLRN',Trading automatico e non solo Creare itcoin con noi xc3 xa8 facilissimo nInfo whatsapp 3408258759 n n itcoin n mining xe2 x80 xa6
2019-11-17T15:01:32.000Z,b'$PAX\nBuy at #MXC-USDT and sell at #Crex24-USD. Ratio: 1.82%\n#bitcoin #arbitrage #arbitraj #ArbingTool \nhttps://t.co/xiFUPzcOcC',PAX nBuy at MXC USDT and sell at Crex24 USD Ratio 1 82 n itcoin aritrage aritraj AringTool
2019-11-17T15:01:33.000Z,"\"b\"\"This #Bitcoin and $crypto conference has FREE ENTRY. It's sponsor-supported. Nobody's taking exhorbitant amounts of\\xe2\\x80\\xa6 https://t.co/68Zmr28gdY\"\"\"",This Bitcoin and crypto conference has FREE ENTRY It s sponsor supported Noody s taking exhoritant amounts of xe2 x80 xa6
2019-11-17T15:01:33.000Z,"b'$XVG large peak detected(1.82%)! Monitoring, not trading(yet). Sell alert at 0.00000056 $BTC - According to my calc\\xe2\\x80\\xa6 https://t.co/qc4fSIK19k'",XVG large peak detected 1 82 Monitoring not trading yet Sell alert at 0 00000056 BTC According to my calc xe2 x80 xa6
2019-11-17T15:01:34.000Z,b'$ADA\nBuy at #Sistemkoin-ETH and sell at #Binance-ETH. Ratio: 0.58%\nBuy at #Sistemkoin-ETH and sell at #EXMO-ETH. Ra\xe2\x80\xa6 https://t.co/x9B49DBGCR',ADA nBuy at Sistemkoin ETH and sell at Binance ETH Ratio 0 58 nBuy at Sistemkoin ETH and sell at EXMO ETH Ra xe2 x80 xa6
2019-11-17T15:01:52.000Z,b'\xf0\x9f\x91\x8c\xf0\x9f\x98\x8d Magic Lightning Cloud Classic T-Shirt White \xf0\x9f\x98\x8d\xf0\x9f\x91\x8c\nTake 25% OFF with code WHALE25\nhttps://t.co/SaTBCtMcEb  \xf0\x9f\x91\x88\xe2\x80\xa6 https://t.co/zX5As33nfd',xf0 x9f x91 x8c xf0 x9f x98 x8d Magic Lightning Cloud Classic T Shirt White xf0 x9f x98 x8d xf0 x9f x91 x8c nTake 25 OFF with code WHALE25 nhttps xf0 x9f x91 x88 xe2 x80 xa6
2019-11-17T15:02:02.000Z,b'Yenilenme s\xc3\xbcrecinin ard\xc4\xb1ndan yar\xc4\xb1n i\xc5\x9flemlere ba\xc5\x9fl\xc4\xb1yoruz..\n\n\xc4\xb0lk hafta kazan\xc3\xa7 hedefimiz ne kadar olmal\xc4\xb1 sizce?\n\n\xf0\x9f\x91\x89Yoru\xe2\x80\xa6 https://t.co/OIAOoYpMYq',Yenilenme s xc3 xcrecinin ard xc4 x1ndan yar xc4 x1n i xc5 x9flemlere a xc5 x9fl xc4 x1yoruz n n xc4 x0lk hafta kazan xc3 xa7 hedefimiz ne kadar olmal xc4 x1 sizce n n xf0 x9f x91 x89Yoru xe2 x80 xa6
2019-11-17T15:02:03.000Z,b'KickEX  Airdrop (30$) https://t.co/46HeHb3zpE\n\n#Airdrops #kickex #bitcoin #airdrop',KickEX Airdrop 30 kickex itcoin airdrop
2019-11-17T15:02:12.000Z,b'The project team will use blockchain to improve real estate processes. This can lead to significant qualitative cha\xe2\x80\xa6 https://t.co/b3QDoydXR9',The project team will use lockchain to improve real estate processes This can lead to significant qualitative cha xe2 x80 xa6
2019-11-17T15:02:24.000Z,b'$XMR\nBuy at #Digifinex-BTC and sell at #Crex24-BTC. Ratio: 0.44%\n#bitcoin #arbitrage #arbitraj #ArbingTool \nhttps://t.co/xiFUPzcOcC',XMR nBuy at Digifinex BTC and sell at Crex24 BTC Ratio 0 44 n itcoin aritrage aritraj AringTool
2019-11-17T15:02:26.000Z,b'$INK\nBuy at #EXMO-USD and sell at #Gate.io-USDT. Ratio: 1.83%\nBuy at #EXMO-BTC and sell at #Gate.io-BTC. Ratio: 1.9\xe2\x80\xa6 https://t.co/nF21Z9PYH4',INK nBuy at EXMO USD and sell at Gate io USDT Ratio 1 83 nBuy at EXMO BTC and sell at Gate io BTC Ratio 1 9 xe2 x80 xa6
2019-11-17T15:02:26.000Z,b'$WTC\nBuy at #Bitrue-ETH and sell at #OKEx-ETH. Ratio: 10.72%\n#bitcoin #arbitrage #arbitraj #ArbingTool \nhttps://t.co/xiFUPzcOcC',WTC nBuy at Bitrue ETH and sell at OKEx ETH Ratio 10 72 n itcoin aritrage aritraj AringTool
2019-11-17T15:02:26.000Z,b'$FUN\nBuy at #Binance-USDT and sell at #Vebitcoin-TRY. Ratio: 0.21%\n#bitcoin #arbitrage #arbitraj #ArbingTool \nhttps://t.co/xiFUPzcOcC',FUN nBuy at Binance USDT and sell at Veitcoin TRY Ratio 0 21 n itcoin aritrage aritraj AringTool
2019-11-17T15:02:27.000Z,b'$BCHABC\nBuy at #Poloniex-USDT and sell at #Vebitcoin-TRY. Ratio: 0.73%\n#bitcoin #arbitrage #arbitraj #ArbingTool \nhttps://t.co/xiFUPzcOcC',BCHABC nBuy at Poloniex USDT and sell at Veitcoin TRY Ratio 0 73 n itcoin aritrage aritraj AringTool
2019-11-17T15:02:27.000Z,b'$GTO\nBuy at #OKEx-USDT and sell at #Binance-BNB. Ratio: 0.19%\n#bitcoin #arbitrage #arbitraj #ArbingTool \nhttps://t.co/xiFUPzcOcC',GTO nBuy at OKEx USDT and sell at Binance BNB Ratio 0 19 n itcoin aritrage aritraj AringTool
2019-11-17T15:02:27.000Z,b'$KEY\nBuy at #Binance-USDT and sell at #MXC-USDT. Ratio: 1.25%\n#bitcoin #arbitrage #arbitraj #ArbingTool \nhttps://t.co/xiFUPzcOcC',KEY nBuy at Binance USDT and sell at MXC USDT Ratio 1 25 n itcoin aritrage aritraj AringTool
