2019-11-17T13:58:03.000Z,"b'$btc #btc #bitcoin ABD Ba\\xc5\\x9fkan Aday\\xc4\\xb1 Yang, Blockchain Sekt\\xc3\\xb6r\\xc3\\xbcn\\xc3\\xbc D\\xc3\\xbczenlemek \\xc4\\xb0stiyor #kriptopara\\nhttps://t.co/kNO6soDPMk'",tc tc itcoin ABD Ba xc5 x9fkan Aday xc4 x1 Yang Blockchain Sekt xc3 x6r xc3 xcn xc3 xc D xc3 xczenlemek xc4 x0stiyor kriptopara
2019-11-17T13:58:03.000Z,b'@jorgeluisfarias @mattaaron @aaronolmos @jacksonpo7 @P_Hold @ernestocontrer @Mariandipietra @mariannaparraga\xe2\x80\xa6 https://t.co/xzy2CZ0MSj',xe2 x80 xa6
2019-11-17T13:58:19.000Z,b'#bitcoin #MoneyTalks https://t.co/MjG7fQ8DD6',itcoin MoneyTalks
2019-11-17T13:58:27.000Z,b'#borsa da ak\xc4\xb1nt\xc4\xb1ya kar\xc5\x9f\xc4\xb1 k\xc3\xbcrek \xc3\xa7ekmeyi birde ben deniycem. \xf0\x9f\x98\x85 #bitcoin #btc #dolar #hisse https://t.co/CyVKQ3RV25',orsa da ak xc4 x1nt xc4 x1ya kar xc5 x9f xc4 x1 k xc3 xcrek xc3 xa7ekmeyi irde en deniycem xf0 x9f x98 x85 itcoin tc dolar hisse
2019-11-17T13:58:39.000Z,b'#DACX #IEO #cryptocurrency #blockchain #bitcoin https://t.co/CS2TILfJyz https://t.co/GWvX8BlLqQ',DACX IEO cryptocurrency lockchain itcoin
2019-11-17T13:58:56.000Z,b'In Holland you can even buy bitcoin (crypto) giftcards as a gift! \xf0\x9f\x8e\x81 \n\n#bitcoin #adoption #crypto https://t.co/zH5r4zgQYY',In Holland you can even uy itcoin crypto giftcards as a gift xf0 x9f x8e x81 n n itcoin adoption crypto
2019-11-17T13:59:17.000Z,b'#criptomonedas #bitcoin #cryptocurrencynews #cryptocurrency /\\ How crypto has helped people living in countries wit\xe2\x80\xa6 https://t.co/9VuHA5EVDw',criptomonedas itcoin cryptocurrencynews cryptocurrency How crypto has helped people living in countries wit xe2 x80 xa6
2019-11-17T13:59:44.000Z,b'asdfsad\n\xf0\x9f\x94\xa5\xf0\x9f\x94\xa5\xe2\xac\x87\xe2\xac\x87\xf0\x9f\x94\xa5\xf0\x9f\x94\xa5\nhttps://t.co/HtyglY6GXd\n\n#bitcoin #crypto #news #noticiasbitcoin',asdfsad n xf0 x9f x94 xa5 xf0 x9f x94 xa5 xe2 xac x87 xe2 xac x87 xf0 x9f x94 xa5 xf0 x9f x94 xa5 nhttps crypto news noticiasitcoin
2019-11-17T13:59:46.000Z,b'\xf0\x9f\x8e\x81you love trading #bitcoin and #Ethereum ?\n\xf0\x9f\x8e\x81you love playing ?\n\xf0\x9f\x8e\x81you love betting?\n\n    This gaming platform is for\xe2\x80\xa6 https://t.co/WVDzwXgC3M',xf0 x9f x8e x81you love trading itcoin and Ethereum n xf0 x9f x8e x81you love playing n xf0 x9f x8e x81you love etting n n This gaming platform is for xe2 x80 xa6
2019-11-17T14:00:00.000Z,"b'Just installed @generalbytes #bitcoin machine at Westfields White City in #London, UK \\xf0\\x9f\\x87\\xac\\xf0\\x9f\\x87\\xa7. Operated by @Cryptominal.\\xe2\\x80\\xa6 https://t.co/nwOClEogp5'",Just installed itcoin machine at Westfields White City in London UK xf0 x9f x87 xac xf0 x9f x87 xa7 Operated y xe2 x80 xa6
2019-11-17T14:00:01.000Z,b'Visit https://t.co/20syBHFsoK to check the latest #bitcoin price in #gbp #uk #pound. You can also use our free $GBP to $BTC price converter.',Visit to check the latest itcoin price in gp uk pound You can also use our free GBP to BTC price converter
2019-11-17T14:00:01.000Z,"b'#HourlyCryptoStatus (#1 to #3):\\n\\n#1 #btc (#bitcoin): 8,535.32 USD | 0.3% 24h\\n\\n#2 #eth (#ethereum): 184.31 USD | 1.1\\xe2\\x80\\xa6 https://t.co/Br68F6YGPS'",HourlyCryptoStatus 1 to 3 n n 1 tc itcoin 8 535 32 USD 0 3 24h n n 2 eth ethereum 184 31 USD 1 1 xe2 x80 xa6
2019-11-17T14:00:02.000Z,"\"b\"\"The Bitcoin $BTC price is currently 8597.02 $USD or 7779.19 $EUR.\\nIt's the number #1 cryptocurrency on the Earth wi\\xe2\\x80\\xa6 https://t.co/D9V0xT2lFf\"\"\"",The Bitcoin BTC price is currently 8597 02 USD or 7779 19 EUR nIt s the numer 1 cryptocurrency on the Earth wi xe2 x80 xa6
2019-11-17T14:00:02.000Z,b'MercadoBitcoin(BTC) =&gt; R$36300 | BlockChain(BTC) =&gt; R$35796 | MercadoBitcoin(LTC) =&gt; R$254 #bitcoin #litecoin',MercadoBitcoin BTC gt R 36300 BlockChain BTC gt R 35796 MercadoBitcoin LTC gt R 254 itcoin litecoin
2019-11-17T14:00:02.000Z,"b'11/17 23:00\\xe7\\x8f\\xbe\\xe5\\x9c\\xa8\\n\\n#Bitcoin : 928,580\\xe5\\x86\\x86\\xe2\\x86\\x93\\n#NEM #XEM : 4.57\\xe5\\x86\\x86\\xe2\\x86\\x93\\n#Monacoin : 115.5\\xe5\\x86\\x86\\xe2\\x86\\x93\\n#Ethereum : 20,130\\xe5\\x86\\x86\\xe2\\x86\\x92\\n#Zaif : 0.156\\xe5\\x86\\x86\\xe2\\x86\\x93'",11 17 23 00 xe7 x8f xe xe5 x9c xa8 n n Bitcoin 928 580 xe5 x86 x86 xe2 x86 x93 n NEM XEM 4 57 xe5 x86 x86 xe2 x86 x93 n Monacoin 115 5 xe5 x86 x86 xe2 x86 x93 n Ethereum 20 130 xe5 x86 x86 xe2 x86 x92 n Zaif 0 156 xe5 x86 x86 xe2 x86 x93
2019-11-17T14:00:02.000Z,"b'Bitcoin: $8,533.45\\n +0.28% (+$23.85)\\nHigh: $8,585.12\\nLow: $8,372.71\\nVolume: 47\\n\\n$BTC #BTC #bitcoin'",Bitcoin 8 533 45 n 0 28 23 85 nHigh 8 585 12 nLow 8 372 71 nVolume 47 n n BTC BTC itcoin
2019-11-17T14:00:03.000Z,b'#Bitcoin (#BTC)\nUSD 8561.99\nEUR 7729.58\n\n#Litecoin (#LTC)\nUSD 59.44\nEUR 53.69\n\n#Ethereum (#ETH)\nUSD 184.54\nEUR 166.\xe2\x80\xa6 https://t.co/VOyHmnAGb5',Bitcoin BTC nUSD 8561 99 nEUR 7729 58 n n Litecoin LTC nUSD 59 44 nEUR 53 69 n n Ethereum ETH nUSD 184 54 nEUR 166 xe2 x80 xa6
2019-11-17T14:00:03.000Z,"b'Last hourly biggest #BITCOIN blockchain transaction : \\n \\n292 #BTC (2,495,164 USD) from unknow wallet to unknow wall\\xe2\\x80\\xa6 https://t.co/XrNBUNSNTN'",Last hourly iggest BITCOIN lockchain transaction n n292 BTC 2 495 164 USD from unknow wallet to unknow wall xe2 x80 xa6
2019-11-17T14:00:03.000Z,"\"b\"\"Tomorrow's Bitcoin(BTC) forecast is\\n        \\n\\xe2\\x96\\xb3UP 45% \\n\\xe2\\x96\\xbcDOWN 55%\\n\\n#Bitcoin",Tomorrow s Bitcoin BTC forecast is n n xe2 x96 x3UP 45 n xe2 x96 xcDOWN 55 n n Bitcoin
2019-11-17T14:00:03.000Z,b'\xf0\x9f\x93\x88 #Bitcoin (#BTC $BTC) global volume weighted average is currently $8524.917 | 0.42% change over 24hrs.  #crypto\xe2\x80\xa6 https://t.co/ywcTX1YVTM',xf0 x9f x93 x88 Bitcoin BTC BTC gloal volume weighted average is currently 8524 917 0 42 change over 24hrs crypto xe2 x80 xa6
2019-11-17T14:00:03.000Z,b'\xe3\x81\xbf\xe3\x82\x93\xe3\x81\xaa\xe3\x81\xae\xe3\x83\x93\xe3\x83\x83\xe3\x83\x88\xe3\x82\xb3\xe3\x82\xa4\xe3\x83\xb3(btc) \xe3\x81\xae\xe4\xba\x88\xe6\x83\xb3\n        \n\xe2\x96\xb3\xe4\xb8\x8a\xe3\x81\x92\xe4\xba\x88\xe6\x83\xb345% \n\xe2\x96\xbc\xe4\xb8\x8b\xe3\x81\x92\xe4\xba\x88\xe6\x83\xb355%\n\n#\xe4\xbb\xae\xe6\x83\xb3\xe9\x80\x9a\xe8\xb2\xa8 #btcjpy #btc #bitcoin #\xe3\x83\x93\xe3\x83\x83\xe3\x83\x88\xe3\x82\xb3\xe3\x82\xa4\xe3\x83\xb3\n\n\xe4\xbb\xae\xe6\x83\xb3\xe9\x80\x9a\xe8\xb2\xa8\xe4\xba\x88\xe6\x83\xb3\xe3\x82\xa2\xe3\x83\x97\xe3\x83\xaa\xe2\x80\xa6 https://t.co/kbKIA7hXnE',xe3 x81 xf xe3 x82 x93 xe3 x81 xaa xe3 x81 xae xe3 x83 x93 xe3 x83 x83 xe3 x83 x88 xe3 x82 x3 xe3 x82 xa4 xe3 x83 x3 tc xe3 x81 xae xe4 xa x88 xe6 x83 x3 n n xe2 x96 x3 xe4 x8 x8a xe3 x81 x92 xe4 xa x88 xe6 x83 x345 n xe2 x96 xc xe4 x8 x8 xe3 x81 x92 xe4 xa x88 xe6 x83 x355 n n xe4 x xae xe6 x83 x3 xe9 x80 x9a xe8 x2 xa8 tcjpy tc itcoin xe3 x83 x93 xe3 x83 x83 xe3 x83 x88 xe3 x82 x3 xe3 x82 xa4 xe3 x83 x3 n n xe4 x xae xe6 x83 x3 xe9 x80 x9a xe8 x2 xa8 xe4 xa x88 xe6 x83 x3 xe3 x82 xa2 xe3 x83 x97 xe3 x83 xaa xe2 x80 xa6
2019-11-17T14:00:04.000Z,b'One Bitcoin now worth $8539.003. Market Cap $154.151 Billion. Based on #coindesk BPI #bitcoin',One Bitcoin now worth 8539 003 Market Cap 154 151 Billion Based on coindesk BPI itcoin
2019-11-17T14:00:04.000Z,b'2019/11/17 23:00\n\nBTC 928816.5\xe5\x86\x86\nETH 20061\xe5\x86\x86\nETC 507.5\xe5\x86\x86\nBCH 29051.5\xe5\x86\x86\nXRP 28.6\xe5\x86\x86\nXEM 4.6\xe5\x86\x86\nLSK 85.6\xe5\x86\x86\nMONA 114.9\xe5\x86\x86\n\n#\xe4\xbb\xae\xe6\x83\xb3\xe9\x80\x9a\xe8\xb2\xa8\xe2\x80\xa6 https://t.co/THX060O0az',2019 11 17 23 00 n nBTC 928816 5 xe5 x86 x86 nETH 20061 xe5 x86 x86 nETC 507 5 xe5 x86 x86 nBCH 29051 5 xe5 x86 x86 nXRP 28 6 xe5 x86 x86 nXEM 4 6 xe5 x86 x86 nLSK 85 6 xe5 x86 x86 nMONA 114 9 xe5 x86 x86 n n xe4 x xae xe6 x83 x3 xe9 x80 x9a xe8 x2 xa8 xe2 x80 xa6
2019-11-17T14:00:05.000Z,b'Union Nettetal vs SC Velbert. #bitcoin #betting - https://t.co/NH6X40hJvh',Union Nettetal vs SC Velert itcoin etting
2019-11-17T14:00:05.000Z,b'One Bitcoin now worth $8533.17@bitstamp. High $8589.100. Low $8375.000. Market Cap $154.037 Billion #bitcoin https://t.co/PEiESojLiS',One Bitcoin now worth 8533 17 High 8589 100 Low 8375 000 Market Cap 154 037 Billion itcoin
2019-11-17T14:00:06.000Z,b'TOP-12 most-mentioned #crypto this hour:\n1. #bitcoin\n2. #ethereum\n3. #tron\n4. #ardor\n5. #xrp\n6. #litecoin\n7. #nem\n8\xe2\x80\xa6 https://t.co/MRy8CM3xj0',TOP 12 most mentioned crypto this hour n1 itcoin n2 ethereum n3 tron n4 ardor n5 xrp n6 litecoin n7 nem n8 xe2 x80 xa6
2019-11-17T14:00:07.000Z,"b'\\xe2\\x8f\\xb0 17:00\\n\\xe2\\x82\\xbf Bitcoin = 8.474,5763 $\\n#bitcoin #btc #BTCUSD'",xe2 x8f x0 17 00 n xe2 x82 xf Bitcoin 8 474 5763 n itcoin tc BTCUSD
2019-11-17T14:00:07.000Z,b'#bitcoin Earn FREE bitcoin with this easy strategy \xe2\x96\xb6 https://t.co/K41USsQ7H8 https://t.co/RNB3JT0eWo',itcoin Earn FREE itcoin with this easy strategy xe2 x96 x6
2019-11-17T14:00:09.000Z,b'Bitcoin Falls Through Key Average as Traditional Markets Hit Record Highs \xf0\x9f\x91\x89 #CoinDesk #CryptocoinFactory #Bitcoin https://t.co/LHReeXV6BF',Bitcoin Falls Through Key Average as Traditional Markets Hit Record Highs xf0 x9f x91 x89 CoinDesk CryptocoinFactory Bitcoin
2019-11-17T14:00:10.000Z,"b'Nov 17, 2019 14:00:00 UTC | 8,538.50$ | 7,726.20\\xe2\\x82\\xac | 6,615.10\\xc2\\xa3 | #Bitcoin #BTC $BTC #crypto #financial #news https://t.co/TsdF2B0twg'",Nov 17 2019 14 00 00 UTC 8 538 50 7 726 20 xe2 x82 xac 6 615 10 xc2 xa3 Bitcoin BTC BTC crypto financial news
2019-11-17T14:00:12.000Z,"b'Nov 17, 2019 06:00AM #Bitcoin Price:\\nUSD 8642.56 | EUR 7693.00 | JPY 924601.29'",Nov 17 2019 06 00AM Bitcoin Price nUSD 8642 56 EUR 7693 00 JPY 924601 29
2019-11-17T14:00:15.000Z,"b'#BTC: \\xe2\\x82\\xba49.038,00\\n#ETH: \\xe2\\x82\\xba1.059,06\\n#LTC:  \\xe2\\x82\\xba340,71\\n#XRP: \\xe2\\x82\\xba1,51\\n\\n17.11.19 - 17:00\\n\\n#Bitcoin #Litecoin #Ethereum #Ripple\\xe2\\x80\\xa6 https://t.co/dJn7RdoLlX'",BTC xe2 x82 xa49 038 00 n ETH xe2 x82 xa1 059 06 n LTC xe2 x82 xa340 71 n XRP xe2 x82 xa1 51 n n17 11 19 17 00 n n Bitcoin Litecoin Ethereum Ripple xe2 x80 xa6
2019-11-17T14:00:15.000Z,"\"b'Plan your trip to the 3rd Annual International Payment Forum, #Vienna with #XcelTrip, use code \"\"Xcel10Nov\"\" to recie\\xe2\\x80\\xa6 https://t.co/4TaJrj03LD'\"",Plan your trip to the 3rd Annual International Payment Forum Vienna with XcelTrip use code Xcel10Nov to recie xe2 x80 xa6
2019-11-17T14:00:19.000Z,"b'Two US men charged with SIM swapping, stealing $550K\\n\\nRead More: https://t.co/bBIULkvowY\\n\\n#Crypto #SimSwap\\xe2\\x80\\xa6 https://t.co/13TfgUyqdy'",Two US men charged with SIM swapping stealing 550K n nRead More SimSwap xe2 x80 xa6
2019-11-17T14:00:24.000Z,b'Introducing DACX EXCHANGE\n\nDigital Asset &amp; Commodity Exchange utilizes artificial intelligence and high-performance\xe2\x80\xa6 https://t.co/4eyltyiW5L',Introducing DACX EXCHANGE n nDigital Asset amp Commodity Exchange utilizes artificial intelligence and high performance xe2 x80 xa6
2019-11-17T14:00:28.000Z,b'#bitcoin A very easy way to earn money. Do you want to get free bitcoin? Discover the magic \xe2\x96\xb6\xe2\x80\xa6 https://t.co/JZCevfJQpb',itcoin A very easy way to earn money Do you want to get free itcoin Discover the magic xe2 x96 x6 xe2 x80 xa6
2019-11-17T14:00:28.000Z,b'If having a #GameDay parlay you just have got to check us out. Parlay bets with added bonuses!\xe2\x80\xa6 https://t.co/DSPWEUpYY3',If having a GameDay parlay you just have got to check us out Parlay ets with added onuses xe2 x80 xa6
2019-11-17T14:00:29.000Z,b'The IRS Is Going After Bitcoin ATMs Next https://t.co/wFbptvUDMt\n\n#cryptocurrency #news #bitcoin #altcoin\xe2\x80\xa6 https://t.co/p09dZITtFU',The IRS Is Going After Bitcoin ATMs Next news itcoin altcoin xe2 x80 xa6
2019-11-17T14:00:30.000Z,b'#\xe4\xbb\xae\xe6\x83\xb3\xe9\x80\x9a\xe8\xb2\xa8\xe9\x80\x9f\xe5\xa0\xb1 Bitcoin ATM\xe3\x81\xae\xe8\xa8\xad\xe7\xbd\xae\xe5\x8f\xb0\xe6\x95\xb0\xe3\x81\x8c\xef\xbc\x96\xe5\x8d\x83\xe5\x8f\xb0\xe8\xb6\x85\xe3\x81\x88\xe3\x82\x8b #\xe4\xbb\xae\xe6\x83\xb3\xe9\x80\x9a\xe8\xb2\xa8 #\xe7\xb1\xb3\xe5\x9b\xbd #Bitcoin',xe4 x xae xe6 x83 x3 xe9 x80 x9a xe8 x2 xa8 xe9 x80 x9f xe5 xa0 x1 Bitcoin ATM xe3 x81 xae xe8 xa8 xad xe7 xd xae xe5 x8f x0 xe6 x95 x0 xe3 x81 x8c xef xc x96 xe5 x8d x83 xe5 x8f x0 xe8 x6 x85 xe3 x81 x88 xe3 x82 x8 xe4 x xae xe6 x83 x3 xe9 x80 x9a xe8 x2 xa8 xe7 x1 x3 xe5 x9 xd Bitcoin
2019-11-17T14:00:30.000Z,b'BTC hourly update\n$8536.23    |    -0.0049%\xf0\x9f\x93\x89\n$BTC #BTCUSD #Bitcoin',BTC hourly update n 8536 23 0 0049 xf0 x9f x93 x89 n BTC BTCUSD Bitcoin
2019-11-17T14:00:47.000Z,b'#BTCUSD Market #1H timeframe on  November 17 at 13:00 (UTC)  is #Bullish.  #cryptocurrency #bitcoin  #btc #crypto\xe2\x80\xa6 https://t.co/uGmKCeOdO3',BTCUSD Market 1H timeframe on Novemer 17 at 13 00 UTC is Bullish cryptocurrency itcoin tc crypto xe2 x80 xa6
