2019-11-17T04:45:14.000Z,b'\xf0\x9f\x94\x84 Prices update in $USD (1 hour):\n\n$BTC   - 8473.7 $    (+0.01 %)\n$ETH   - 181.23 $    (-0.19 %)\n$XRP   - 0.26 $\xe2\x80\xa6 https://t.co/TfdSvxPLAT',xf0 x9f x94 x84 Prices update in USD 1 hour n n BTC 8473 7 0 01 n ETH 181 23 0 19 n XRP 0 26 xe2 x80 xa6
2019-11-17T04:45:14.000Z,b'\xf0\x9f\x94\x84 Prices update in $USDT (1 hour):\n\n$BTC - 8483.19 $       (+0.03 %)\n$ETH - 181.3 $         (-0.34 %)\n$XRP - 0.26 $\xe2\x80\xa6 https://t.co/pJmdGr0DPA',xf0 x9f x94 x84 Prices update in USDT 1 hour n n BTC 8483 19 0 03 n ETH 181 3 0 34 n XRP 0 26 xe2 x80 xa6
2019-11-17T04:45:15.000Z,b'\xf0\x9f\x94\x84 Prices update in $EUR (1 hour):\n\n$BTC   - 7675.7 \xe2\x82\xac  (+0.06 %)\n$ETH   - 164.02 \xe2\x82\xac  (-0.29 %)\n$XRP   - 0.24 \xe2\x82\xac    (-0\xe2\x80\xa6 https://t.co/9jUBWiFirM',xf0 x9f x94 x84 Prices update in EUR 1 hour n n BTC 7675 7 xe2 x82 xac 0 06 n ETH 164 02 xe2 x82 xac 0 29 n XRP 0 24 xe2 x82 xac 0 xe2 x80 xa6
2019-11-17T04:45:18.000Z,b'#crypto price changes last 4 hours\n\n\xf0\x9f\x9a\x80\n$OST +15.79%\n$UPP +12.54%\n$RFR +10.86%\n\n\xf0\x9f\x8c\xa7\xef\xb8\x8f\n$NPXS -33.49%\n$HYDRO -14.48%\n$XDN\xe2\x80\xa6 https://t.co/iWb341MDX7',crypto price changes last 4 hours n n xf0 x9f x9a x80 n OST 15 79 n UPP 12 54 n RFR 10 86 n n xf0 x9f x8c xa7 xef x8 x8f n NPXS 33 49 n HYDRO 14 48 n XDN xe2 x80 xa6
2019-11-17T04:45:28.000Z,b'\xf0\x9f\x94\x84 Prices update in $USDT (1 hour):\n\n$BTC - 8474.65 $ (-0.04 %)\n$ETH - 181.21 $  (-0.32 %)\n$XRP - 0.26 $    (-0.07 %\xe2\x80\xa6 https://t.co/k50fDAP2PC',xf0 x9f x94 x84 Prices update in USDT 1 hour n n BTC 8474 65 0 04 n ETH 181 21 0 32 n XRP 0 26 0 07 xe2 x80 xa6
2019-11-17T04:45:49.000Z,b'What\xe2\x80\x99s the last thing you bought with #Bitcoin $BTC or any other #cryptocurrency',What xe2 x80 x99s the last thing you ought with Bitcoin BTC or any other cryptocurrency
2019-11-17T04:46:02.000Z,b'Free Bitcoins - Earn $65 free btc in 5 minutes https://t.co/31oergIDpu #bitcoin #freebtc #getbtc',Free Bitcoins Earn 65 free tc in 5 minutes itcoin freetc gettc
2019-11-17T04:46:11.000Z,b'@extstock @dcs_token I liked this exchange..) #cryptocurrency #bitcoin',I liked this exchange cryptocurrency itcoin
2019-11-17T04:46:42.000Z,b'\xf0\x9f\x94\x84 Prices update in $USD (1 hour):\n\n$BTC - 8473.7 $ (+0.01 %)\n$ETH - 181.23 $ (-0.2 %)\n$XRP - 0.26 $   (-0.06 %)\xe2\x80\xa6 https://t.co/oXrHVo5Bcu',xf0 x9f x94 x84 Prices update in USD 1 hour n n BTC 8473 7 0 01 n ETH 181 23 0 2 n XRP 0 26 0 06 xe2 x80 xa6
2019-11-17T04:47:05.000Z,b'Investigadores Criminales del IRS analizan los cajeros autom\xc3\xa1ticos y terminales de Bitcoin #Bitcoin #IRS\xe2\x80\xa6 https://t.co/xeZDsiKx8d',Investigadores Criminales del IRS analizan los cajeros autom xc3 xa1ticos y terminales de Bitcoin Bitcoin IRS xe2 x80 xa6
2019-11-17T04:47:27.000Z,b'1 word:\n\n#Bitcoin \n\nWhat\xe2\x80\x99s next???? https://t.co/ZWcs7V2mcY',1 word n n Bitcoin n nWhat xe2 x80 x99s next
2019-11-17T04:47:38.000Z,b'#cryptocurrency #bitcoin awesome airdrop https://t.co/7Be4fVwDcc',cryptocurrency itcoin awesome airdrop
2019-11-17T04:47:39.000Z,b'#DACX #IEO #cryptocurrency #blockchain #bitcoin https://t.co/BEOyHfLAQT',DACX IEO cryptocurrency lockchain itcoin
2019-11-17T04:48:04.000Z,b'You have the power to reveal insights and opportunities that might never come to light otherwise with\xe2\x80\xa6 https://t.co/sOEjNcpn80',You have the power to reveal insights and opportunities that might never come to light otherwise with xe2 x80 xa6
2019-11-17T04:48:24.000Z,b'Golden \xf0\x9f\x8e\x96\xef\xb8\x8f Money \xf0\x9f\x92\xb5 Team \xf0\x9f\xa4\x9d Presents\n\xf0\x9f\xa7\xa8THUMBIN MUSIC\xf0\x9f\xa7\xa8 \xf0\x9f\x9a\xa8ALERT\xf0\x9f\x9a\xa8\n@MoneyMakinMajix - MoneyCounter  \nVideo on @worldstar \n.\xe2\x80\xa6 https://t.co/iWKEdkDuI5',Golden xf0 x9f x8e x96 xef x8 x8f Money xf0 x9f x92 x5 Team xf0 x9f xa4 x9d Presents n xf0 x9f xa7 xa8THUMBIN MUSIC xf0 x9f xa7 xa8 xf0 x9f x9a xa8ALERT xf0 x9f x9a xa8 n MoneyCounter nVideo on n xe2 x80 xa6
2019-11-17T04:48:25.000Z,b'LAST TRADE: BUY 0.19798822BTC@7671.8EUR\nSELL WALL: 29.889BTC@7719.4EUR\nBUY WALL: 59.993BTC@7500.0EUR\nSUM SHORTS: 39\xe2\x80\xa6 https://t.co/xpI0HsUJ44',LAST TRADE BUY 0 19798822BTC 8EUR nSELL WALL 29 889BTC 4EUR nBUY WALL 59 993BTC 0EUR nSUM SHORTS 39 xe2 x80 xa6
2019-11-17T04:48:28.000Z,"b'@coindesk @extstock @ChairmanHeath @christine_dkim @ethereum Nice project,\\xf0\\x9f\\x98\\x8a thanks\\n#cryptocurrency\\n#bitcoin'",Nice project xf0 x9f x98 x8a thanks n cryptocurrency n itcoin
2019-11-17T04:48:33.000Z,b'GOLDEN\xf0\x9f\x8e\x96\xef\xb8\x8fMONEY \xf0\x9f\x92\xb5 TEAM \xf0\x9f\xa4\x9d PRESENTS\n\xf0\x9f\x94\xa5HOT MUSIC\xf0\x9f\x94\xa5 \xf0\x9f\x9a\xa8 ALERT\xf0\x9f\x9a\xa8\n@24Real1 (Right Now)\nNew single Available on all platforms\n.\n.\xe2\x80\xa6 https://t.co/pnXUAugpHZ',GOLDEN xf0 x9f x8e x96 xef x8 x8fMONEY xf0 x9f x92 x5 TEAM xf0 x9f xa4 x9d PRESENTS n xf0 x9f x94 xa5HOT MUSIC xf0 x9f x94 xa5 xf0 x9f x9a xa8 ALERT xf0 x9f x9a xa8 n Right Now nNew single Availale on all platforms n n xe2 x80 xa6
2019-11-17T04:48:51.000Z,b'https://t.co/IGE8t9AMFK I wasn\xe2\x80\x99t around for mt gox but a@friend sent me this and it\xe2\x80\x99s awesome.  #bitcoin #btc #crypto',I wasn xe2 x80 x99t around for mt gox ut a sent me this and it xe2 x80 x99s awesome itcoin tc crypto
2019-11-17T04:49:04.000Z,b'The Easiest Money Ever https://t.co/tiOEvybr9q #makemoneyonline #Bitcoin #EarnBitcoin',The Easiest Money Ever makemoneyonline Bitcoin EarnBitcoin
2019-11-17T04:49:26.000Z,b'@extstock @dcs_token #cryptocurrency #bitcoin awesome plateform with great future..I am really delighted to be part of it',cryptocurrency itcoin awesome plateform with great future I am really delighted to e part of it
2019-11-17T04:50:02.000Z,"b'Top 5 #cryptocurrencies \\n Alert Time: 2019-11-17 07:50:02\\n#Bitcoin: $8,545.305\\n#Ethereum: $182.641\\n#XRP: $0.264\\xe2\\x80\\xa6 https://t.co/yRn4uyc1R0'",Top 5 cryptocurrencies n Alert Time 2019 11 17 07 50 02 n Bitcoin 8 545 305 n Ethereum 182 641 n XRP 0 264 xe2 x80 xa6
2019-11-17T04:50:09.000Z,"b'@extstock @dcs_token Nice project,\\xf0\\x9f\\x98\\x8a thanks\\n#cryptocurrency\\n#bitcoin'",Nice project xf0 x9f x98 x8a thanks n cryptocurrency n itcoin
2019-11-17T04:50:23.000Z,b'Bought some $EIDOS for the first time at $0.008 (0.0024 $EOS).\n@enumivo \n\n$ddos $trx #tron #crypto $btc $eth $link\xe2\x80\xa6 https://t.co/xkkkmuE2Vb',Bought some EIDOS for the first time at 0 008 0 0024 EOS n n n ddos trx tron crypto tc eth link xe2 x80 xa6
2019-11-17T04:51:08.000Z,b'Serbest #Piyasa\n\nTarih: 16.11.2019 23:59:58\nDolar: \xe2\x82\xba5.7449\nEuro: \xe2\x82\xba6.3531\n24 Ayar Gram: \xe2\x82\xba270.97\n22 Ayar Gram: \xe2\x82\xba247.1\xe2\x80\xa6 https://t.co/IVOsjslxhJ',Serest Piyasa n nTarih 16 11 2019 23 59 58 nDolar xe2 x82 xa5 7449 nEuro xe2 x82 xa6 3531 n24 Ayar Gram xe2 x82 xa270 97 n22 Ayar Gram xe2 x82 xa247 1 xe2 x80 xa6
2019-11-17T04:51:16.000Z,b'@extstock @dcs_token #cryptocurrency #bitcoin',cryptocurrency itcoin
2019-11-17T04:51:52.000Z,b'The door is always open @joeldalais @MetanetIcu #Bitcoin',The door is always open Bitcoin
2019-11-17T04:52:34.000Z,"\"b\"\"@Lukewearechange Soon there will be civil war everywhere. Send all parasites home before it's too late. Use\\xe2\\x80\\xa6 https://t.co/UajoA6Xm0Z\"\"\"",Soon there will e civil war everywhere Send all parasites home efore it s too late Use xe2 x80 xa6
2019-11-17T04:53:06.000Z,"\"b\"\"#Bitcoin is either illegal or restricted in 16 countries!\\n\\nIn other words",Bitcoin is either illegal or restricted in 16 countries n nIn other words
2019-11-17T04:53:35.000Z,"b'Prior to 2014, Jeff Garzik was the third most prolific coder to Bitcoin Core. \\n\\nHe joins us to discuss the beginnin\\xe2\\x80\\xa6 https://t.co/FxztSxdhI3'",Prior to 2014 Jeff Garzik was the third most prolific coder to Bitcoin Core n nHe joins us to discuss the eginnin xe2 x80 xa6
2019-11-17T04:53:47.000Z,b'#trading #stockmarket #market #options #hedgefunds #cboe #money #investments #crypto #bitcoin https://t.co/C7rFuT7Gd1',trading stockmarket market options hedgefunds coe money investments crypto itcoin
2019-11-17T04:53:53.000Z,b'I like siriusx \n#ICO #Crowdsale #Bitcoin #Blockchain #Token #ETH #Ethereum https://t.co/n9vVYPEoUV',I like siriusx n ICO Crowdsale Bitcoin Blockchain Token ETH Ethereum
2019-11-17T04:54:00.000Z,b'\xe3\x81\x8a\xe3\x81\x84\xe3\x81\x8a\xe3\x81\x84\xe3\x83\x9e\xe3\x82\xb8\xe3\x81\x8b\xe3\x82\x88...Qtum\xe8\xb6\x8a\xe3\x81\x88\xe3\x81\xa1\xe3\x81\xbe\xe3\x81\xa3\xe3\x81\x9f\xe3\x82\x88\xef\xbc\x81#CENNZ #Centrality #\xe3\x82\xbb\xe3\x83\xb3\xe3\x83\x88\xe3\x83\xa9\xe3\x83\xaa\xe3\x83\x86\xe3\x82\xa3 #blockchain #cryptocurrency #\xe4\xbb\xae\xe6\x83\xb3\xe9\x80\x9a\xe8\xb2\xa8 #\xe3\x83\x93\xe3\x83\x83\xe3\x83\x88\xe3\x82\xb3\xe3\x82\xa4\xe3\x83\xb3 #Bitcoin #BTC https://t.co/6g4UV9PmIV',xe3 x81 x8a xe3 x81 x84 xe3 x81 x8a xe3 x81 x84 xe3 x83 x9e xe3 x82 x8 xe3 x81 x8 xe3 x82 x88 Qtum xe8 x6 x8a xe3 x81 x88 xe3 x81 xa1 xe3 x81 xe xe3 x81 xa3 xe3 x81 x9f xe3 x82 x88 xef xc x81 CENNZ Centrality xe3 x82 x xe3 x83 x3 xe3 x83 x88 xe3 x83 xa9 xe3 x83 xaa xe3 x83 x86 xe3 x82 xa3 lockchain cryptocurrency xe4 x xae xe6 x83 x3 xe9 x80 x9a xe8 x2 xa8 xe3 x83 x93 xe3 x83 x83 xe3 x83 x88 xe3 x82 x3 xe3 x82 xa4 xe3 x83 x3 Bitcoin BTC
2019-11-17T04:54:16.000Z,b'#Fortnite #Bitcoin https://t.co/9aCfvmd9C5',Fortnite Bitcoin
2019-11-17T04:54:16.000Z,b'#btc needs #etn to get mass adopted but #Electroneum does not need #bitcoin to get mass adopted.  Copy that.\xe2\x80\xa6 https://t.co/yugZOcPBW4',tc needs etn to get mass adopted ut Electroneum does not need itcoin to get mass adopted Copy that xe2 x80 xa6
2019-11-17T04:54:54.000Z,b'Danke. Bitte.\n32yyeXCAqrxbKMvSDP9ymib64wJfB8GUbe\n\n#Bitcoin\n#help',Danke Bitte n32yyeXCAqrxKMvSDP9ymi64wJfB8GUe n n Bitcoin n help
2019-11-17T04:55:00.000Z,b'Intertops Casino - 50 Free Spins Sign Up Bonus and New 100% November Coupon with 50 Spins Reward\xe2\x80\xa6 https://t.co/x60oJbnPPP',Intertops Casino 50 Free Spins Sign Up Bonus and New 100 Novemer Coupon with 50 Spins Reward xe2 x80 xa6
2019-11-17T04:55:12.000Z,b'@fundstrat #bitcoin is the apex predator of all monies.  This is all you need to know.',itcoin is the apex predator of all monies This is all you need to know
2019-11-17T04:55:32.000Z,b'https://t.co/3HSIMFIpRK: BREAKING NEWS: SKY SPORTS TO RAISE ANTHONY JOSHUA VS ANDY RUIZ (U.K.) PPV COST SUDDENLY !!\xe2\x80\xa6 https://t.co/K75hgVipz9',BREAKING NEWS SKY SPORTS TO RAISE ANTHONY JOSHUA VS ANDY RUIZ U K PPV COST SUDDENLY xe2 x80 xa6
2019-11-17T04:55:32.000Z,b'https://t.co/3HSIMFIpRK: ANTHONY JOSHUA WILL DEFEAT ANDY RUIZ IN REMATCH TO REGAIN TITLES &amp; STATUS HERE\xe2\x80\x99S WHY !!\xe2\x80\xa6 https://t.co/z5riX1EFv3',ANTHONY JOSHUA WILL DEFEAT ANDY RUIZ IN REMATCH TO REGAIN TITLES amp STATUS HERE xe2 x80 x99S WHY xe2 x80 xa6
2019-11-17T04:55:33.000Z,"b'https://t.co/3HSIMFIpRK: DEONTAY WILDER IS THE (BOB GIBBONS) OF BOXING ! WITH SO MUCH FORCE PUNCHING DOWN, SAY GEOR\\xe2\\x80\\xa6 https://t.co/u6zveVOsn7'",DEONTAY WILDER IS THE BOB GIBBONS OF BOXING WITH SO MUCH FORCE PUNCHING DOWN SAY GEOR xe2 x80 xa6
