2019-11-17T18:11:27.000Z,b'#DOLAR #TL 18-22 Kas\xc4\xb1m Haftas\xc4\xb1 Ne Yapacak?\nhttps://t.co/RcdmucvqXh\n\n#mesut_al #thyao #halkb #asels #garan #klgyo\xe2\x80\xa6 https://t.co/HihzvnJrZc',DOLAR TL 18 22 Kas xc4 x1m Haftas xc4 x1 Ne Yapacak nhttps thyao halk asels garan klgyo xe2 x80 xa6
2019-11-17T18:11:35.000Z,b'Market Update: Crypto Prices Improve After 3-Week Downtrend\n#Bitcoin #Crypto #Cryptocurrency #October1st #HereWeGo\nhttps://t.co/3Szm7WfLZn',Market Update Crypto Prices Improve After 3 Week Downtrend n Bitcoin Crypto Cryptocurrency Octoer1st HereWeGo
2019-11-17T18:11:53.000Z,"\"b\"\"Art Piece: '\\xe5\\x8d\\x84\\xe3\\x84\\x96\\xe5\\xb1\\xb1\\xe3\\x80\\x80\\xe3\\x84\\x92\\xe3\\x84\\x96\\xe3\\x80\\x80\\xe4\\xb8\\x82\\xe5\\xb1\\xb1\\xe5\\x8d\\x82\\xe3\\x84\\xa5\\xe3\\x84\\xa5\\xe3\\x84\\x96\\xe5\\xb1\\xb1\\xe3\\x80\\x80\\xe5\\x8d\\x82\\xe3\\x80\\x80\\xe5\\x87\\xa0\\xe5\\x8d\\x82\\xe3\\x84\\x92\\xe4\\xb8\\xa8\\xe3\\x84\\x96\\xe5\\x87\\xa0'\\nAvailable to bid with #ethereum here---&gt;https://t.co/paaD5BEcMA\\n\\nA human guide\\xe2\\x80\\xa6 https://t.co/lCKCtJTl9Z\"\"\"",Art Piece xe5 x8d x84 xe3 x84 x96 xe5 x1 x1 xe3 x80 x80 xe3 x84 x92 xe3 x84 x96 xe3 x80 x80 xe4 x8 x82 xe5 x1 x1 xe5 x8d x82 xe3 x84 xa5 xe3 x84 xa5 xe3 x84 x96 xe5 x1 x1 xe3 x80 x80 xe5 x8d x82 xe3 x80 x80 xe5 x87 xa0 xe5 x8d x82 xe3 x84 x92 xe4 x8 xa8 xe3 x84 x96 xe5 x87 xa0 nAvailale to id with ethereum here gt human guide xe2 x80 xa6
2019-11-17T18:11:54.000Z,"b'@swapzillaco Excellent tools and features, as well as low fees in comparison with other sites. Good counteraction t\\xe2\\x80\\xa6 https://t.co/1hPGeVTE6l'",Excellent tools and features as well as low fees in comparison with other sites Good counteraction t xe2 x80 xa6
2019-11-17T18:12:04.000Z,b'#GRAM #ALTIN 18-22 Kas\xc4\xb1m Haftas\xc4\xb1 Ne Yapacak?\nhttps://t.co/FFWy44vlQT\n\n#mesut_al #thyao #halkb #asels #garan #klgyo\xe2\x80\xa6 https://t.co/hvqiW7cI6g',GRAM ALTIN 18 22 Kas xc4 x1m Haftas xc4 x1 Ne Yapacak nhttps thyao halk asels garan klgyo xe2 x80 xa6
2019-11-17T18:12:11.000Z,b'Earn bitcoins for clicking ads https://t.co/5x5xZL2o86 #bitcoin v\xc3\xada @BTCClicks',Earn itcoins for clicking ads itcoin v xc3 xada
2019-11-17T18:12:20.000Z,"b'Work continues today on getting our recent order of Bitmain S17 Pro Bitcoin Miners up and running at our LaFayette,\\xe2\\x80\\xa6 https://t.co/Zg5f1dbWkg'",Work continues today on getting our recent order of Bitmain S17 Pro Bitcoin Miners up and running at our LaFayette xe2 x80 xa6
2019-11-17T18:12:23.000Z,b'@extstock @dcs_token Good project\n#cryptocurrency #bitcoin',Good project n cryptocurrency itcoin
2019-11-17T18:12:28.000Z,b'@lopp C. Bad day for miners who\xe2\x80\x99s majority hardware investment just got obsolete :(\n\nProbably going to hurt things\xe2\x80\xa6 https://t.co/aI2GpPCbiw',C Bad day for miners who xe2 x80 x99s majority hardware investment just got osolete n nProaly going to hurt things xe2 x80 xa6
2019-11-17T18:12:32.000Z,b'Presidential candidate Andrew Yang vows to promote crypto legislation #Bitcoin #Btc #Cryptocurrency #finance #forex\xe2\x80\xa6 https://t.co/zlPqyTNDUt',Presidential candidate Andrew Yang vows to promote crypto legislation Bitcoin Btc Cryptocurrency finance forex xe2 x80 xa6
2019-11-17T18:12:33.000Z,b'#BORSA #\xc4\xb0STANBUL 18-22 Kas\xc4\xb1m Haftas\xc4\xb1 Ne Yapacak?\nhttps://t.co/s22GepoiLZ\n\n#mesut_al #thyao #halkb #asels #garan\xe2\x80\xa6 https://t.co/O8HoyIPgL2',BORSA xc4 x0STANBUL 18 22 Kas xc4 x1m Haftas xc4 x1 Ne Yapacak nhttps thyao halk asels garan xe2 x80 xa6
2019-11-17T18:12:54.000Z,b'$RLC / $BTC\n\xe2\xad\x90\xef\xb8\x8f\xe2\xad\x90\xef\xb8\x8f\n\nSinyalin Saati: 17.11.2019 - 06:15\n\n\xf0\x9f\x9a\x80 Sinyal Geldi\xc4\x9findeki Fiyat: 8902\n\xf0\x9f\x9a\x80 Y\xc3\xbckseldi\xc4\x9fi Fiyat: 10054\n\xf0\x9f\x9a\x80\xe2\x80\xa6 https://t.co/jtGyh2h01h',RLC BTC n xe2 xad x90 xef x8 x8f xe2 xad x90 xef x8 x8f n nSinyalin Saati 17 11 2019 06 15 n n xf0 x9f x9a x80 Sinyal Geldi xc4 x9findeki Fiyat 8902 n xf0 x9f x9a x80 Y xc3 xckseldi xc4 x9fi Fiyat 10054 n xf0 x9f x9a x80 xe2 x80 xa6
2019-11-17T18:13:03.000Z,b'Iran Violent Turmoil Could Be Catalyst for Next Bitcoin Surge https://t.co/ktoK0O5hHv #Bitcoin #Iran https://t.co/sRua5sJjvE',Iran Violent Turmoil Could Be Catalyst for Next Bitcoin Surge Bitcoin Iran
2019-11-17T18:13:04.000Z,b'@JohnOnChain @Franck_Rbn @PowerHasheur @SatoshiLite Qui de mieux que soi-m\xc3\xaame pour tester la premi\xc3\xa8re tx du r\xc3\xa9seau\xe2\x80\xa6 https://t.co/3od5H9D9z0',Qui de mieux que soi m xc3 xaame pour tester la premi xc3 xa8re tx du r xc3 xa9seau xe2 x80 xa6
2019-11-17T18:13:07.000Z,"b'The Pot Stock Crash Will Dent Bitcoin Price, Claims Peter Schiff https://t.co/UcFkOgR5yE #Bitcoin #PeterSchiff https://t.co/5JHlZaof0Q'",The Pot Stock Crash Will Dent Bitcoin Price Claims Peter Schiff Bitcoin PeterSchiff
2019-11-17T18:13:15.000Z,"\"b'Report: What the Ethereum \"\"transaction flippening\"\" means\\n#Bitcoin #Crypto #Cryptocurrency #October1st #HereWeGo\\nhttps://t.co/lxtTo4Q4gZ'\"",Report What the Ethereum transaction flippening means n Bitcoin Crypto Cryptocurrency Octoer1st HereWeGo
2019-11-17T18:13:17.000Z,"b'Excellent tools and features, as well as low fees in comparison with other sites. Good counteraction to scammers. I\\xe2\\x80\\xa6 https://t.co/QEz5PIOigA'",Excellent tools and features as well as low fees in comparison with other sites Good counteraction to scammers I xe2 x80 xa6
2019-11-17T18:13:24.000Z,b'ProtonMail has no Intention of Converting Bitcoin Payments to Fiat https://t.co/IKj9BA4OFq | #Bitcoin #BTC\xe2\x80\xa6 https://t.co/NBLSRQdEY6',ProtonMail has no Intention of Converting Bitcoin Payments to Fiat Bitcoin BTC xe2 x80 xa6
2019-11-17T18:13:32.000Z,b'The very latest #bitcoin news analysis from over 150 global news sources in real time every hour 24*7*365 \n\n#BTCUSD\xe2\x80\xa6 https://t.co/uBBmJaDTMS',The very latest itcoin news analysis from over 150 gloal news sources in real time every hour 24 7 365 n n BTCUSD xe2 x80 xa6
2019-11-17T18:13:32.000Z,"\"b\"\"#Bitcoin's 100-day MA crossover may be inviting for buyers\\n\\nhttps://t.co/yPMPAmqkkp\"\"\"",Bitcoin s 100 day MA crossover may e inviting for uyers n
2019-11-17T18:13:47.000Z,"\"b'Why Blockchain will change our Life, Economy and the World - IS #BLOCKCHAIN REVOLUTION \"\"THE KILLER OF #DEMOCRACY\"\" ?\\xe2\\x80\\xa6 https://t.co/Ufq4ZTcKql'\"",Why Blockchain will change our Life Economy and the World IS BLOCKCHAIN REVOLUTION THE KILLER OF DEMOCRACY xe2 x80 xa6
2019-11-17T18:13:58.000Z,"\"b'#Ukraine Railway Staff Caught with Illegal #Bitcoin #Mining Operation. \\n\\n\"\"He explained that over 200 pieces of\\xe2\\x80\\xa6 https://t.co/AQEo8fMjhA'\"",Ukraine Railway Staff Caught with Illegal Bitcoin Mining Operation n n He explained that over 200 pieces of xe2 x80 xa6
2019-11-17T18:13:58.000Z,"b'\\xe2\\x8f\\xb0 21:13:57 #Piyasa #D\\xc3\\xb6viz\\n\\xe2\\x96\\xac USD: 5,7453 \\xe2\\x82\\xba\\n\\xe2\\x96\\xac EUR: 6,3498 \\xe2\\x82\\xba\\n\\xe2\\x96\\xac GBP: 7,4139 \\xe2\\x82\\xba\\n\\xe2\\x96\\xac EUR/USD: 1,1052 $\\n\\xe2\\x96\\xb2 Bitcoin: 8.575,8 $\\xe2\\x80\\xa6 https://t.co/XDWfrwfMrZ'",xe2 x8f x0 21 13 57 Piyasa D xc3 x6viz n xe2 x96 xac USD 5 7453 xe2 x82 xa n xe2 x96 xac EUR 6 3498 xe2 x82 xa n xe2 x96 xac GBP 7 4139 xe2 x82 xa n xe2 x96 xac EUR USD 1 1052 n xe2 x96 x2 Bitcoin 8 575 8 xe2 x80 xa6
2019-11-17T18:14:04.000Z,b'\xc2\xa1Esto es #Bitcoin simplificado! https://t.co/MnBHoer0BO',xc2 xa1Esto es Bitcoin simplificado
2019-11-17T18:14:07.000Z,"\"b'\"\"FREE 7 Day Forex Trading Course\\xc2\\xa0Gives You The\\xc2\\xa0Exact Tools &amp; Resources\\nTo Easily Find\\xc2\\xa0Highly Accurate\\xc2\\xa0Trades\\xc2\\xa0On Dem\\xe2\\x80\\xa6 https://t.co/NjWhlE5Jsi'\"",FREE 7 Day Forex Trading Course xc2 xa0Gives You The xc2 xa0Exact Tools amp Resources nTo Easily Find xc2 xa0Highly Accurate xc2 xa0Trades xc2 xa0On Dem xe2 x80 xa6
2019-11-17T18:14:13.000Z,b'$RLC / $BTC\n\xe2\xad\x90\xef\xb8\x8f\xe2\xad\x90\xef\xb8\x8f\n\nSignal Time: 11.17.2019 - 06:15 GMT+3\n\n\xf0\x9f\x9a\x80 Signal Price: 8902\n\xf0\x9f\x9a\x80 Top Price: 10054\n\xf0\x9f\x9a\x80 Profit: %12.9\n\nR\xe2\x80\xa6 https://t.co/RlLy678Ih6',RLC BTC n xe2 xad x90 xef x8 x8f xe2 xad x90 xef x8 x8f n nSignal Time 11 17 2019 06 15 GMT 3 n n xf0 x9f x9a x80 Signal Price 8902 n xf0 x9f x9a x80 Top Price 10054 n xf0 x9f x9a x80 Profit 12 9 n nR xe2 x80 xa6
2019-11-17T18:14:20.000Z,b'Antminer T15 https://t.co/yAwbct27jY #bitcoin #crypto #antminer #bitmain',Antminer T15 itcoin crypto antminer itmain
2019-11-17T18:14:20.000Z,b'Bitmain Antminer L3+ 504 MH/s Scrypt Miner UNTESTED (670) https://t.co/Ou7kDvPDz0 #bitcoin #crypto #antminer #bitmain',Bitmain Antminer L3 504 MH s Scrypt Miner UNTESTED 670 itcoin crypto antminer itmain
2019-11-17T18:14:20.000Z,b'Bitmain Antminer APW3++ Power Supply 1600W / 1200W Used Excellent Condition https://t.co/lX7Vlpwhx0 #bitcoin #crypto #antminer #bitmain',Bitmain Antminer APW3 Power Supply 1600W 1200W Used Excellent Condition itcoin crypto antminer itmain
2019-11-17T18:14:20.000Z,b'Bitmain Antminer S9 13.5TH With APW3++ Power Supply \xe2\x80\x93 Ready To Ship https://t.co/9FHCqMYic0 #bitcoin #crypto #antminer #bitmain',Bitmain Antminer S9 13 5TH With APW3 Power Supply xe2 x80 x93 Ready To Ship itcoin crypto antminer itmain
2019-11-17T18:14:21.000Z,b'Bitmain Antminer APW3++ Power Supply 1600W / 1200W Used Excellent Condition https://t.co/iqIsAXX8GH #bitcoin #crypto #antminer #bitmain',Bitmain Antminer APW3 Power Supply 1600W 1200W Used Excellent Condition itcoin crypto antminer itmain
2019-11-17T18:14:32.000Z,"b'O valor m\\xc3\\xa9dio das criptomoedas \\xc3\\xa9:\\n Bitcoin(BTC) R$ 35751,70 \\n Litecoin(LTC) R$ 246,34 \\n Bitcoin Cash(BCH) R$ 1115,1\\xe2\\x80\\xa6 https://t.co/qT4Ua9XN50'",O valor m xc3 xa9dio das criptomoedas xc3 xa9 n Bitcoin BTC R 35751 70 n Litecoin LTC R 246 34 n Bitcoin Cash BCH R 1115 1 xe2 x80 xa6
2019-11-17T18:14:41.000Z,b'I need testnet coin! (Reddit #Bitcoin) \n\nMy 8 year old son wants to talk about #Bitcoin to his classmates and I thi\xe2\x80\xa6 https://t.co/L9iJfOdEoQ',I need testnet coin Reddit Bitcoin n nMy 8 year old son wants to talk aout Bitcoin to his classmates and I thi xe2 x80 xa6
2019-11-17T18:15:00.000Z,"b'Try out Fairlay, a crypto betting exchange that accepts deposits in #Bitcoin, #Ethereum, #Litecoin, #DASH and\\xe2\\x80\\xa6 https://t.co/eE65BxHi3F'",Try out Fairlay a crypto etting exchange that accepts deposits in Bitcoin Ethereum Litecoin DASH and xe2 x80 xa6
2019-11-17T18:15:01.000Z,b'LocalBitcoins Receives Finnish FSA Virtual Currency Provider License https://t.co/OAdBRp8Zzc  #XBT #BTC #Bitcoin',LocalBitcoins Receives Finnish FSA Virtual Currency Provider License XBT BTC Bitcoin
2019-11-17T18:15:08.000Z,b'Notice how we called the low(10/02) and high(11/20) - Watching 11/20 closely :)\n-\n#GBPUSD $GBPUSD\n-\n#Forex #BitCoin\xe2\x80\xa6 https://t.co/k0iCBiOCFF',Notice how we called the low 10 02 and high 11 20 Watching 11 20 closely n n GBPUSD GBPUSD n n Forex BitCoin xe2 x80 xa6
2019-11-17T18:15:16.000Z,"\"b\"\"While bears &amp; bulls got screwed every which way on the grind down",While ears amp ulls got screwed every which way on the grind down
2019-11-17T18:15:22.000Z,"b'When you survive your third #Bitcoin bubble, reach OG status and learn \\xe2\\x80\\x9cFiat\\xe2\\x80\\x9d means \\xe2\\x80\\x9carbitrary order\\xe2\\x80\\x9d\\xe2\\x80\\xa6 https://t.co/kFybD3bGT1'",When you survive your third Bitcoin ule reach OG status and learn xe2 x80 x9cFiat xe2 x80 x9d means xe2 x80 x9caritrary order xe2 x80 x9d xe2 x80 xa6
2019-11-17T18:15:23.000Z,b'Who would win? - Crypto Millionaire App: https://t.co/gykVY7q789 #Bitcoin #Crypto #Ethereum #Litecoin #Ripple #EOS https://t.co/aiDk9ju4qT',Who would win Crypto Millionaire App Bitcoin Crypto Ethereum Litecoin Ripple EOS
2019-11-17T18:15:27.000Z,b'Market Update: Crypto Prices Improve After 3-Week Downtrend https://t.co/pVhmXFrwcc via @BTCTN #cryptocurrency\xe2\x80\xa6 https://t.co/AVLNMQ2gJG',Market Update Crypto Prices Improve After 3 Week Downtrend via cryptocurrency xe2 x80 xa6
