2019-11-17T13:30:54.000Z,"b'Was expecting pump and dump, but sequence was the opposite, so it gives me bullish hopes for $BTC now. Will accumul\\xe2\\x80\\xa6 https://t.co/GF7jTlEXgi'",Was expecting pump and dump ut sequence was the opposite so it gives me ullish hopes for BTC now Will accumul xe2 x80 xa6
2019-11-17T13:31:07.000Z,b'#Liquid3_6 #LiquidMarketing #riseandgrind #pennystocks #style #fashion #shop #sale #purses #shoes #dresses\xe2\x80\xa6 https://t.co/WAXE16woVE',Liquid3 6 LiquidMarketing riseandgrind pennystocks style fashion shop sale purses shoes dresses xe2 x80 xa6
2019-11-17T13:31:15.000Z,"b'El precio del Bitcoin: 7,750.13\\xe2\\x82\\xac #bitcoin #elpreciodelbtc #criptomonedas'",El precio del Bitcoin 7 750 13 xe2 x82 xac itcoin elpreciodeltc criptomonedas
2019-11-17T13:31:22.000Z,b'P/\xc3\xa5{\xc3\x9cYn\xc2\xb3 #crypto #bitcoin #java #competition #influencer #datascience #fintech #science #EU https://t.co/VYM2YAppqS https://t.co/x9HtSr4kNv',P xc3 xa5 xc3 x9cYn xc2 x3 crypto itcoin java competition influencer datascience fintech science EU
2019-11-17T13:31:57.000Z,"\"b'El jefe de Xbox Game Studios dice que no hay necesidad de \"\"guardar\"\" juegos para Scarlett - https://t.co/2XHXY3KYuu\\xe2\\x80\\xa6 https://t.co/ZkgOZyxxx4'\"",El jefe de Xox Game Studios dice que no hay necesidad de guardar juegos para Scarlett
2019-11-17T13:32:05.000Z,"b'Los intercambios de criptomonedas han recorrido un largo camino, y eso es bueno para los usuarios -\\xe2\\x80\\xa6 https://t.co/YHoOv9Jkpb'",Los intercamios de criptomonedas han recorrido un largo camino y eso es ueno para los usuarios xe2 x80 xa6
2019-11-17T13:33:17.000Z,"\"b\"\"L'ascension inattendue de la Turquie au sommet des adoptants mondiaux de la cryptographie #bitcoin #ethereum\\xe2\\x80\\xa6 https://t.co/cOgKCoMbXC\"\"\"",L ascension inattendue de la Turquie au sommet des adoptants mondiaux de la cryptographie itcoin ethereum xe2 x80 xa6
2019-11-17T13:33:31.000Z,b'@CincinnatusBTC @Eljaboom @Cryptocashu yes we are early in #blockchaintechnology  not in #bitcoin',yes we are early in lockchaintechnology not in itcoin
2019-11-17T13:33:59.000Z,b'\xe2\x94\x94aGe\xc2\xb7\xc2\xa4A\xc2\xad #crypto #bitcoin #java #competition #influencer #datascience #fintech #science #EU https://t.co/SHZjIk4cq2 https://t.co/DTFVl1vgLE',xe2 x94 x94aGe xc2 x7 xc2 xa4A xc2 xad crypto itcoin java competition influencer datascience fintech science EU
2019-11-17T13:34:04.000Z,"b'Bitcoiners to Yang: It\\xe2\\x80\\x99s fiat, not money\\n\\n#AndrewYang #Bitcoin #cryptocurrency \\n https://t.co/sALk6RIKrA'",Bitcoiners to Yang It xe2 x80 x99s fiat not money n n AndrewYang Bitcoin cryptocurrency n
2019-11-17T13:34:10.000Z,"b'BitMEX Daily Volume Hits 2019 Low, \\xe2\\x80\\x98Market Officially Lifeless\\xe2\\x80\\x99 - https://t.co/UnGFVzMEMZ\\n #bitcoin #btc\\xe2\\x80\\xa6 https://t.co/jP0WpLiyHq'",BitMEX Daily Volume Hits 2019 Low xe2 x80 x98Market Officially Lifeless xe2 x80 x99 itcoin tc xe2 x80 xa6
2019-11-17T13:34:11.000Z,b'Guess what #bitcoin Africa followed me....am so excited...more than enough for a 2 weeks old account',Guess what itcoin Africa followed me am so excited more than enough for a 2 weeks old account
2019-11-17T13:34:27.000Z,b'1 #satoshi =        0.01326 $PKR \xf0\x9f\x87\xb5\xf0\x9f\x87\xb0\n0.00613 $BTN \xf0\x9f\x87\xa7\xf0\x9f\x87\xb9   0.03313 $KZT \xf0\x9f\x87\xb0\xf0\x9f\x87\xbf\n0.00724 $BDT \xf0\x9f\x87\xa7\xf0\x9f\x87\xa9   0.00981 $NPR \xf0\x9f\x87\xb3\xf0\x9f\x87\xb5\n0.00596\xe2\x80\xa6 https://t.co/0Bx8IMI8ra',1 satoshi 0 01326 PKR xf0 x9f x87 x5 xf0 x9f x87 x0 n0 00613 BTN xf0 x9f x87 xa7 xf0 x9f x87 x9 0 03313 KZT xf0 x9f x87 x0 xf0 x9f x87 xf n0 00724 BDT xf0 x9f x87 xa7 xf0 x9f x87 xa9 0 00981 NPR xf0 x9f x87 x3 xf0 x9f x87 x5 n0 00596 xe2 x80 xa6
2019-11-17T13:34:27.000Z,"b'@garcosc Algo suspicaz que el  @BancoRepublica no diferencie el buen dinero: Bitcoin, de otros criptoactivos que ti\\xe2\\x80\\xa6 https://t.co/9g4lfO4qha'",Algo suspicaz que el no diferencie el uen dinero Bitcoin de otros criptoactivos que ti xe2 x80 xa6
2019-11-17T13:34:59.000Z,b'#batbtc\n\n\xe2\x8c\x9b\xef\xb8\x8fMy road map prediction for next 2 months.\n\nParitede \xc3\xb6n\xc3\xbcm\xc3\xbczdeki 2 ay a\xc5\x9fa\xc4\x9f\xc4\xb1daki \xc5\x9fekilde ilerler umar\xc4\xb1m. Sa\xe2\x80\xa6 https://t.co/J9lzbKsWEx',attc n n xe2 x8c x9 xef x8 x8fMy road map prediction for next 2 months n nParitede xc3 x6n xc3 xcm xc3 xczdeki 2 ay a xc5 x9fa xc4 x9f xc4 x1daki xc5 x9fekilde ilerler umar xc4 x1m Sa xe2 x80 xa6
2019-11-17T13:35:09.000Z,"b'$DASH Adjusting the take profit a bit, just in case...1h chart\\n\\n#crypto #cryptocurrency #cryptocurrencies\\xe2\\x80\\xa6 https://t.co/XhIQmXOYLY'",DASH Adjusting the take profit a it just in case 1h chart n n crypto cryptocurrency cryptocurrencies xe2 x80 xa6
2019-11-17T13:35:15.000Z,"b'@APompliano @polina_marinova Congrats, Pomp.\\n\\nDoes she know you love #bitcoin, more than her?'",Congrats Pomp n nDoes she know you love itcoin more than her
2019-11-17T13:35:16.000Z,"\"b\"\"Steve Jobs - is Real Satoshi Nakamoto! That's why: Look at the date of Satoshi's last message and the date of Steve\\xe2\\x80\\xa6 https://t.co/UWvF65uN6C\"\"\"",Steve Jos is Real Satoshi Nakamoto That s why Look at the date of Satoshi s last message and the date of Steve xe2 x80 xa6
2019-11-17T13:35:19.000Z,b'The Hardware Bitcoin Wallet. Get Trezor now for only 89 EUR https://t.co/RyPUbEzrNS #btc #bitcoin 08 https://t.co/UP14IsIZ9j',The Hardware Bitcoin Wallet Get Trezor now for only 89 EUR tc itcoin 08
2019-11-17T13:35:22.000Z,b'Crypto Platform Celsius Network Reaches $4.25 Billion in Total Loans https://t.co/SqX5N8aixE via @CoinTelegraph\xe2\x80\xa6 https://t.co/RbEq55ee7c',Crypto Platform Celsius Network Reaches 4 25 Billion in Total Loans via xe2 x80 xa6
2019-11-17T13:35:42.000Z,b'\xf0\x9f\x91\x87\n\nTechnical Analysis Details for $SNGLS\n\n\xf0\x9f\xa7\x90\n\n#binance #cryptotrading #Crypto #bitcoin $BTC $ETH $XRP $TRX $ADA $BNB\xe2\x80\xa6 https://t.co/Wz2YsCYWbj',xf0 x9f x91 x87 n nTechnical Analysis Details for SNGLS n n xf0 x9f xa7 x90 n n inance cryptotrading Crypto itcoin BTC ETH XRP TRX ADA BNB xe2 x80 xa6
2019-11-17T13:35:48.000Z,b'Jan 2019-Nov 17 2019\n\n#Bitcoin $3843- $8612 +124%\n#Litecoin $31.98- $60 +88%\n#XRP $0.356- $0.266 -25%',Jan 2019 Nov 17 2019 n n Bitcoin 3843 8612 124 n Litecoin 31 98 60 88 n XRP 0 356 0 266 25
2019-11-17T13:35:58.000Z,b'There will only be about .002625 #bitcoin for each person on Earth. Get your share for about $23 right now. @CashApp https://t.co/OM08ohjwSD',There will only e aout 002625 itcoin for each person on Earth Get your share for aout 23 right now
2019-11-17T13:36:06.000Z,b'@BillyBambrough when @Google said that it will kill Bitcoin?! #btc #bitcoin @btc',when said that it will kill Bitcoin tc itcoin
2019-11-17T13:36:13.000Z,b'@APompliano @polina_marinova Congrats \xf0\x9f\x91\x8f #Bitcoin \xf0\x9f\x9a\x80',Congrats xf0 x9f x91 x8f Bitcoin xf0 x9f x9a x80
2019-11-17T13:36:53.000Z,b'#Crypto Platform #Celsius Network Reaches $4.25 Billion in Total Loans\n\n#defi #cryptocurrency #Bitcoin #Ethereum \n\nhttps://t.co/DrAT5jKNcn',Crypto Platform Celsius Network Reaches 4 25 Billion in Total Loans n n defi cryptocurrency Bitcoin Ethereum n
2019-11-17T13:37:11.000Z,b'Think about this:\nFiat does not offer a wide array of uses.\nCrypto currencies are like giving your fiat the diversi\xe2\x80\xa6 https://t.co/2kpVF3H0Me',Think aout this nFiat does not offer a wide array of uses nCrypto currencies are like giving your fiat the diversi xe2 x80 xa6
2019-11-17T13:37:40.000Z,b'POL LockDrop | Lock Up Your TRC20-USDT Now to Get POL https://t.co/Ycm6D2gwcx https://t.co/fHcVAMtpo5 $btc #bitcoin\xe2\x80\xa6 https://t.co/lW9Izd4aq1',POL LockDrop Lock Up Your TRC20 USDT Now to Get POL tc itcoin xe2 x80 xa6
2019-11-17T13:37:45.000Z,b'What the CFTC Chairman Actually Said About Ether Futures and Ethereum 2.0 https://t.co/0v2Ba08LUG #BTC #ICO #bitcoin https://t.co/5x5IB66viz',What the CFTC Chairman Actually Said Aout Ether Futures and Ethereum 2 0 BTC ICO itcoin
2019-11-17T13:37:48.000Z,b'Jed McCaleb has sold half XRP he received; left with ~4.5 billion #Bitcoin #Btc #Cryptocurrency #finance #forex\xe2\x80\xa6 https://t.co/MuCwhlOZSt',Jed McCale has sold half XRP he received left with 4 5 illion Bitcoin Btc Cryptocurrency finance forex xe2 x80 xa6
2019-11-17T13:37:57.000Z,"b'#Bitmex Daily Volume Hits 2019 Low, \\xe2\\x80\\x98Market Officially Lifeless\\xe2\\x80\\x99 reported by https://t.co/mXECCrOVg3 ---- #Bitcoin\\xe2\\x80\\xa6 https://t.co/itHBfgUUhR'",Bitmex Daily Volume Hits 2019 Low xe2 x80 x98Market Officially Lifeless xe2 x80 x99 reported y Bitcoin xe2 x80 xa6
2019-11-17T13:38:04.000Z,"b'Craig Wright Could Be Real Satoshi, According to Founder of First Chinese #Crypto Exchange\\xc2\\xa0\\xc2\\xa0https://t.co/bdLkTs5nCq\\xe2\\x80\\xa6 https://t.co/NEO5RT6nSE'",Craig Wright Could Be Real Satoshi According to Founder of First Chinese Crypto Exchange xc2 xa0 xc2 xa0https
2019-11-17T13:38:15.000Z,"b'BitMEX Daily Volume Hits 2019 Low, \\xe2\\x80\\x98Market Officially Lifeless\\xe2\\x80\\x99 https://t.co/pKWCnwEIlU  #XBT #BTC #Bitcoin'",BitMEX Daily Volume Hits 2019 Low xe2 x80 x98Market Officially Lifeless xe2 x80 x99 XBT BTC Bitcoin
2019-11-17T13:39:13.000Z,b'#bitcoin #Trader #trade https://t.co/6WkB1l3QhU',itcoin Trader trade
2019-11-17T13:39:15.000Z,b'Market Dashboard for the week\n\n#markets #marketupdate #snapshot #investing #equity #WealthManagement #debt #forex\xe2\x80\xa6 https://t.co/UVV0ow1dEb',Market Dashoard for the week n n markets marketupdate snapshot investing equity WealthManagement det forex xe2 x80 xa6
2019-11-17T13:39:19.000Z,b'Crypto Platform Celsius Network Reaches $4.25 Billion in Total Loans\n#Bitcoin #Crypto #Cryptocurrency #October1st\xe2\x80\xa6 https://t.co/VbEUyDC6zj',Crypto Platform Celsius Network Reaches 4 25 Billion in Total Loans n Bitcoin Crypto Cryptocurrency Octoer1st xe2 x80 xa6
2019-11-17T13:39:22.000Z,b'Thats the crux of #bitcoin... for BITMEX:XBTUSD by BitFink #XBTUSD https://t.co/QFc4fmGls3 https://t.co/26zcTTZMLk',Thats the crux of itcoin for BITMEX XBTUSD y BitFink XBTUSD
2019-11-17T13:39:27.000Z,b'Voici le crypto-humour du week-end\xf0\x9f\x91\x89https://t.co/Q4UIbIw7VV \n\n#Humour #Cryptomonnaie #Bitcoin',Voici le crypto humour du week end xf0 x9f x91 x89https n n Humour Cryptomonnaie Bitcoin
2019-11-17T13:39:30.000Z,b'#Bitcoin Price Analysis  Struggling to Stay Above the 200\n\nhttps://t.co/Zl6UsWtRY8',Bitcoin Price Analysis Struggling to Stay Aove the 200 n
2019-11-17T13:40:00.000Z,b'Que penser de MakerDAO ? https://t.co/I5kH1Aa6bi #bitcoin #altcoin #Cryptocurrency #cryptomonnaie #cryptonews #blockchain',Que penser de MakerDAO itcoin altcoin Cryptocurrency cryptomonnaie cryptonews lockchain
2019-11-17T13:40:00.000Z,"b'Crypto Tidbits: RBC May Embrace Bitcoin, China Bashes Cryptocurrency, Ethereum DeFi Booming \\xf0\\x9f\\x91\\x89 #NewsBTC\\xe2\\x80\\xa6 https://t.co/B2PZZOFouv'",Crypto Tidits RBC May Emrace Bitcoin China Bashes Cryptocurrency Ethereum DeFi Booming xf0 x9f x91 x89 NewsBTC xe2 x80 xa6
2019-11-17T13:40:00.000Z,b'@AllNutsPrograms @ConstZerger NOoiinN! \nIch will ja nicht die DIY #Wasserstoff Gewinnungsanlage im Garten abfackeln\xe2\x80\xa6 https://t.co/rAIH2KnGjM',NOoiinN nIch will ja nicht die DIY Wasserstoff Gewinnungsanlage im Garten afackeln xe2 x80 xa6
