2019-11-17T21:24:46.000Z,b'Posted withrepost \xe2\x80\xa2 btcpremium_crypto_exchange Is Bitcoin trading complicated on BtcPremium? #crypto #bitcoin\xe2\x80\xa6 https://t.co/QiYwV7RR8v',Posted withrepost xe2 x80 xa2 tcpremium crypto exchange Is Bitcoin trading complicated on BtcPremium crypto itcoin xe2 x80 xa6
2019-11-17T21:24:54.000Z,b'#acsel #bmkototrend  G #BMK #usdtry #eurtry #XU100 #btc #btcusd #bitcoin #crypto #bist30 #bist100 #viop30 #varant\xe2\x80\xa6 https://t.co/BsR5jYe5ed',acsel mkototrend G BMK usdtry eurtry XU100 tc tcusd itcoin crypto ist30 ist100 viop30 varant xe2 x80 xa6
2019-11-17T21:25:18.000Z,b'#adana #bmkototrend  G #BMK #usdtry #eurtry #XU100 #btc #btcusd #bitcoin #crypto #bist30 #bist100 #viop30 #varant\xe2\x80\xa6 https://t.co/oZFjganMVr',adana mkototrend G BMK usdtry eurtry XU100 tc tcusd itcoin crypto ist30 ist100 viop30 varant xe2 x80 xa6
2019-11-17T21:25:28.000Z,b'Bored of the coins. #bitcoin #crypto #cryptocurrencies #cryptocurrency https://t.co/tDsqi02yWN',Bored of the coins itcoin crypto cryptocurrencies cryptocurrency
2019-11-17T21:26:33.000Z,b'Mornings of #Bitcoin Millionaires ##Bitcoin (Reddit #Bitcoin) \n\n   submitted by    /u/Johnfxtrader  [link]   [comme\xe2\x80\xa6 https://t.co/SPOFgPuZyv',Mornings of Bitcoin Millionaires Bitcoin Reddit Bitcoin n n sumitted y u Johnfxtrader link comme xe2 x80 xa6
2019-11-17T21:26:42.000Z,b'@lopp What a waste of Energy . The #Bitcoin Deception - other #Crypto function better in the Real World\n\nHopefully\xe2\x80\xa6 https://t.co/NZwzrfQdoW',What a waste of Energy The Bitcoin Deception other Crypto function etter in the Real World n nHopefully xe2 x80 xa6
2019-11-17T21:26:53.000Z,b'EINDE VAN DE WEEK TWEET: \n\nRode week in #Crypto! Goed zou zijn al #bitcoin boven de $8.550 sluit. Volgende support\xe2\x80\xa6 https://t.co/DwUJobPErk',EINDE VAN DE WEEK TWEET n nRode week in Crypto Goed zou zijn al itcoin oven de 8 550 sluit Volgende support xe2 x80 xa6
2019-11-17T21:26:55.000Z,"b'#PHP #Developer - Vargo Recruitment LTD ( Newport, United Kingdom )  - [ \\xe2\\x9e\\xa1 https://t.co/GRBmFp7I0f ] #AI #AiJobs\\xe2\\x80\\xa6 https://t.co/GqdUj9kNFk'",PHP Developer Vargo Recruitment LTD Newport United Kingdom xe2 x9e xa1 AI AiJos xe2 x80 xa6
2019-11-17T21:27:16.000Z,"b'Senior #PHP #Developer - Sharpe Recruitment ( Durham, United Kingdom )  - [ \\xe2\\x9e\\xa1 https://t.co/jgCeBQ7zo2 ] #AI #AiJobs\\xe2\\x80\\xa6 https://t.co/CLPNNcPFAn'",Senior PHP Developer Sharpe Recruitment Durham United Kingdom xe2 x9e xa1 AI AiJos xe2 x80 xa6
2019-11-17T21:27:32.000Z,"b'Crypto Derivatives: A Corner of the Market or the Market Itself? Emmanuel Goh, CEO of https://t.co/i9ziJxnHPV, look\\xe2\\x80\\xa6 https://t.co/kRfy75hy7M'",Crypto Derivatives A Corner of the Market or the Market Itself Emmanuel Goh CEO of look xe2 x80 xa6
2019-11-17T21:27:37.000Z,"b'Web #Developer - #PHP, Ecommerce, Sys Admin - Applause IT Ltd ( Rugby, UK )  - [ \\xf0\\x9f\\x93\\x8b More Info\\xe2\\x80\\xa6 https://t.co/RU8ZRpnG4z'",We Developer PHP Ecommerce Sys Admin Applause IT Ltd Rugy UK xf0 x9f x93 x8 More Info xe2 x80 xa6
2019-11-17T21:27:51.000Z,b'1 #satoshi =        0.00015 $AZN \xf0\x9f\x87\xa6\xf0\x9f\x87\xbf\n0.00949 $ALL \xf0\x9f\x87\xa6\xf0\x9f\x87\xb1   0.00150 $MDL \xf0\x9f\x87\xb2\xf0\x9f\x87\xa9\n0.00125 $EEK \xf0\x9f\x87\xaa\xf0\x9f\x87\xaa   0.00049 $TRY \xf0\x9f\x87\xb9\xf0\x9f\x87\xb7\n0.00007\xe2\x80\xa6 https://t.co/MPZBjPMWlj',1 satoshi 0 00015 AZN xf0 x9f x87 xa6 xf0 x9f x87 xf n0 00949 ALL xf0 x9f x87 xa6 xf0 x9f x87 x1 0 00150 MDL xf0 x9f x87 x2 xf0 x9f x87 xa9 n0 00125 EEK xf0 x9f x87 xaa xf0 x9f x87 xaa 0 00049 TRY xf0 x9f x87 x9 xf0 x9f x87 x7 n0 00007 xe2 x80 xa6
2019-11-17T21:28:08.000Z,b'My reaction when I get #liquidated  \n\n#bitcoin #crypto #altcoins #trading @loomdart\n\nhttps://t.co/96YkultMTI',My reaction when I get liquidated n n itcoin crypto altcoins trading n
2019-11-17T21:28:18.000Z,"b'#PHP #Developer - Damage ( Doncaster, United Kingdom )  - [ \\xf0\\x9f\\x93\\x8b More Info  https://t.co/CazTeZR5BD ] #AI #AiJobs\\xe2\\x80\\xa6 https://t.co/CmTSkjTwU4'",PHP Developer Damage Doncaster United Kingdom xf0 x9f x93 x8 More Info AI AiJos xe2 x80 xa6
2019-11-17T21:28:23.000Z,"b'Hey you can get much of benefit with support this payment project guys, this payment project have technology blockc\\xe2\\x80\\xa6 https://t.co/ULjU9v6NWo'",Hey you can get much of enefit with support this payment project guys this payment project have technology lockc xe2 x80 xa6
2019-11-17T21:29:02.000Z,"b'Markets go down, NOW its Buytime\\xf0\\x9f\\x92\\xb5\\xf0\\x9f\\x92\\xb8\\xf0\\x9f\\x93\\x88 Pic by  #barcelona #barcelonacity #spanien #spain #iphonex #iphone #buytime\\xe2\\x80\\xa6 https://t.co/lkxwl7Wb26'",Markets go down NOW its Buytime xf0 x9f x92 x5 xf0 x9f x92 x8 xf0 x9f x93 x88 Pic y arcelona arcelonacity spanien spain iphonex iphone uytime xe2 x80 xa6
2019-11-17T21:29:13.000Z,"b'\\xe4\\xb8\\x8a\\xe6\\x98\\x87\\xe7\\x9b\\xb8\\xe5\\xa0\\xb4(\\xe9\\x95\\xb7\\xe3\\x81\\x84\\xe8\\xb6\\xb3\\xe3\\x81\\xa7)\\xe3\\x81\\xa7\\xe3\\x81\\xaf\\xe8\\xb2\\xb7\\xe3\\x81\\x84\\xe3\\x83\\x91\\xe3\\x82\\xbf\\xe3\\x83\\xbc\\xe3\\x83\\xb3\\xe3\\x81\\xa0\\xe3\\x81\\x91\\xe6\\x8e\\xa2\\xe3\\x81\\x9b #fx,#bitcoin'",xe4 x8 x8a xe6 x98 x87 xe7 x9 x8 xe5 xa0 x4 xe9 x95 x7 xe3 x81 x84 xe8 x6 x3 xe3 x81 xa7 xe3 x81 xa7 xe3 x81 xaf xe8 x2 x7 xe3 x81 x84 xe3 x83 x91 xe3 x82 xf xe3 x83 xc xe3 x83 x3 xe3 x81 xa0 xe3 x81 x91 xe6 x8e xa2 xe3 x81 x9 fx itcoin
2019-11-17T21:29:18.000Z,b'#BTC #Bitcoin #BTC https://t.co/Rma90vZDSb',BTC Bitcoin BTC
2019-11-17T21:29:48.000Z,"\"b\"\"New to #BITCOIN",New to BITCOIN
2019-11-17T21:29:51.000Z,b'#BTC #Bitcoin $BTC https://t.co/Lxg6Xcbk41',BTC Bitcoin BTC
2019-11-17T21:29:51.000Z,b'I lost everything by hacking. But I believe in a small possibility.\n\n#BTC #Bitcoin #Cryptocurrency #XRP #DGD #ADA#B\xe2\x80\xa6 https://t.co/VGRU0wk6lL',I lost everything y hacking But I elieve in a small possiility n n BTC Bitcoin Cryptocurrency XRP DGD ADA B xe2 x80 xa6
2019-11-17T21:30:04.000Z,b'One Bitcoin now worth $8530.40@bitstamp. High $8631.600. Low $8375.000. Market Cap $154.002 Billion #bitcoin',One Bitcoin now worth 8530 40 High 8631 600 Low 8375 000 Market Cap 154 002 Billion itcoin
2019-11-17T21:30:04.000Z,b'One Bitcoin now worth $8545.782. Market Cap $154.279 Billion. Based on #coindesk BPI #bitcoin',One Bitcoin now worth 8545 782 Market Cap 154 279 Billion Based on coindesk BPI itcoin
2019-11-17T21:30:05.000Z,b'2019/11/18 06:30\n\nBTC 929770.5\xe5\x86\x86\nETH 20097.2\xe5\x86\x86\nETC 506.2\xe5\x86\x86\nBCH 29180.8\xe5\x86\x86\nXRP 28.8\xe5\x86\x86\nXEM 4.5\xe5\x86\x86\nLSK 85.4\xe5\x86\x86\nMONA 115.5\xe5\x86\x86\xe2\x80\xa6 https://t.co/GqjZ8vODDO',2019 11 18 06 30 n nBTC 929770 5 xe5 x86 x86 nETH 20097 2 xe5 x86 x86 nETC 506 2 xe5 x86 x86 nBCH 29180 8 xe5 x86 x86 nXRP 28 8 xe5 x86 x86 nXEM 4 5 xe5 x86 x86 nLSK 85 4 xe5 x86 x86 nMONA 115 5 xe5 x86 x86 xe2 x80 xa6
2019-11-17T21:30:06.000Z,b'What he would be wishing now? \xf0\x9f\x98\x82\n\n\xf0\x9f\x91\x89 https://t.co/JVL0p5pSCw \xf0\x9f\x91\x80\n\nCrypto Derivatives with the Best Perpetual Contracts\xe2\x80\xa6 https://t.co/xoonQmZlct',What he would e wishing now xf0 x9f x98 x82 n n xf0 x9f x91 x89 xf0 x9f x91 x80 n nCrypto Derivatives with the Best Perpetual Contracts xe2 x80 xa6
2019-11-17T21:30:06.000Z,"b'Top 5 #cryptocurrencies \\n Alert Time: 2019-11-18 00:30:06\\n#Bitcoin: $8,682.034\\n#Ethereum: $187.172\\n#XRP: $0.269\\xe2\\x80\\xa6 https://t.co/my2lKXcgBP'",Top 5 cryptocurrencies n Alert Time 2019 11 18 00 30 06 n Bitcoin 8 682 034 n Ethereum 187 172 n XRP 0 269 xe2 x80 xa6
2019-11-17T21:30:08.000Z,"b'#BTC: \\xe2\\x82\\xba49.068,00\\n#ETH: \\xe2\\x82\\xba1.059,82\\n#LTC:  \\xe2\\x82\\xba342,06\\n#XRP: \\xe2\\x82\\xba1,52\\n\\n18.11.19 - 00:30\\n\\n#Bitcoin #Litecoin #Ethereum #Ripple\\xe2\\x80\\xa6 https://t.co/mCIGnwQ74b'",BTC xe2 x82 xa49 068 00 n ETH xe2 x82 xa1 059 82 n LTC xe2 x82 xa342 06 n XRP xe2 x82 xa1 52 n n18 11 19 00 30 n n Bitcoin Litecoin Ethereum Ripple xe2 x80 xa6
2019-11-17T21:30:08.000Z,b'\xe2\x80\x98Extremely Dangerous\xe2\x80\x99 \xe2\x80\x94 Bobby Lee Regrets Backing Bitcoin SegWit2x #bitcoin #cryptocurrency #litecoin\xe2\x80\xa6 https://t.co/AWCKXpG96m',xe2 x80 x98Extremely Dangerous xe2 x80 x99 xe2 x80 x94 Boy Lee Regrets Backing Bitcoin SegWit2x itcoin cryptocurrency litecoin xe2 x80 xa6
2019-11-17T21:30:09.000Z,"\"b\"\"More than half of the world's population is unbanked. #Amazon has ran out of areas to expand in the first world. Wh\\xe2\\x80\\xa6 https://t.co/ZNCBPQraCm\"\"\"",More than half of the world s population is unanked Amazon has ran out of areas to expand in the first world Wh xe2 x80 xa6
2019-11-17T21:30:10.000Z,"b'Nov 17, 2019 21:29:00 UTC | 8,545.80$ | 7,733.70\\xe2\\x82\\xac | 6,616.90\\xc2\\xa3 | #Bitcoin #BTC $BTC #crypto #financial #news https://t.co/eyKgeXVlMH'",Nov 17 2019 21 29 00 UTC 8 545 80 7 733 70 xe2 x82 xac 6 616 90 xc2 xa3 Bitcoin BTC BTC crypto financial news
2019-11-17T21:30:12.000Z,b'Confidentiality of information and security of transactions are very important. And maintaining our privacy is prot\xe2\x80\xa6 https://t.co/wciFcN5N1A',Confidentiality of information and security of transactions are very important And maintaining our privacy is prot xe2 x80 xa6
2019-11-17T21:30:15.000Z,"\"b\"\"Bitcoin's Upcoming Halving Exposes Long-Term Security Issues https://t.co/nDYpDkDZ4T #bitcoin\\xc2\\xa0#blockchain #btc\\xc2\\xa0\\xe2\\x80\\xa6 https://t.co/J1ibJlAnL0\"\"\"",Bitcoin s Upcoming Halving Exposes Long Term Security Issues itcoin xc2 xa0 lockchain tc xc2 xa0 xe2 x80 xa6
2019-11-17T21:30:15.000Z,"b'Hello humans, as of Sun Nov 17 15:30:14 CST 2019, current #cryptocoin prices:\\n#bitcoin is $8682.0336\\n#dash is $68.9\\xe2\\x80\\xa6 https://t.co/rndaXHKIeg'",Hello humans as of Sun Nov 17 15 30 14 CST 2019 current cryptocoin prices n itcoin is 8682 0336 n dash is 68 9 xe2 x80 xa6
2019-11-17T21:30:23.000Z,"b'Buy Bitcoin With PayPal! Also with CC, paysafecard, Skrill, OKPAY https://t.co/Qdq3dxXr95 #btc #bitcoin 16 https://t.co/kEyMt6NgfZ'",Buy Bitcoin With PayPal Also with CC paysafecard Skrill OKPAY tc itcoin 16
2019-11-17T21:30:26.000Z,"\"b\"\"It's beginning to look a lot like summer! \\xf0\\x9f\\x98\\x8e\\xf0\\x9f\\x98\\x8e\\xf0\\x9f\\x98\\x8e https://t.co/gykVY7q789 #Bitcoin #GameofThrones #Crypto #Ethereum\\xe2\\x80\\xa6 https://t.co/29rPJeHapA\"\"\"",It s eginning to look a lot like summer xf0 x9f x98 x8e xf0 x9f x98 x8e xf0 x9f x98 x8e Bitcoin GameofThrones Crypto Ethereum xe2 x80 xa6
2019-11-17T21:30:32.000Z,"b'El precio del Bitcoin: 7,738.76\\xe2\\x82\\xac #bitcoin #elpreciodelbtc #criptomonedas'",El precio del Bitcoin 7 738 76 xe2 x82 xac itcoin elpreciodeltc criptomonedas
2019-11-17T21:30:33.000Z,b'@juthica #bitcoin will always be a trade able asset but in time most of that trading will be as an exchange for goo\xe2\x80\xa6 https://t.co/rxE6X2xEtl',itcoin will always e a trade ale asset ut in time most of that trading will e as an exchange for goo xe2 x80 xa6
2019-11-17T21:30:50.000Z,b'##Bitcoin May Be Forming Long-Term Bottom as Bulls Fight Back: After an extended period of trading\xe2\x80\xa6 https://t.co/46kdaBBcSG #Blockchain',Bitcoin May Be Forming Long Term Bottom as Bulls Fight Back After an extended period of trading xe2 x80 xa6 Blockchain
2019-11-17T21:30:59.000Z,b'First #SmartContracts deployed! Many more to come! $strat #strat #hackathon #csharp #blockchain #bitcoin $btc $eth\xe2\x80\xa6 https://t.co/UjItz3Jm0K',First SmartContracts deployed Many more to come strat strat hackathon csharp lockchain itcoin tc eth xe2 x80 xa6
2019-11-17T21:31:06.000Z,b'Free 300 GH Cloud Mining at Gominer Instant Witdraw https://t.co/EbGyTlzbbF #gominer #hashflare #genesismining #bitcoin',Free 300 GH Cloud Mining at Gominer Instant Witdraw gominer hashflare genesismining itcoin
2019-11-17T21:31:14.000Z,b'An Army of Bitcoin Devs Is Battle-Testing Upgrades to Privacy and Scaling\n#Bitcoin #Crypto #Cryptocurrency\xe2\x80\xa6 https://t.co/0CO0nIAuwh',An Army of Bitcoin Devs Is Battle Testing Upgrades to Privacy and Scaling n Bitcoin Crypto Cryptocurrency xe2 x80 xa6
